grupo_parlamentario,congresista,votacion
APP,"ACUÑA PERALTA, MARÍA GRIMANEZA",SI
APP,"ACUÑA PERALTA, SEGUNDO HÉCTOR",AUSENTE
FP,"AGUINAGA RECUENCO, ALEJANDRO AURELIO",ABSTENCION
PL,"AGÜERO GUTIÉRREZ, MARÍA ANTONIETA",SI
SP,"ALCARRAZ AGUERO, YOREL KIRA",SIN_RESPONDER
FP,"ALEGRÍA GARCÍA, ARTURO",ABSTENCION
AP,"ALVA PRIETO, MARÍA DEL CARMEN",SIN_RESPONDER
AP,"ALVA ROJAS, CARLOS ENRIQUE",ABSTENCION
AP-PIS,"AMURUZ DULANTO, YESSICA ROSSELLI",NO
PP,"ANDERSON RAMÍREZ, CARLOS ANTONIO",NO
AP,"ARAGÓN CARREÑO, LUIS ÁNGEL",NO
AP,"ARRIOLA TUEROS, JOSÉ ALBERTO",NO
SP,"AZURÍN LOAYZA, ALFREDO",NO
PL,"BALCÁZAR ZELADA, JOSÉ MARÍA",NO
FP,"BARBARÁN REYES, ROSANGELLA ANDREA",ABSTENCION
AP-PIS,"BAZÁN CALDERÓN, DIEGO ALONSO FERNANDO",NO
JP,"BAZÁN NARRO, SIGRID TESORO",NO
PL,"BELLIDO UGARTE, GUIDO",SI
PD,"BERMEJO ROJAS, GUILLERMO",AUSENTE
AP-PIS,"BURGOS OLIVEROS, JUAN BARTOLOMÉ",NO
FP,"BUSTAMANTE DONAYRE, ERNESTO",ABSTENCION
PP,"CALLE LOBATÓN, DIGNA",NO
APP,"CAMONES SORIANO, LADY MERCEDES",SI
FP,"CASTILLO RIVAS, EDUARDO ENRIQUE",ABSTENCION
AP-PIS,"CAVERO ALVA, ALEJANDRO ENRIQUE",ABSTENCION
PL,"CERRÓN ROJAS, WALDEMAR JOSÉ",SI
FP,"CHACÓN TRUJILLO, NILZA MERLY",ABSTENCION
APP,"CHIABRA LEÓN, ROBERTO ENRIQUE",SI
AP-PIS,"CHIRINOS VENEGAS, PATRICIA ROSA",NO
PD,"CHÁVEZ CHINO, BETSSY BETZABET",LICENCIA_OFICIAL
RP,"CICCIA VÁSQUEZ, MIGUEL ANGEL",SI
PL,"COAYLA JUÁREZ, JORGE SAMUEL",NO
FP,"CORDERO JON TAY, LUIS GUSTAVO",ABSTENCION
FP,"CORDERO JON TAY, MARÍA DEL PILAR",ABSTENCION
JP,"CORTEZ AGUIRRE, ISABEL",NO
PL,"CRUZ MAMANI, FLAVIO",SI
RP,"CUETO ASERVI, JOSÉ ERNESTO",SI
PL,"CUTIPA CCAMA, VÍCTOR RAÚL",NO
AP-PIS,"CÓRDOVA LOBATÓN, MARÍA JESSICA",ABSTENCION
AP,"DOROTEO CARBAJO, RAÚL FELIPE",NO
PL,"DÁVILA ATANACIO, PASIÓN NEOMIAS",SI
APP,"DÍAZ MONAGO, FREDDY RONALD",AUSENTE
APP,"ECHAÍZ DE NÚÑEZ IZAGA, GLADYS MARGOT",AUSENTE
PD,"ECHEVERRÍA RODRÍGUEZ, HAMLET",NO
SP,"ELERA GARCÍA, WILMAR ALBERTO",NO
PP,"ELÍAS ÁVALOS, JOSÉ LUIS",AUSENTE
AP,"ESPINOZA VARGAS, JHAEC DARWIN",LICENCIA_POR_ENFERMEDAD
AP,"FLORES ANCACHI, JORGE LUIS",NO
PL,"FLORES RAMÍREZ, ALEX RANDU",NO
FP,"FLORES RUÍZ, VÍCTOR SEFERINO",ABSTENCION
APP,"GARCÍA CORREA, IDELSO MANUEL",SI
PL,"GONZA CASTILLO, AMERICO",SI
AP-PIS,"GONZALES DELGADO, DIANA CAROLINA",ABSTENCION
FP,"GUERRA GARCÍA, CAMPOS HERNANDO",ABSTENCION
PL,"GUTIÉRREZ TICONA, PAUL SILVIO",SI
RP,"HERRERA MEDINA, NOELIA ROSSVITH",SI
FP,"HUAMÁN CORONADO, RAÚL",ABSTENCION
FP,"INFANTES CASTAÑEDA, MERY ELIANA",ABSTENCION
SP,"JERI ORÉ, JOSÉ ENRIQUE",NO
FP,"JIMÉNEZ HEREDIA, DAVID JULIO",AUSENTE
APP,"JULON IRIGOIN, ELVA EDHIT",SI
APP,"JUÁREZ CALLE, HEIDY LISBETH",SI
FP,"JUÁREZ GALLEGOS, CARMEN PATRICIA",ABSTENCION
RP,"JÁUREGUI MARTÍNEZ DE AGUAYO, MARÍA DE LOS MILAGROS JACKELINE",SI
PD,"KAMICHE MORANTE, LUIS ROBERTO",LICENCIA_POR_ENFERMEDAD
PD,"LIMACHI QUISPE, NIEVES ESMERALDA",NO
FP,"LIZARZABURU LIZARZABURU, JUAN CARLOS MARTIN",AUSENTE
PP,"LUNA GÁLVEZ, JOSÉ LEÓN",NO
JP,"LUQUE IBARRA, RUTH",NO
FP,"LÓPEZ MORALES, JENY LUZ",ABSTENCION
AP,"LÓPEZ UREÑA, ILICH FREDY",NO
PL,"MARTICORENA MENDOZA, JORGE ALFONSO",AUSENTE
AP,"MARTÍNEZ TALAVERA, PEDRO EDWIN",NO
PL,"MEDINA HERMOSILLA, ELIZABETH SARA",SI
RP,"MEDINA MINAYA, ESDRAS RICARDO",SI
PL,"MONTALVO CUBAS, SEGUNDO TORIBIO",AUSENTE
AP,"MONTEZA FACHO, SILVIA MARÍA",NO
RP,"MONTOYA MANRIQUE, JORGE CARLOS",SI
FP,"MORANTE FIGARI, JORGE ALBERTO",ABSTENCION
AP,"MORI CELIS, JUAN CARLOS",NO
FP,"MOYANO DELGADO, MARTHA LUPE",ABSTENCION
RP,"MUÑANTE BARRIOS, ALEJANDRO",SI
NA,"MÁLAGA TRILLO, GEORGE EDWARD",NO
FP,"OBANDO MORGAN, AURISTELA ANA",ABSTENCION
FP,"OLIVOS MARTÍNEZ, VIVIAN",ABSTENCION
NA,"PABLO MEDINA, FLOR AIDEE",NO
RP,"PADILLA ROMERO, JAVIER ROMMEL",AUSENTE
PL,"PALACIOS HUÁMAN, MARGOT",SI
PL,"PAREDES CASTRO, FRANCIS JHASMINA",AUSENTE
AP,"PAREDES FONSECA, KAROL IVETT",NO
PL,"PAREDES GONZALES, ALEX ANTONIO",AUSENTE
NA,"PAREDES PIQUÉ, SUSEL ANA MARÍA",AUSENTE
PL,"PARIONA SINCHE, ALFREDO",SI
APP,"PICÓN QUEDO, LUIS RAÚL",SIN_RESPONDER
PL,"PORTALATINO ÁVALOS, KELLY ROXANA",AUSENTE
AP,"PORTERO LÓPEZ, HILDA MARLENY",NO
PL,"QUIROZ BARBOZA, SEGUNDO TEODOMIRO",NO
PL,"QUISPE MAMANI, WILSON RUSBEL",SI
PL,"QUITO SARMIENTO, BERNARDO JAIME",SI
FP,"RAMÍREZ GARCÍA, TANIA ESTEFANY",ABSTENCION
FP,"REVILLA VILLANUEVA, CÉSAR MANUEL",ABSTENCION
PL,"REYES CAM, ABEL AUGUSTO",LICENCIA_OFICIAL
JP,"REYMUNDO MERCADO, EDGARD CORNELIO",NO
PL,"RIVAS CHACARA, JANET MILAGROS",NO
PL,"ROBLES ARAUJO, SILVANA EMPERATRIZ",SI
APP,"RUÍZ RODRÍGUEZ, MAGALY ROSMERY",AUSENTE
SP,"SAAVEDRA CASTERNOQUE, HITLER",NO
APP,"SALHUANA CAVIDES, EDUARDO",SI
AP,"SOTO PALACIOS, WILSON",NO
APP,"SOTO REYES, ALEJANDRO",SI
JP,"SÁNCHEZ PALOMINO, ROBERTO HELBERT",NO
PL,"TACURI VALDIVIA, GERMÁN ADOLFO",SI
PL,"TAIPE CORONADO, MARÍA ELIZABETH",SIN_RESPONDER
PL,"TELLO MONTES, NIVARDO EDGAR",SI
APP,"TORRES SALINAS, ROSIO",SI
APP,"TRIGOZO REÁTEGUI, CHERYL",SI
AP-PIS,"TUDELA GUTIÉRREZ, ADRIANA JOSEFINA",NO
PL,"UGARTE MAMANI, JHAKELINE KATY",NO
PD,"VALER PINTO, HÉCTOR",NO
PL,"VARAS MELÉNDEZ, ELÍAS MARCIAL",NO
FP,"VENTURA ANGEL, HÉCTOR JOSÉ",ABSTENCION
AP,"VERGARA MENDOZA, ELVIS HERNÁN",NO
PL,"VÁSQUEZ VELA, LUCINDA",AUSENTE
AP-PIS,"WILLIAMS ZAPATA, JOSÉ DANIEL",ABSTENCION
PP,"WONG PUJADA, ENRIQUE",NO
AP-PIS,"YARROW LUMBRERAS, NORMA MARTINA",ABSTENCION
PL,"ZEA CHOQUECHAMBI, OSCAR",LICENCIA_OFICIAL
RP,"ZEBALLOS APONTE, JORGE ARTURO",SI
PD,"ZEBALLOS MADARIAGA, CARLOS JAVIER",NO
FP,"ZETA CHUNGA, CRUZ MARÍA",ABSTENCION