grupo_parlamentario,congresista,votacion
APP,"ACUÑA PERALTA, MARÍA GRIMANEZA",SI
NA,"ACUÑA PERALTA, SEGUNDO HÉCTOR",ABSTENCION
FP,"AGUINAGA RECUENCO, ALEJANDRO AURELIO",SI
PL,"AGÜERO GUTIÉRREZ, MARÍA ANTONIETA",NO
PP,"ALCARRAZ AGUERO, YOREL KIRA",SI
FP,"ALEGRÍA GARCÍA, ARTURO",SI
AP,"ALVA PRIETO, MARÍA DEL CARMEN",NO
NA,"ALVA ROJAS, CARLOS ENRIQUE",NO
AP-PIS,"AMURUZ DULANTO, YESSICA ROSSELLI",LICENCIA_POR_ENFERMEDAD
NA,"ANDERSON RAMÍREZ, CARLOS ANTONIO",SI
AP,"ARAGÓN CARREÑO, LUIS ÁNGEL",NO
AP,"ARRIOLA TUEROS, JOSÉ ALBERTO",NO
SP,"AZURÍN LOAYZA, ALFREDO",NO
PB,"BALCÁZAR ZELADA, JOSÉ MARÍA",SI
FP,"BARBARÁN REYES, ROSANGELLA ANDREA",SI
AP-PIS,"BAZÁN CALDERÓN, DIEGO ALONSO FERNANDO",AUSENTE
CD-JPP,"BAZÁN NARRO, SIGRID TESORO",NO
PB,"BELLIDO UGARTE, GUIDO",NO
PD,"BERMEJO ROJAS, GUILLERMO",NO
NA,"BURGOS OLIVEROS, JUAN BARTOLOMÉ",NO
FP,"BUSTAMANTE DONAYRE, ERNESTO",SI
PP,"CALLE LOBATÓN, DIGNA",NO
APP,"CAMONES SORIANO, LADY MERCEDES",SI
FP,"CASTILLO RIVAS, EDUARDO ENRIQUE",SI
AP-PIS,"CAVERO ALVA, ALEJANDRO ENRIQUE",SIN_RESPONDER
PL,"CERRÓN ROJAS, WALDEMAR JOSÉ",NO
FP,"CHACÓN TRUJILLO, NILZA MERLY",SI
APP,"CHIABRA LEÓN, ROBERTO ENRIQUE",SI
AP-PIS,"CHIRINOS VENEGAS, PATRICIA ROSA",NO
PD,"CHÁVEZ CHINO, BETSSY BETZABET",AUSENTE
RP,"CICCIA VÁSQUEZ, MIGUEL ANGEL",SI
PB,"COAYLA JUÁREZ, JORGE SAMUEL",NO
FP,"CORDERO JON TAY, LUIS GUSTAVO",SI
FP,"CORDERO JON TAY, MARÍA DEL PILAR",SI
CD-JPP,"CORTEZ AGUIRRE, ISABEL",AUSENTE
PL,"CRUZ MAMANI, FLAVIO",NO
RP,"CUETO ASERVI, JOSÉ ERNESTO",SI
PB,"CUTIPA CCAMA, VÍCTOR RAÚL",NO
AP-PIS,"CÓRDOVA LOBATÓN, MARÍA JESSICA",SI
AP,"DOROTEO CARBAJO, RAÚL FELIPE",NO
BM,"DÁVILA ATANACIO, PASIÓN NEOMIAS",SUSPENDIDO
RP,"ECHAÍZ DE NÚÑEZ IZAGA, GLADYS MARGOT",SI
PD,"ECHEVERRÍA RODRÍGUEZ, HAMLET",NO
SP,"ELERA GARCÍA, WILMAR ALBERTO",AUSENTE
PP,"ELÍAS ÁVALOS, JOSÉ LUIS",SI
AP,"ESPINOZA VARGAS, JHAEC DARWIN",NO
AP,"FLORES ANCACHI, JORGE LUIS",NO
PL,"FLORES RAMÍREZ, ALEX RANDU",NO
FP,"FLORES RUÍZ, VÍCTOR SEFERINO",SI
APP,"GARCÍA CORREA, IDELSO MANUEL",SI
PL,"GONZA CASTILLO, AMERICO",NO
AP-PIS,"GONZALES DELGADO, DIANA CAROLINA",SI
FP,"GUERRA GARCÍA, CAMPOS HERNANDO",SI
BM,"GUTIÉRREZ TICONA, PAUL SILVIO",NO
RP,"HERRERA MEDINA, NOELIA ROSSVITH",LICENCIA_POR_ENFERMEDAD
FP,"HUAMÁN CORONADO, RAÚL",SI
FP,"INFANTES CASTAÑEDA, MERY ELIANA",SI
SP,"JERI ORÉ, JOSÉ ENRIQUE",NO
FP,"JIMÉNEZ HEREDIA, DAVID JULIO",SI
APP,"JULON IRIGOIN, ELVA EDHIT",SI
NA,"JUÁREZ CALLE, HEIDY LISBETH",LICENCIA_OFICIAL
FP,"JUÁREZ GALLEGOS, CARMEN PATRICIA",SI
RP,"JÁUREGUI MARTÍNEZ DE AGUAYO, MARÍA DE LOS MILAGROS JACKELINE",SI
PD,"KAMICHE MORANTE, LUIS ROBERTO",NO
PD,"LIMACHI QUISPE, NIEVES ESMERALDA",NO
FP,"LIZARZABURU LIZARZABURU, JUAN CARLOS MARTIN",SI
PP,"LUNA GÁLVEZ, JOSÉ LEÓN",LICENCIA_POR_ENFERMEDAD
CD-JPP,"LUQUE IBARRA, RUTH",NO
FP,"LÓPEZ MORALES, JENY LUZ",SI
AP,"LÓPEZ UREÑA, ILICH FREDY",NO
PB,"MARTICORENA MENDOZA, JORGE ALFONSO",NO
AP,"MARTÍNEZ TALAVERA, PEDRO EDWIN",NO
BM,"MEDINA HERMOSILLA, ELIZABETH SARA",NO
SP,"MEDINA MINAYA, ESDRAS RICARDO",NO
PL,"MONTALVO CUBAS, SEGUNDO TORIBIO",AUSENTE
AP,"MONTEZA FACHO, SILVIA MARÍA",NO
RP,"MONTOYA MANRIQUE, JORGE CARLOS",SI
FP,"MORANTE FIGARI, JORGE ALBERTO",SI
AP,"MORI CELIS, JUAN CARLOS",LICENCIA_OFICIAL
FP,"MOYANO DELGADO, MARTHA LUPE",SI
RP,"MUÑANTE BARRIOS, ALEJANDRO",SI
NA,"MÁLAGA TRILLO, GEORGE EDWARD",LICENCIA_OFICIAL
FP,"OBANDO MORGAN, AURISTELA ANA",SI
FP,"OLIVOS MARTÍNEZ, VIVIAN",SI
NA,"PABLO MEDINA, FLOR AIDEE",NO
RP,"PADILLA ROMERO, JAVIER ROMMEL",SI
PL,"PALACIOS HUÁMAN, MARGOT",NO
BM,"PAREDES CASTRO, FRANCIS JHASMINA",NO
AP,"PAREDES FONSECA, KAROL IVETT",NO
BM,"PAREDES GONZALES, ALEX ANTONIO",NO
NA,"PAREDES PIQUÉ, SUSEL ANA MARÍA",SI
PL,"PARIONA SINCHE, ALFREDO",NO
NA,"PICÓN QUEDO, LUIS RAÚL",NO
PL,"PORTALATINO ÁVALOS, KELLY ROXANA",ABSTENCION
AP,"PORTERO LÓPEZ, HILDA MARLENY",NO
BM,"QUIROZ BARBOZA, SEGUNDO TEODOMIRO",NO
PL,"QUISPE MAMANI, WILSON RUSBEL",NO
PL,"QUITO SARMIENTO, BERNARDO JAIME",AUSENTE
FP,"RAMÍREZ GARCÍA, TANIA ESTEFANY",SI
FP,"REVILLA VILLANUEVA, CÉSAR MANUEL",SI
PL,"REYES CAM, ABEL AUGUSTO",AUSENTE
CD-JPP,"REYMUNDO MERCADO, EDGARD CORNELIO",NO
PL,"RIVAS CHACARA, JANET MILAGROS",NO
PL,"ROBLES ARAUJO, SILVANA EMPERATRIZ",NO
APP,"RUÍZ RODRÍGUEZ, MAGALY ROSMERY",NO
SP,"SAAVEDRA CASTERNOQUE, HITLER",NO
APP,"SALHUANA CAVIDES, EDUARDO",SI
AP,"SOTO PALACIOS, WILSON",NO
APP,"SOTO REYES, ALEJANDRO",SI
CD-JPP,"SÁNCHEZ PALOMINO, ROBERTO HELBERT",NO
BM,"TACURI VALDIVIA, GERMÁN ADOLFO",NO
PL,"TAIPE CORONADO, MARÍA ELIZABETH",NO
BM,"TELLO MONTES, NIVARDO EDGAR",AUSENTE
APP,"TORRES SALINAS, ROSIO",SI
APP,"TRIGOZO REÁTEGUI, CHERYL",SI
AP-PIS,"TUDELA GUTIÉRREZ, ADRIANA JOSEFINA",NO
BM,"UGARTE MAMANI, JHAKELINE KATY",NO
SP,"VALER PINTO, HÉCTOR",NO
PB,"VARAS MELÉNDEZ, ELÍAS MARCIAL",NO
FP,"VENTURA ANGEL, HÉCTOR JOSÉ",SI
AP,"VERGARA MENDOZA, ELVIS HERNÁN",ABSTENCION
BM,"VÁSQUEZ VELA, LUCINDA",NO
AP-PIS,"WILLIAMS ZAPATA, JOSÉ DANIEL",SIN_RESPONDER
PP,"WONG PUJADA, ENRIQUE",NO
AP-PIS,"YARROW LUMBRERAS, NORMA MARTINA",SI
NA,"ZEA CHOQUECHAMBI, OSCAR",SI
RP,"ZEBALLOS APONTE, JORGE ARTURO",SI
PP,"ZEBALLOS MADARIAGA, CARLOS JAVIER",NO
FP,"ZETA CHUNGA, CRUZ MARÍA",SI