grupo_parlamentario,congresista,votacion
APP,"ACUÑA PERALTA, MARÍA GRIMANEZA",NO
NA,"ACUÑA PERALTA, SEGUNDO HÉCTOR",NO
FP,"AGUINAGA RECUENCO, ALEJANDRO AURELIO",SI
PL,"AGÜERO GUTIÉRREZ, MARÍA ANTONIETA",NO
PP,"ALCARRAZ AGUERO, YOREL KIRA",NO
FP,"ALEGRÍA GARCÍA, ARTURO",SI
NA,"ALVA PRIETO, MARÍA DEL CARMEN",SI
NA,"ALVA ROJAS, CARLOS ENRIQUE",SI
AP-PIS,"AMURUZ DULANTO, YESSICA ROSSELLI",AUSENTE
NA,"ANDERSON RAMÍREZ, CARLOS ANTONIO",NO
AP,"ARAGÓN CARREÑO, LUIS ÁNGEL",NO
NA,"ARRIOLA TUEROS, JOSÉ ALBERTO",SI
SP,"AZURÍN LOAYZA, ALFREDO",SI
PB,"BALCÁZAR ZELADA, JOSÉ MARÍA",ABSTENCION
FP,"BARBARÁN REYES, ROSANGELLA ANDREA",SI
AP-PIS,"BAZÁN CALDERÓN, DIEGO ALONSO FERNANDO",SI
CD-JPP,"BAZÁN NARRO, SIGRID TESORO",NO
PB,"BELLIDO UGARTE, GUIDO",ABSTENCION
CD-JPP,"BERMEJO ROJAS, GUILLERMO",NO
PP,"BURGOS OLIVEROS, JUAN BARTOLOMÉ",NO
FP,"BUSTAMANTE DONAYRE, ERNESTO",SI
PP,"CALLE LOBATÓN, DIGNA",SI
APP,"CAMONES SORIANO, LADY MERCEDES",NO
FP,"CASTILLO RIVAS, EDUARDO ENRIQUE",SI
AP-PIS,"CAVERO ALVA, ALEJANDRO ENRIQUE",SI
PL,"CERRÓN ROJAS, WALDEMAR JOSÉ",NO
FP,"CHACÓN TRUJILLO, NILZA MERLY",SI
APP,"CHIABRA LEÓN, ROBERTO ENRIQUE",NO
AP-PIS,"CHIRINOS VENEGAS, PATRICIA ROSA",SI
RP,"CICCIA VÁSQUEZ, MIGUEL ANGEL",NO
PB,"COAYLA JUÁREZ, JORGE SAMUEL",ABSTENCION
AP,"CORDERO JON TAY, LUIS GUSTAVO",NO
NA,"CORDERO JON TAY, MARÍA DEL PILAR",SUSPENDIDO
CD-JPP,"CORTEZ AGUIRRE, ISABEL",NO
PL,"CRUZ MAMANI, FLAVIO",NO
RP,"CUETO ASERVI, JOSÉ ERNESTO",SI
CD-JPP,"CUTIPA CCAMA, VÍCTOR RAÚL",NO
AP-PIS,"CÓRDOVA LOBATÓN, MARÍA JESSICA",AUSENTE
AP,"DOROTEO CARBAJO, RAÚL FELIPE",SI
BM,"DÁVILA ATANACIO, PASIÓN NEOMIAS",NO
RP,"ECHAÍZ DE NÚÑEZ IZAGA, GLADYS MARGOT",SI
CD-JPP,"ECHEVERRÍA RODRÍGUEZ, HAMLET",NO
PP,"ELÍAS ÁVALOS, JOSÉ LUIS",SI
AP,"ESPINOZA VARGAS, JHAEC DARWIN",NO
AP,"FLORES ANCACHI, JORGE LUIS",NO
NA,"FLORES RAMÍREZ, ALEX RANDU",NO
FP,"FLORES RUÍZ, VÍCTOR SEFERINO",SI
APP,"GARCÍA CORREA, IDELSO MANUEL",NO
PL,"GONZA CASTILLO, AMERICO",NO
AP-PIS,"GONZALES DELGADO, DIANA CAROLINA",SI
BM,"GUTIÉRREZ TICONA, PAUL SILVIO",SI
APP,"HEIDINGER BALLESTEROS, NELCY",NO
RP,"HERRERA MEDINA, NOELIA ROSSVITH",SI
FP,"HUAMÁN CORONADO, RAÚL",SI
FP,"INFANTES CASTAÑEDA, MERY ELIANA",AUSENTE
SP,"JERI ORÉ, JOSÉ ENRIQUE",SI
FP,"JIMÉNEZ HEREDIA, DAVID JULIO",SI
APP,"JULON IRIGOIN, ELVA EDHIT",NO
PP,"JUÁREZ CALLE, HEIDY LISBETH",AUSENTE
FP,"JUÁREZ GALLEGOS, CARMEN PATRICIA",SI
RP,"JÁUREGUI MARTÍNEZ DE AGUAYO, MARÍA DE LOS MILAGROS JACKELINE",SI
CD-JPP,"KAMICHE MORANTE, LUIS ROBERTO",NO
CD-JPP,"LIMACHI QUISPE, NIEVES ESMERALDA",AUSENTE
FP,"LIZARZABURU LIZARZABURU, JUAN CARLOS MARTIN",AUSENTE
PP,"LUNA GÁLVEZ, JOSÉ LEÓN",SI
CD-JPP,"LUQUE IBARRA, RUTH",NO
FP,"LÓPEZ MORALES, JENY LUZ",SI
NA,"LÓPEZ UREÑA, ILICH FREDY",AUSENTE
PB,"MARTICORENA MENDOZA, JORGE ALFONSO",SI
NA,"MARTÍNEZ TALAVERA, PEDRO EDWIN",AUSENTE
BM,"MEDINA HERMOSILLA, ELIZABETH SARA",NO
NA,"MEDINA MINAYA, ESDRAS RICARDO",SI
PL,"MITA ALANOCA, ISAAC",NO
PL,"MONTALVO CUBAS, SEGUNDO TORIBIO",NO
NA,"MONTEZA FACHO, SILVIA MARÍA",SI
RP,"MONTOYA MANRIQUE, JORGE CARLOS",SI
FP,"MORANTE FIGARI, JORGE ALBERTO",SI
NA,"MORI CELIS, JUAN CARLOS",LICENCIA_POR_ENFERMEDAD
FP,"MOYANO DELGADO, MARTHA LUPE",SI
RP,"MUÑANTE BARRIOS, ALEJANDRO",SI
NA,"MÁLAGA TRILLO, GEORGE EDWARD",SI
FP,"OBANDO MORGAN, AURISTELA ANA",SI
FP,"OLIVOS MARTÍNEZ, VIVIAN",SI
NA,"PABLO MEDINA, FLOR AIDEE",AUSENTE
RP,"PADILLA ROMERO, JAVIER ROMMEL",AUSENTE
PL,"PALACIOS HUÁMAN, MARGOT",NO
PP,"PAREDES CASTRO, FRANCIS JHASMINA",NO
NA,"PAREDES FONSECA, KAROL IVETT",SI
BM,"PAREDES GONZALES, ALEX ANTONIO",NO
CD-JPP,"PAREDES PIQUÉ, SUSEL ANA MARÍA",NO
NA,"PARIONA SINCHE, ALFREDO",NO
SP,"PAZO NUNURA, JOSE BERNARDO",SI
PP,"PICÓN QUEDO, LUIS RAÚL",NO
PL,"PORTALATINO ÁVALOS, KELLY ROXANA",SI
AP,"PORTERO LÓPEZ, HILDA MARLENY",AUSENTE
BM,"QUIROZ BARBOZA, SEGUNDO TEODOMIRO",NO
PL,"QUISPE MAMANI, WILSON RUSBEL",NO
NA,"QUITO SARMIENTO, BERNARDO JAIME",NO
FP,"RAMÍREZ GARCÍA, TANIA ESTEFANY",SI
FP,"REVILLA VILLANUEVA, CÉSAR MANUEL",SI
PL,"REYES CAM, ABEL AUGUSTO",AUSENTE
CD-JPP,"REYMUNDO MERCADO, EDGARD CORNELIO",NO
PL,"RIVAS CHACARA, JANET MILAGROS",NO
NA,"ROBLES ARAUJO, SILVANA EMPERATRIZ",NO
FP,"ROSPIGLIOSI CAPURRO, FERNANDO MIGUEL",SI
APP,"RUÍZ RODRÍGUEZ, MAGALY ROSMERY",NO
SP,"SAAVEDRA CASTERNOQUE, HITLER",SI
APP,"SALHUANA CAVIDES, EDUARDO",NO
AP,"SOTO PALACIOS, WILSON",NO
APP,"SOTO REYES, ALEJANDRO",SIN_RESPONDER
CD-JPP,"SÁNCHEZ PALOMINO, ROBERTO HELBERT",NO
BM,"TACURI VALDIVIA, GERMÁN ADOLFO",NO
PL,"TAIPE CORONADO, MARÍA ELIZABETH",SIN_RESPONDER
BM,"TELLO MONTES, NIVARDO EDGAR",AUSENTE
APP,"TORRES SALINAS, ROSIO",NO
APP,"TRIGOZO REÁTEGUI, CHERYL",SI
AP-PIS,"TUDELA GUTIÉRREZ, ADRIANA JOSEFINA",AUSENTE
NA,"UGARTE MAMANI, JHAKELINE KATY",SI
SP,"VALER PINTO, HÉCTOR",SI
PB,"VARAS MELÉNDEZ, ELÍAS MARCIAL",AUSENTE
FP,"VENTURA ANGEL, HÉCTOR JOSÉ",SI
AP,"VERGARA MENDOZA, ELVIS HERNÁN",SI
BM,"VÁSQUEZ VELA, LUCINDA",NO
AP-PIS,"WILLIAMS ZAPATA, JOSÉ DANIEL",SI
PP,"WONG PUJADA, ENRIQUE",SI
AP-PIS,"YARROW LUMBRERAS, NORMA MARTINA",SI
BM,"ZEA CHOQUECHAMBI, OSCAR",NO
RP,"ZEBALLOS APONTE, JORGE ARTURO",SI
PP,"ZEBALLOS MADARIAGA, CARLOS JAVIER",SI
FP,"ZETA CHUNGA, CRUZ MARÍA",SI
