grupo_parlamentario,congresista,votacion
APP,"ACUÑA PERALTA, MARÍA GRIMANEZA",SI
NA,"ACUÑA PERALTA, SEGUNDO HÉCTOR",AUSENTE
FP,"AGUINAGA RECUENCO, ALEJANDRO AURELIO",SI
PL,"AGÜERO GUTIÉRREZ, MARÍA ANTONIETA",SI
PP,"ALCARRAZ AGUERO, YOREL KIRA",NO
FP,"ALEGRÍA GARCÍA, ARTURO",SI
AP,"ALVA PRIETO, MARÍA DEL CARMEN",SI
NA,"ALVA ROJAS, CARLOS ENRIQUE",ABSTENCION
AP-PIS,"AMURUZ DULANTO, YESSICA ROSSELLI",AUSENTE
NA,"ANDERSON RAMÍREZ, CARLOS ANTONIO",SI
AP,"ARAGÓN CARREÑO, LUIS ÁNGEL",NO
AP,"ARRIOLA TUEROS, JOSÉ ALBERTO",NO
SP,"AZURÍN LOAYZA, ALFREDO",SI
PB,"BALCÁZAR ZELADA, JOSÉ MARÍA",NO
FP,"BARBARÁN REYES, ROSANGELLA ANDREA",SI
AP-PIS,"BAZÁN CALDERÓN, DIEGO ALONSO FERNANDO",SI
CD-JPP,"BAZÁN NARRO, SIGRID TESORO",SI
PB,"BELLIDO UGARTE, GUIDO",NO
CD-JPP,"BERMEJO ROJAS, GUILLERMO",AUSENTE
NA,"BURGOS OLIVEROS, JUAN BARTOLOMÉ",SI
FP,"BUSTAMANTE DONAYRE, ERNESTO",SI
PP,"CALLE LOBATÓN, DIGNA",LICENCIA_PERSONAL
APP,"CAMONES SORIANO, LADY MERCEDES",SI
FP,"CASTILLO RIVAS, EDUARDO ENRIQUE",SI
AP-PIS,"CAVERO ALVA, ALEJANDRO ENRIQUE",AUSENTE
PL,"CERRÓN ROJAS, WALDEMAR JOSÉ",SI
FP,"CHACÓN TRUJILLO, NILZA MERLY",SI
APP,"CHIABRA LEÓN, ROBERTO ENRIQUE",SI
AP-PIS,"CHIRINOS VENEGAS, PATRICIA ROSA",SI
RP,"CICCIA VÁSQUEZ, MIGUEL ANGEL",SI
PB,"COAYLA JUÁREZ, JORGE SAMUEL",NO
FP,"CORDERO JON TAY, LUIS GUSTAVO",LICENCIA_POR_ENFERMEDAD
FP,"CORDERO JON TAY, MARÍA DEL PILAR",ABSTENCION
CD-JPP,"CORTEZ AGUIRRE, ISABEL",SI
PL,"CRUZ MAMANI, FLAVIO",SI
RP,"CUETO ASERVI, JOSÉ ERNESTO",SI
PB,"CUTIPA CCAMA, VÍCTOR RAÚL",NO
AP-PIS,"CÓRDOVA LOBATÓN, MARÍA JESSICA",SI
AP,"DOROTEO CARBAJO, RAÚL FELIPE",NO
BM,"DÁVILA ATANACIO, PASIÓN NEOMIAS",SUSPENDIDO
RP,"ECHAÍZ DE NÚÑEZ IZAGA, GLADYS MARGOT",LICENCIA_POR_ENFERMEDAD
CD-JPP,"ECHEVERRÍA RODRÍGUEZ, HAMLET",SI
PP,"ELÍAS ÁVALOS, JOSÉ LUIS",AUSENTE
AP,"ESPINOZA VARGAS, JHAEC DARWIN",NO
AP,"FLORES ANCACHI, JORGE LUIS",NO
PL,"FLORES RAMÍREZ, ALEX RANDU",NO
FP,"FLORES RUÍZ, VÍCTOR SEFERINO",SI
APP,"GARCÍA CORREA, IDELSO MANUEL",AUSENTE
PL,"GONZA CASTILLO, AMERICO",AUSENTE
AP-PIS,"GONZALES DELGADO, DIANA CAROLINA",SI
FP,"GUERRA GARCÍA, CAMPOS HERNANDO",SI
BM,"GUTIÉRREZ TICONA, PAUL SILVIO",NO
APP,"HEIDINGER BALLESTEROS, NELCY",SI
RP,"HERRERA MEDINA, NOELIA ROSSVITH",SI
FP,"HUAMÁN CORONADO, RAÚL",SI
FP,"INFANTES CASTAÑEDA, MERY ELIANA",SI
SP,"JERI ORÉ, JOSÉ ENRIQUE",SI
FP,"JIMÉNEZ HEREDIA, DAVID JULIO",LICENCIA_PERSONAL
APP,"JULON IRIGOIN, ELVA EDHIT",SI
PP,"JUÁREZ CALLE, HEIDY LISBETH",AUSENTE
FP,"JUÁREZ GALLEGOS, CARMEN PATRICIA",SI
RP,"JÁUREGUI MARTÍNEZ DE AGUAYO, MARÍA DE LOS MILAGROS JACKELINE",SI
CD-JPP,"KAMICHE MORANTE, LUIS ROBERTO",SI
CD-JPP,"LIMACHI QUISPE, NIEVES ESMERALDA",LICENCIA_POR_ENFERMEDAD
FP,"LIZARZABURU LIZARZABURU, JUAN CARLOS MARTIN",AUSENTE
PP,"LUNA GÁLVEZ, JOSÉ LEÓN",ABSTENCION
CD-JPP,"LUQUE IBARRA, RUTH",SI
FP,"LÓPEZ MORALES, JENY LUZ",SI
AP,"LÓPEZ UREÑA, ILICH FREDY",ABSTENCION
PB,"MARTICORENA MENDOZA, JORGE ALFONSO",NO
AP,"MARTÍNEZ TALAVERA, PEDRO EDWIN",SI
BM,"MEDINA HERMOSILLA, ELIZABETH SARA",NO
SP,"MEDINA MINAYA, ESDRAS RICARDO",SI
PL,"MITA ALANOCA, ISAAC",SI
PL,"MONTALVO CUBAS, SEGUNDO TORIBIO",SI
AP,"MONTEZA FACHO, SILVIA MARÍA",SI
RP,"MONTOYA MANRIQUE, JORGE CARLOS",SI
FP,"MORANTE FIGARI, JORGE ALBERTO",SI
AP,"MORI CELIS, JUAN CARLOS",NO
FP,"MOYANO DELGADO, MARTHA LUPE",SI
RP,"MUÑANTE BARRIOS, ALEJANDRO",SI
NA,"MÁLAGA TRILLO, GEORGE EDWARD",SI
FP,"OBANDO MORGAN, AURISTELA ANA",SI
FP,"OLIVOS MARTÍNEZ, VIVIAN",SI
NA,"PABLO MEDINA, FLOR AIDEE",AUSENTE
RP,"PADILLA ROMERO, JAVIER ROMMEL",SI
PL,"PALACIOS HUÁMAN, MARGOT",SI
BM,"PAREDES CASTRO, FRANCIS JHASMINA",AUSENTE
AP,"PAREDES FONSECA, KAROL IVETT",SI
BM,"PAREDES GONZALES, ALEX ANTONIO",NO
NA,"PAREDES PIQUÉ, SUSEL ANA MARÍA",SI
PL,"PARIONA SINCHE, ALFREDO",NO
SP,"PAZO NUNURA, JOSE BERNARDO",AUSENTE
NA,"PICÓN QUEDO, LUIS RAÚL",AUSENTE
PL,"PORTALATINO ÁVALOS, KELLY ROXANA",AUSENTE
AP,"PORTERO LÓPEZ, HILDA MARLENY",SI
BM,"QUIROZ BARBOZA, SEGUNDO TEODOMIRO",NO
PL,"QUISPE MAMANI, WILSON RUSBEL",NO
PL,"QUITO SARMIENTO, BERNARDO JAIME",NO
FP,"RAMÍREZ GARCÍA, TANIA ESTEFANY",AUSENTE
FP,"REVILLA VILLANUEVA, CÉSAR MANUEL",SI
PL,"REYES CAM, ABEL AUGUSTO",AUSENTE
CD-JPP,"REYMUNDO MERCADO, EDGARD CORNELIO",SI
PL,"RIVAS CHACARA, JANET MILAGROS",NO
PL,"ROBLES ARAUJO, SILVANA EMPERATRIZ",SI
APP,"RUÍZ RODRÍGUEZ, MAGALY ROSMERY",SI
SP,"SAAVEDRA CASTERNOQUE, HITLER",SI
APP,"SALHUANA CAVIDES, EDUARDO",SI
AP,"SOTO PALACIOS, WILSON",ABSTENCION
APP,"SOTO REYES, ALEJANDRO",SI
CD-JPP,"SÁNCHEZ PALOMINO, ROBERTO HELBERT",SI
BM,"TACURI VALDIVIA, GERMÁN ADOLFO",LICENCIA_PERSONAL
PL,"TAIPE CORONADO, MARÍA ELIZABETH",NO
BM,"TELLO MONTES, NIVARDO EDGAR",NO
APP,"TORRES SALINAS, ROSIO",AUSENTE
APP,"TRIGOZO REÁTEGUI, CHERYL",SI
AP-PIS,"TUDELA GUTIÉRREZ, ADRIANA JOSEFINA",SI
NA,"UGARTE MAMANI, JHAKELINE KATY",NO
SP,"VALER PINTO, HÉCTOR",NO
PB,"VARAS MELÉNDEZ, ELÍAS MARCIAL",NO
FP,"VENTURA ANGEL, HÉCTOR JOSÉ",SI
AP,"VERGARA MENDOZA, ELVIS HERNÁN",NO
BM,"VÁSQUEZ VELA, LUCINDA",ABSTENCION
AP-PIS,"WILLIAMS ZAPATA, JOSÉ DANIEL",SIN_RESPONDER
NA,"WONG PUJADA, ENRIQUE",SUSPENDIDO
AP-PIS,"YARROW LUMBRERAS, NORMA MARTINA",SI
NA,"ZEA CHOQUECHAMBI, OSCAR",SI
RP,"ZEBALLOS APONTE, JORGE ARTURO",SI
PP,"ZEBALLOS MADARIAGA, CARLOS JAVIER",LICENCIA_PERSONAL
FP,"ZETA CHUNGA, CRUZ MARÍA",SI