grupo_parlamentario,congresista,asistencia
APP,"ACUÑA PERALTA, MARÍA GRIMANEZA",PRESENTE
APP,"ACUÑA PERALTA, SEGUNDO HÉCTOR",PRESENTE
FP,"AGUINAGA RECUENCO, ALEJANDRO AURELIO",PRESENTE
PL,"AGÜERO GUTIÉRREZ, MARÍA ANTONIETA",LICENCIA_POR_ENFERMEDAD
SP,"ALCARRAZ AGUERO, YOREL KIRA",PRESENTE
FP,"ALEGRÍA GARCÍA, ARTURO",AUSENTE
AP,"ALVA PRIETO, MARÍA DEL CARMEN",PRESENTE
AP,"ALVA ROJAS, CARLOS ENRIQUE",PRESENTE
AP-PIS,"AMURUZ DULANTO, YESSICA ROSSELLI",PRESENTE
PP,"ANDERSON RAMÍREZ, CARLOS ANTONIO",PRESENTE
AP,"ARAGÓN CARREÑO, LUIS ÁNGEL",PRESENTE
AP,"ARRIOLA TUEROS, JOSÉ ALBERTO",PRESENTE
SP,"AZURÍN LOAYZA, ALFREDO",AUSENTE
PL,"BALCÁZAR ZELADA, JOSÉ MARÍA",PRESENTE
FP,"BARBARÁN REYES, ROSANGELLA ANDREA",PRESENTE
AP-PIS,"BAZÁN CALDERÓN, DIEGO ALONSO FERNANDO",PRESENTE
JP,"BAZÁN NARRO, SIGRID TESORO",PRESENTE
PL,"BELLIDO UGARTE, GUIDO",PRESENTE
PD,"BERMEJO ROJAS, GUILLERMO",AUSENTE
AP-PIS,"BURGOS OLIVEROS, JUAN BARTOLOMÉ",PRESENTE
FP,"BUSTAMANTE DONAYRE, ERNESTO",PRESENTE
PP,"CALLE LOBATÓN, DIGNA",PRESENTE
APP,"CAMONES SORIANO, LADY MERCEDES",AUSENTE
FP,"CASTILLO RIVAS, EDUARDO ENRIQUE",PRESENTE
AP-PIS,"CAVERO ALVA, ALEJANDRO ENRIQUE",PRESENTE
PL,"CERRÓN ROJAS, WALDEMAR JOSÉ",PRESENTE
FP,"CHACÓN TRUJILLO, NILZA MERLY",PRESENTE
APP,"CHIABRA LEÓN, ROBERTO ENRIQUE",AUSENTE
AP-PIS,"CHIRINOS VENEGAS, PATRICIA ROSA",AUSENTE
PD,"CHÁVEZ CHINO, BETSSY BETZABET",LICENCIA_OFICIAL
RP,"CICCIA VÁSQUEZ, MIGUEL ANGEL",PRESENTE
PL,"COAYLA JUÁREZ, JORGE SAMUEL",PRESENTE
FP,"CORDERO JON TAY, LUIS GUSTAVO",PRESENTE
FP,"CORDERO JON TAY, MARÍA DEL PILAR",PRESENTE
JP,"CORTEZ AGUIRRE, ISABEL",PRESENTE
PL,"CRUZ MAMANI, FLAVIO",PRESENTE
RP,"CUETO ASERVI, JOSÉ ERNESTO",PRESENTE
PL,"CUTIPA CCAMA, VÍCTOR RAÚL",PRESENTE
AP-PIS,"CÓRDOVA LOBATÓN, MARÍA JESSICA",PRESENTE
AP,"DOROTEO CARBAJO, RAÚL FELIPE",PRESENTE
PL,"DÁVILA ATANACIO, PASIÓN NEOMIAS",PRESENTE
APP,"DÍAZ MONAGO, FREDDY RONALD",PRESENTE
APP,"ECHAÍZ DE NÚÑEZ IZAGA, GLADYS MARGOT",AUSENTE
PD,"ECHEVERRÍA RODRÍGUEZ, HAMLET",PRESENTE
SP,"ELERA GARCÍA, WILMAR ALBERTO",PRESENTE
PP,"ELÍAS ÁVALOS, JOSÉ LUIS",AUSENTE
AP,"ESPINOZA VARGAS, JHAEC DARWIN",PRESENTE
AP,"FLORES ANCACHI, JORGE LUIS",PRESENTE
PL,"FLORES RAMÍREZ, ALEX RANDU",PRESENTE
FP,"FLORES RUÍZ, VÍCTOR SEFERINO",PRESENTE
APP,"GARCÍA CORREA, IDELSO MANUEL",PRESENTE
PL,"GONZA CASTILLO, AMERICO",PRESENTE
AP-PIS,"GONZALES DELGADO, DIANA CAROLINA",PRESENTE
FP,"GUERRA GARCÍA, CAMPOS HERNANDO",PRESENTE
PL,"GUTIÉRREZ TICONA, PAUL SILVIO",PRESENTE
RP,"HERRERA MEDINA, NOELIA ROSSVITH",PRESENTE
FP,"HUAMÁN CORONADO, RAÚL",PRESENTE
FP,"INFANTES CASTAÑEDA, MERY ELIANA",PRESENTE
SP,"JERI ORÉ, JOSÉ ENRIQUE",PRESENTE
FP,"JIMÉNEZ HEREDIA, DAVID JULIO",AUSENTE
APP,"JULON IRIGOIN, ELVA EDHIT",AUSENTE
APP,"JUÁREZ CALLE, HEIDY LISBETH",PRESENTE
FP,"JUÁREZ GALLEGOS, CARMEN PATRICIA",PRESENTE
RP,"JÁUREGUI MARTÍNEZ DE AGUAYO, MARÍA DE LOS MILAGROS JACKELINE",PRESENTE
PD,"KAMICHE MORANTE, LUIS ROBERTO",LICENCIA_POR_ENFERMEDAD
PD,"LIMACHI QUISPE, NIEVES ESMERALDA",PRESENTE
FP,"LIZARZABURU LIZARZABURU, JUAN CARLOS MARTIN",PRESENTE
PP,"LUNA GÁLVEZ, JOSÉ LEÓN",PRESENTE
JP,"LUQUE IBARRA, RUTH",PRESENTE
FP,"LÓPEZ MORALES, JENY LUZ",PRESENTE
AP,"LÓPEZ UREÑA, ILICH FREDY",PRESENTE
PL,"MARTICORENA MENDOZA, JORGE ALFONSO",PRESENTE
AP,"MARTÍNEZ TALAVERA, PEDRO EDWIN",PRESENTE
PL,"MEDINA HERMOSILLA, ELIZABETH SARA",PRESENTE
RP,"MEDINA MINAYA, ESDRAS RICARDO",PRESENTE
PL,"MONTALVO CUBAS, SEGUNDO TORIBIO",PRESENTE
AP,"MONTEZA FACHO, SILVIA MARÍA",PRESENTE
RP,"MONTOYA MANRIQUE, JORGE CARLOS",PRESENTE
FP,"MORANTE FIGARI, JORGE ALBERTO",PRESENTE
AP,"MORI CELIS, JUAN CARLOS",PRESENTE
FP,"MOYANO DELGADO, MARTHA LUPE",PRESENTE
RP,"MUÑANTE BARRIOS, ALEJANDRO",AUSENTE
NA,"MÁLAGA TRILLO, GEORGE EDWARD",PRESENTE
FP,"OBANDO MORGAN, AURISTELA ANA",AUSENTE
FP,"OLIVOS MARTÍNEZ, VIVIAN",PRESENTE
NA,"PABLO MEDINA, FLOR AIDEE",PRESENTE
RP,"PADILLA ROMERO, JAVIER ROMMEL",PRESENTE
PL,"PALACIOS HUÁMAN, MARGOT",PRESENTE
PL,"PAREDES CASTRO, FRANCIS JHASMINA",PRESENTE
AP,"PAREDES FONSECA, KAROL IVETT",AUSENTE
PL,"PAREDES GONZALES, ALEX ANTONIO",PRESENTE
NA,"PAREDES PIQUÉ, SUSEL ANA MARÍA",PRESENTE
PL,"PARIONA SINCHE, ALFREDO",PRESENTE
APP,"PICÓN QUEDO, LUIS RAÚL",PRESENTE
PL,"PORTALATINO ÁVALOS, KELLY ROXANA",AUSENTE
AP,"PORTERO LÓPEZ, HILDA MARLENY",PRESENTE
PL,"QUIROZ BARBOZA, SEGUNDO TEODOMIRO",AUSENTE
PL,"QUISPE MAMANI, WILSON RUSBEL",PRESENTE
PL,"QUITO SARMIENTO, BERNARDO JAIME",PRESENTE
FP,"RAMÍREZ GARCÍA, TANIA ESTEFANY",PRESENTE
FP,"REVILLA VILLANUEVA, CÉSAR MANUEL",PRESENTE
PL,"REYES CAM, ABEL AUGUSTO",PRESENTE
JP,"REYMUNDO MERCADO, EDGARD CORNELIO",PRESENTE
PL,"RIVAS CHACARA, JANET MILAGROS",PRESENTE
PL,"ROBLES ARAUJO, SILVANA EMPERATRIZ",PRESENTE
APP,"RUÍZ RODRÍGUEZ, MAGALY ROSMERY",PRESENTE
SP,"SAAVEDRA CASTERNOQUE, HITLER",PRESENTE
APP,"SALHUANA CAVIDES, EDUARDO",AUSENTE
AP,"SOTO PALACIOS, WILSON",PRESENTE
APP,"SOTO REYES, ALEJANDRO",PRESENTE
JP,"SÁNCHEZ PALOMINO, ROBERTO HELBERT",LICENCIA_OFICIAL
PL,"TACURI VALDIVIA, GERMÁN ADOLFO",PRESENTE
PL,"TAIPE CORONADO, MARÍA ELIZABETH",PRESENTE
PL,"TELLO MONTES, NIVARDO EDGAR",PRESENTE
APP,"TORRES SALINAS, ROSIO",PRESENTE
APP,"TRIGOZO REÁTEGUI, CHERYL",PRESENTE
AP-PIS,"TUDELA GUTIÉRREZ, ADRIANA JOSEFINA",LICENCIA_OFICIAL
PL,"UGARTE MAMANI, JHAKELINE KATY",AUSENTE
PD,"VALER PINTO, HÉCTOR",AUSENTE
PL,"VARAS MELÉNDEZ, ELÍAS MARCIAL",AUSENTE
FP,"VENTURA ANGEL, HÉCTOR JOSÉ",PRESENTE
AP,"VERGARA MENDOZA, ELVIS HERNÁN",PRESENTE
PL,"VÁSQUEZ VELA, LUCINDA",PRESENTE
AP-PIS,"WILLIAMS ZAPATA, JOSÉ DANIEL",PRESENTE
PP,"WONG PUJADA, ENRIQUE",PRESENTE
AP-PIS,"YARROW LUMBRERAS, NORMA MARTINA",PRESENTE
PL,"ZEA CHOQUECHAMBI, OSCAR",PRESENTE
RP,"ZEBALLOS APONTE, JORGE ARTURO",PRESENTE
PD,"ZEBALLOS MADARIAGA, CARLOS JAVIER",PRESENTE
FP,"ZETA CHUNGA, CRUZ MARÍA",AUSENTE
