grupo_parlamentario,congresista,votacion
APP,"ACUÑA PERALTA, MARÍA GRIMANEZA",NO
UDP,"ACUÑA PERALTA, SEGUNDO HÉCTOR",LICENCIA_OFICIAL
FP,"AGUINAGA RECUENCO, ALEJANDRO AURELIO",NO
PL,"AGÜERO GUTIÉRREZ, MARÍA ANTONIETA",SI
PP,"ALCARRAZ AGUERO, YOREL KIRA",SI
FP,"ALEGRÍA GARCÍA, ARTURO",NO
NA,"ALVA PRIETO, MARÍA DEL CARMEN",SI
NA,"ALVA ROJAS, CARLOS ENRIQUE",AUSENTE
AP-PIS,"AMURUZ DULANTO, YESSICA ROSSELLI",SI
NA,"ANDERSON RAMÍREZ, CARLOS ANTONIO",AUSENTE
AP,"ARAGÓN CARREÑO, LUIS ÁNGEL",SI
NA,"ARRIOLA TUEROS, JOSÉ ALBERTO",SI
SP,"AZURÍN LOAYZA, ALFREDO",SI
PB,"BALCÁZAR ZELADA, JOSÉ MARÍA",NO
FP,"BARBARÁN REYES, ROSANGELLA ANDREA",AUSENTE
AP-PIS,"BAZÁN CALDERÓN, DIEGO ALONSO FERNANDO",ABSTENCION
CD-JPP,"BAZÁN NARRO, SIGRID TESORO",SI
PB,"BELLIDO UGARTE, GUIDO",SI
CD-JPP,"BERMEJO ROJAS, GUILLERMO",SI
UDP,"BURGOS OLIVEROS, JUAN BARTOLOMÉ",ABSTENCION
FP,"BUSTAMANTE DONAYRE, ERNESTO",NO
PP,"CALLE LOBATÓN, DIGNA",AUSENTE
APP,"CAMONES SORIANO, LADY MERCEDES",AUSENTE
FP,"CASTILLO RIVAS, EDUARDO ENRIQUE",NO
AP-PIS,"CAVERO ALVA, ALEJANDRO ENRIQUE",SI
PL,"CERRÓN ROJAS, WALDEMAR JOSÉ",SI
FP,"CHACÓN TRUJILLO, NILZA MERLY",NO
APP,"CHIABRA LEÓN, ROBERTO ENRIQUE",SI
AP-PIS,"CHIRINOS VENEGAS, PATRICIA ROSA",SIN_RESPONDER
RP,"CICCIA VÁSQUEZ, MIGUEL ANGEL",ABSTENCION
PB,"COAYLA JUÁREZ, JORGE SAMUEL",ABSTENCION
UDP,"CORDERO JON TAY, LUIS GUSTAVO",ABSTENCION
NA,"CORDERO JON TAY, MARÍA DEL PILAR",LICENCIA_POR_ENFERMEDAD
CD-JPP,"CORTEZ AGUIRRE, ISABEL",ABSTENCION
PL,"CRUZ MAMANI, FLAVIO",SI
RP,"CUETO ASERVI, JOSÉ ERNESTO",SI
NA,"CUTIPA CCAMA, VÍCTOR RAÚL",AUSENTE
AP-PIS,"CÓRDOVA LOBATÓN, MARÍA JESSICA",LICENCIA_OFICIAL
AP,"DOROTEO CARBAJO, RAÚL FELIPE",SI
BM,"DÁVILA ATANACIO, PASIÓN NEOMIAS",ABSTENCION
RP,"ECHAÍZ DE NÚÑEZ IZAGA, GLADYS MARGOT",ABSTENCION
CD-JPP,"ECHEVERRÍA RODRÍGUEZ, HAMLET",SI
PP,"ELÍAS ÁVALOS, JOSÉ LUIS",SIN_RESPONDER
AP,"ESPINOZA VARGAS, JHAEC DARWIN",SI
AP,"FLORES ANCACHI, JORGE LUIS",NO
NA,"FLORES RAMÍREZ, ALEX RANDU",SI
FP,"FLORES RUÍZ, VÍCTOR SEFERINO",NO
APP,"GARCÍA CORREA, IDELSO MANUEL",ABSTENCION
PL,"GONZA CASTILLO, AMERICO",AUSENTE
AP-PIS,"GONZALES DELGADO, DIANA CAROLINA",SI
BM,"GUTIÉRREZ TICONA, PAUL SILVIO",NO
APP,"HEIDINGER BALLESTEROS, NELCY",NO
FP,"HERRERA MAMANI, FERNANDO MARIO",NO
RP,"HERRERA MEDINA, NOELIA ROSSVITH",SI
FP,"HUAMÁN CORONADO, RAÚL",NO
FP,"INFANTES CASTAÑEDA, MERY ELIANA",LICENCIA_OFICIAL
SP,"JERI ORÉ, JOSÉ ENRIQUE",AUSENTE
FP,"JIMÉNEZ HEREDIA, DAVID JULIO",NO
APP,"JULON IRIGOIN, ELVA EDHIT",NO
PP,"JUÁREZ CALLE, HEIDY LISBETH",SI
FP,"JUÁREZ GALLEGOS, CARMEN PATRICIA",NO
RP,"JÁUREGUI MARTÍNEZ DE AGUAYO, MARÍA DE LOS MILAGROS JACKELINE",SI
CD-JPP,"KAMICHE MORANTE, LUIS ROBERTO",SI
CD-JPP,"LIMACHI QUISPE, NIEVES ESMERALDA",SIN_RESPONDER
FP,"LIZARZABURU LIZARZABURU, JUAN CARLOS MARTIN",NO
PP,"LUNA GÁLVEZ, JOSÉ LEÓN",SI
CD-JPP,"LUQUE IBARRA, RUTH",SI
FP,"LÓPEZ MORALES, JENY LUZ",NO
NA,"LÓPEZ UREÑA, ILICH FREDY",SIN_RESPONDER
PB,"MARTICORENA MENDOZA, JORGE ALFONSO",NO
NA,"MARTÍNEZ TALAVERA, PEDRO EDWIN",SI
BM,"MEDINA HERMOSILLA, ELIZABETH SARA",NO
UDP,"MEDINA MINAYA, ESDRAS RICARDO",AUSENTE
PL,"MITA ALANOCA, ISAAC",SI
PL,"MONTALVO CUBAS, SEGUNDO TORIBIO",SI
NA,"MONTEZA FACHO, SILVIA MARÍA",SI
RP,"MONTOYA MANRIQUE, JORGE CARLOS",SI
FP,"MORANTE FIGARI, JORGE ALBERTO",NO
NA,"MORI CELIS, JUAN CARLOS",SI
FP,"MOYANO DELGADO, MARTHA LUPE",NO
RP,"MUÑANTE BARRIOS, ALEJANDRO",SI
NA,"MÁLAGA TRILLO, GEORGE EDWARD",SI
FP,"OBANDO MORGAN, AURISTELA ANA",NO
FP,"OLIVOS MARTÍNEZ, VIVIAN",NO
NA,"PABLO MEDINA, FLOR AIDEE",AUSENTE
RP,"PADILLA ROMERO, JAVIER ROMMEL",SI
PL,"PALACIOS HUÁMAN, MARGOT",AUSENTE
PP,"PAREDES CASTRO, FRANCIS JHASMINA",SI
NA,"PAREDES FONSECA, KAROL IVETT",SI
BM,"PAREDES GONZALES, ALEX ANTONIO",AUSENTE
CD-JPP,"PAREDES PIQUÉ, SUSEL ANA MARÍA",SI
NA,"PARIONA SINCHE, ALFREDO",ABSTENCION
SP,"PAZO NUNURA, JOSE BERNARDO",NO
PP,"PICÓN QUEDO, LUIS RAÚL",SI
PL,"PORTALATINO ÁVALOS, KELLY ROXANA",LICENCIA_OFICIAL
AP,"PORTERO LÓPEZ, HILDA MARLENY",SI
BM,"QUIROZ BARBOZA, SEGUNDO TEODOMIRO",ABSTENCION
PL,"QUISPE MAMANI, WILSON RUSBEL",SI
NA,"QUITO SARMIENTO, BERNARDO JAIME",SI
FP,"RAMÍREZ GARCÍA, TANIA ESTEFANY",AUSENTE
FP,"REVILLA VILLANUEVA, CÉSAR MANUEL",AUSENTE
PL,"REYES CAM, ABEL AUGUSTO",AUSENTE
CD-JPP,"REYMUNDO MERCADO, EDGARD CORNELIO",LICENCIA_POR_ENFERMEDAD
PL,"RIVAS CHACARA, JANET MILAGROS",SIN_RESPONDER
NA,"ROBLES ARAUJO, SILVANA EMPERATRIZ",AUSENTE
APP,"RUÍZ RODRÍGUEZ, MAGALY ROSMERY",NO
SP,"SAAVEDRA CASTERNOQUE, HITLER",SI
APP,"SALHUANA CAVIDES, EDUARDO",AUSENTE
AP,"SOTO PALACIOS, WILSON",SI
APP,"SOTO REYES, ALEJANDRO",SIN_RESPONDER
CD-JPP,"SÁNCHEZ PALOMINO, ROBERTO HELBERT",SI
BM,"TACURI VALDIVIA, GERMÁN ADOLFO",NO
PL,"TAIPE CORONADO, MARÍA ELIZABETH",SI
BM,"TELLO MONTES, NIVARDO EDGAR",SI
APP,"TORRES SALINAS, ROSIO",NO
APP,"TRIGOZO REÁTEGUI, CHERYL",ABSTENCION
AP-PIS,"TUDELA GUTIÉRREZ, ADRIANA JOSEFINA",AUSENTE
UDP,"UGARTE MAMANI, JHAKELINE KATY",ABSTENCION
SP,"VALER PINTO, HÉCTOR",AUSENTE
PB,"VARAS MELÉNDEZ, ELÍAS MARCIAL",AUSENTE
FP,"VENTURA ANGEL, HÉCTOR JOSÉ",NO
AP,"VERGARA MENDOZA, ELVIS HERNÁN",SI
BM,"VÁSQUEZ VELA, LUCINDA",SI
AP-PIS,"WILLIAMS ZAPATA, JOSÉ DANIEL",SI
PP,"WONG PUJADA, ENRIQUE",AUSENTE
AP-PIS,"YARROW LUMBRERAS, NORMA MARTINA",SI
BM,"ZEA CHOQUECHAMBI, OSCAR",LICENCIA_OFICIAL
RP,"ZEBALLOS APONTE, JORGE ARTURO",SI
PP,"ZEBALLOS MADARIAGA, CARLOS JAVIER",SI
FP,"ZETA CHUNGA, CRUZ MARÍA",NO
