numero,grupo_parlamentario,congresista,votacion
1,APP,"ACUÑA PERALTA, MARÍA GRIMANEZA",NO
2,APP,"ACUÑA PERALTA, SEGUNDO HÉCTOR",AUS
3,PL,"AGÜERO GUTIÉRREZ, MARÍA ANTONIETA",NO
4,FP,"AGUINAGA RECUENCO, ALEJANDRO AURELIO",SI
5,SP,"ALCARRAZ AGUERO, YOREL KIRA",SINRES
6,FP,"ALEGRÍA GARCÍA, ARTURO",SI
7,AP,"ALVA PRIETO, MARÍA DEL CARMEN",AUS
8,AP,"ALVA ROJAS, CARLOS ENRIQUE",SI
9,AP-PIS,"AMURUZ DULANTO, YESSICA ROSSELLI",SI
10,PP,"ANDERSON RAMÍREZ, CARLOS ANTONIO",SI
11,AP,"ARAGÓN CARREÑO, LUIS ÁNGEL",NO
12,AP,"ARRIOLA TUEROS, JOSÉ ALBERTO",NO
13,SP,"AZURÍN LOAYZA, ALFREDO",SI
14,PL,"BALCÁZAR ZELADA, JOSÉ MARÍA",NO
15,FP,"BARBARÁN REYES, ROSANGELLA ANDREA",SI
16,AP-PIS,"BAZÁN CALDERÓN, DIEGO ALONSO FERNANDO",SI
17,JP,"BAZÁN NARRO, SIGRID TESORO",SI
18,PL,"BELLIDO UGARTE, GUIDO",NO
19,PL,"BERMEJO ROJAS, GUILLERMO",NO
20,AP-PIS,"BURGOS OLIVEROS, JUAN BARTOLOMÉ",SI
21,FP,"BUSTAMANTE DONAYRE, ERNESTO",SI
22,PP,"CALLE LOBATÓN, DIGNA",NO
23,APP,"CAMONES SORIANO, LADY MERCEDES",SINRES
24,FP,"CASTILLO RIVAS, EDUARDO ENRIQUE",SI
25,AP-PIS,"CAVERO ALVA, ALEJANDRO ENRIQUE",LO
26,PL,"CERRÓN ROJAS, WALDEMAR JOSÉ",NO
27,FP,"CHACÓN TRUJILLO, NILZA MERLY",AUS
28,PL,"CHÁVEZ CHINO, BETSSY BETZABET",LO
29,APP,"CHIABRA LEÓN, ROBERTO ENRIQUE",SI
30,AP-PIS,"CHIRINOS VENEGAS, PATRICIA ROSA",AUS
31,RP,"CICCIA VÁSQUEZ, MIGUEL ANGEL",SI
32,PL,"COAYLA JUÁREZ, JORGE SAMUEL",LO
33,FP,"CORDERO JON TAY, LUIS GUSTAVO",SI
34,FP,"CORDERO JON TAY, MARÍA DEL PILAR",SI
35,AP-PIS,"CÓRDOVA LOBATÓN, MARÍA JESSICA",SI
36,JP,"CORTEZ AGUIRRE, ISABEL",NO
37,PL,"CRUZ MAMANI, FLAVIO",NO
38,RP,"CUETO ASERVI, JOSÉ ERNESTO",SI
39,PL,"CUTIPA CCAMA, VÍCTOR RAÚL",NO
40,PL,"DÁVILA ATANACIO, PASIÓN NEOMIAS",NO
41,APP,"DÍAZ MONAGO, FREDDY RONALD",NO
42,AP,"DOROTEO CARBAJO, RAÚL FELIPE",NO
43,APP,"ECHAÍZ DE NÚÑEZ IZAGA, GLADYS MARGOT",SI
44,PL,"ECHEVERRÍA RODRÍGUEZ, HAMLET",LO
45,SP,"ELERA GARCÍA, WILMAR ALBERTO",SI
46,PP,"ELÍAS ÁVALOS, JOSÉ LUIS",LE
47,AP,"ESPINOZA VARGAS, JHAEC DARWIN",NO
48,AP,"FLORES ANCACHI, JORGE LUIS",NO
49,PL,"FLORES RAMÍREZ, ALEX RANDU",NO
50,FP,"FLORES RUÍZ, VÍCTOR SEFERINO",SI
51,APP,"GARCÍA CORREA, IDELSO MANUEL",NO
52,PL,"GONZA CASTILLO, AMERICO",NO
53,AP-PIS,"GONZALES DELGADO, DIANA CAROLINA",SI
54,FP,"GUERRA GARCÍA, CAMPOS HERNANDO",SI
55,PL,"GUTIÉRREZ TICONA, PAUL SILVIO",AUS
56,RP,"HERRERA MEDINA, NOELIA ROSSVITH",SI
57,FP,"HUAMÁN CORONADO, RAÚL",SI
58,FP,"INFANTES CASTAÑEDA, MERY ELIANA",SI
59,RP,"JÁUREGUI MARTÍNEZ DE AGUAYO, MARÍA DE LOS MILAGROS JACKELINE",AUS
60,SP,"JERI ORÉ, JOSÉ ENRIQUE",SINRES
61,FP,"JIMÉNEZ HEREDIA, DAVID JULIO",SI
62,APP,"JUÁREZ CALLE, HEIDY LISBETH",NO
63,FP,"JUÁREZ GALLEGOS, CARMEN PATRICIA",SI
64,APP,"JULON IRIGOIN, ELVA EDHIT",LE
65,PL,"KAMICHE MORANTE, LUIS ROBERTO",NO
66,PL,"LIMACHI QUISPE, NIEVES ESMERALDA",NO
67,FP,"LIZARZABURU LIZARZABURU, JUAN CARLOS MARTIN",SI
68,FP,"LÓPEZ MORALES, JENY LUZ",SI
69,AP,"LÓPEZ UREÑA, ILICH FREDY",NO
70,PP,"LUNA GÁLVEZ, JOSÉ LEÓN",AUS
71,JP,"LUQUE IBARRA, RUTH",SI
72,NA,"MÁLAGA TRILLO, GEORGE EDWARD",SI
73,PL,"MARTICORENA MENDOZA, JORGE ALFONSO",NO
74,AP,"MARTÍNEZ TALAVERA, PEDRO EDWIN",NO
75,PL,"MEDINA HERMOSILLA, ELIZABETH SARA",NO
76,RP,"MEDINA MINAYA, ESDRAS RICARDO",AUS
77,PL,"MONTALVO CUBAS, SEGUNDO TORIBIO",NO
78,AP,"MONTEZA FACHO, SILVIA MARÍA",NO
79,RP,"MONTOYA MANRIQUE, JORGE CARLOS",SI
80,FP,"MORANTE FIGARI, JORGE ALBERTO",LE
81,AP,"MORI CELIS, JUAN CARLOS",LP
82,FP,"MOYANO DELGADO, MARTHA LUPE",SI
83,RP,"MUÑANTE BARRIOS, ALEJANDRO",SI
84,FP,"OBANDO MORGAN, AURISTELA ANA",SI
85,FP,"OLIVOS MARTÍNEZ, VIVIAN",SI
86,NA,"PABLO MEDINA, FLOR AIDEE",SI
87,RP,"PADILLA ROMERO, JAVIER ROMMEL",SI
88,PL,"PALACIOS HUÁMAN, MARGOT",NO
89,PL,"PAREDES CASTRO, FRANCIS JHASMINA",NO
90,AP,"PAREDES FONSECA, KAROL IVETT",NO
91,PL,"PAREDES GONZALES, ALEX ANTONIO",NO
92,NA,"PAREDES PIQUÉ, SUSEL ANA MARÍA",SI
93,PL,"PARIONA SINCHE, ALFREDO",NO
94,APP,"PICÓN QUEDO, LUIS RAÚL",NO
95,PL,"PORTALATINO ÁVALOS, KELLY ROXANA",NO
96,AP,"PORTERO LÓPEZ, HILDA MARLENY",NO
97,PL,"QUIROZ BARBOZA, SEGUNDO TEODOMIRO",NO
98,PL,"QUISPE MAMANI, WILSON RUSBEL",NO
99,PL,"QUITO SARMIENTO, BERNARDO JAIME",NO
100,FP,"RAMÍREZ GARCÍA, TANIA ESTEFANY",SI
101,FP,"REVILLA VILLANUEVA, CÉSAR MANUEL",SI
102,PL,"REYES CAM, ABEL AUGUSTO",NO
103,JP,"REYMUNDO MERCADO, EDGARD CORNELIO",NO
104,PL,"RIVAS CHACARA, JANET MILAGROS",NO
105,PL,"ROBLES ARAUJO, SILVANA EMPERATRIZ",NO
106,APP,"RUÍZ RODRÍGUEZ, MAGALY ROSMERY",ABST
107,SP,"SAAVEDRA CASTERNOQUE, HITLER",ABST
108,APP,"SALHUANA CAVIDES, EDUARDO",SI
109,JP,"SÁNCHEZ PALOMINO, ROBERTO HELBERT",NO
110,AP,"SOTO PALACIOS, WILSON",NO
111,APP,"SOTO REYES, ALEJANDRO",NO
112,PL,"TACURI VALDIVIA, GERMÁN ADOLFO",NO
113,PL,"TAIPE CORONADO, MARÍA ELIZABETH",AUS
114,PL,"TELLO MONTES, NIVARDO EDGAR",AUS
115,APP,"TORRES SALINAS, ROSIO",NO
116,APP,"TRIGOZO REÁTEGUI, CHERYL",NO
117,AP-PIS,"TUDELA GUTIÉRREZ, ADRIANA JOSEFINA",SI
118,PL,"UGARTE MAMANI, JHAKELINE KATY",NO
119,SP,"VALER PINTO, HÉCTOR",NO
120,PL,"VARAS MELÉNDEZ, ELÍAS MARCIAL",NO
121,PL,"VÁSQUEZ VELA, LUCINDA",NO
122,FP,"VENTURA ANGEL, HÉCTOR JOSÉ",SI
123,AP,"VERGARA MENDOZA, ELVIS HERNÁN",NO
124,AP-PIS,"WILLIAMS ZAPATA, JOSÉ DANIEL",SI
125,PP,"WONG PUJADA, ENRIQUE",AUS
126,AP-PIS,"YARROW LUMBRERAS, NORMA MARTINA",SI
127,PL,"ZEA CHOQUECHAMBI, OSCAR",NO
128,RP,"ZEBALLOS APONTE, JORGE ARTURO",LE
129,NA,"ZEBALLOS MADARIAGA, CARLOS JAVIER",NO
130,FP,"ZETA CHUNGA, CRUZ MARÍA",SI
