grupo_parlamentario,congresista,asistencia
APP,"ACUÑA PERALTA, MARÍA GRIMANEZA",PRESENTE
UDP,"ACUÑA PERALTA, SEGUNDO HÉCTOR",AUSENTE
FP,"AGUINAGA RECUENCO, ALEJANDRO AURELIO",AUSENTE
PL,"AGÜERO GUTIÉRREZ, MARÍA ANTONIETA",PRESENTE
PP,"ALCARRAZ AGUERO, YOREL KIRA",PRESENTE
FP,"ALEGRÍA GARCÍA, ARTURO",AUSENTE
NA,"ALVA PRIETO, MARÍA DEL CARMEN",PRESENTE
NA,"ALVA ROJAS, CARLOS ENRIQUE",PRESENTE
AP-PIS,"AMURUZ DULANTO, YESSICA ROSSELLI",PRESENTE
NA,"ANDERSON RAMÍREZ, CARLOS ANTONIO",PRESENTE
AP,"ARAGÓN CARREÑO, LUIS ÁNGEL",PRESENTE
NA,"ARRIOLA TUEROS, JOSÉ ALBERTO",PRESENTE
SP,"AZURÍN LOAYZA, ALFREDO",PRESENTE
PB,"BALCÁZAR ZELADA, JOSÉ MARÍA",PRESENTE
FP,"BARBARÁN REYES, ROSANGELLA ANDREA",AUSENTE
AP-PIS,"BAZÁN CALDERÓN, DIEGO ALONSO FERNANDO",PRESENTE
CD-JPP,"BAZÁN NARRO, SIGRID TESORO",PRESENTE
PB,"BELLIDO UGARTE, GUIDO",AUSENTE
CD-JPP,"BERMEJO ROJAS, GUILLERMO",PRESENTE
UDP,"BURGOS OLIVEROS, JUAN BARTOLOMÉ",PRESENTE
FP,"BUSTAMANTE DONAYRE, ERNESTO",PRESENTE
PP,"CALLE LOBATÓN, DIGNA",LICENCIA_PERSONAL
APP,"CAMONES SORIANO, LADY MERCEDES",AUSENTE
FP,"CASTILLO RIVAS, EDUARDO ENRIQUE",PRESENTE
AP-PIS,"CAVERO ALVA, ALEJANDRO ENRIQUE",AUSENTE
PL,"CERRÓN ROJAS, WALDEMAR JOSÉ",PRESENTE
FP,"CHACÓN TRUJILLO, NILZA MERLY",AUSENTE
APP,"CHIABRA LEÓN, ROBERTO ENRIQUE",PRESENTE
AP-PIS,"CHIRINOS VENEGAS, PATRICIA ROSA",PRESENTE
RP,"CICCIA VÁSQUEZ, MIGUEL ANGEL",PRESENTE
PB,"COAYLA JUÁREZ, JORGE SAMUEL",PRESENTE
UDP,"CORDERO JON TAY, LUIS GUSTAVO",PRESENTE
NA,"CORDERO JON TAY, MARÍA DEL PILAR",SUSPENDIDO
CD-JPP,"CORTEZ AGUIRRE, ISABEL",PRESENTE
PL,"CRUZ MAMANI, FLAVIO",PRESENTE
RP,"CUETO ASERVI, JOSÉ ERNESTO",PRESENTE
NA,"CUTIPA CCAMA, VÍCTOR RAÚL",PRESENTE
AP-PIS,"CÓRDOVA LOBATÓN, MARÍA JESSICA",PRESENTE
AP,"DOROTEO CARBAJO, RAÚL FELIPE",AUSENTE
BM,"DÁVILA ATANACIO, PASIÓN NEOMIAS",PRESENTE
RP,"ECHAÍZ DE NÚÑEZ IZAGA, GLADYS MARGOT",LICENCIA_POR_ENFERMEDAD
CD-JPP,"ECHEVERRÍA RODRÍGUEZ, HAMLET",PRESENTE
PP,"ELÍAS ÁVALOS, JOSÉ LUIS",PRESENTE
AP,"ESPINOZA VARGAS, JHAEC DARWIN",AUSENTE
AP,"FLORES ANCACHI, JORGE LUIS",PRESENTE
NA,"FLORES RAMÍREZ, ALEX RANDU",PRESENTE
FP,"FLORES RUÍZ, VÍCTOR SEFERINO",PRESENTE
APP,"GARCÍA CORREA, IDELSO MANUEL",PRESENTE
PL,"GONZA CASTILLO, AMERICO",PRESENTE
AP-PIS,"GONZALES DELGADO, DIANA CAROLINA",PRESENTE
BM,"GUTIÉRREZ TICONA, PAUL SILVIO",PRESENTE
APP,"HEIDINGER BALLESTEROS, NELCY",PRESENTE
FP,"HERRERA MAMANI, FERNANDO MARIO",PRESENTE
RP,"HERRERA MEDINA, NOELIA ROSSVITH",PRESENTE
FP,"HUAMÁN CORONADO, RAÚL",PRESENTE
FP,"INFANTES CASTAÑEDA, MERY ELIANA",PRESENTE
SP,"JERI ORÉ, JOSÉ ENRIQUE",PRESENTE
FP,"JIMÉNEZ HEREDIA, DAVID JULIO",AUSENTE
APP,"JULON IRIGOIN, ELVA EDHIT",LICENCIA_OFICIAL
PP,"JUÁREZ CALLE, HEIDY LISBETH",PRESENTE
FP,"JUÁREZ GALLEGOS, CARMEN PATRICIA",PRESENTE
RP,"JÁUREGUI MARTÍNEZ DE AGUAYO, MARÍA DE LOS MILAGROS JACKELINE",AUSENTE
CD-JPP,"KAMICHE MORANTE, LUIS ROBERTO",LICENCIA_POR_ENFERMEDAD
CD-JPP,"LIMACHI QUISPE, NIEVES ESMERALDA",PRESENTE
FP,"LIZARZABURU LIZARZABURU, JUAN CARLOS MARTIN",AUSENTE
PP,"LUNA GÁLVEZ, JOSÉ LEÓN",AUSENTE
CD-JPP,"LUQUE IBARRA, RUTH",PRESENTE
FP,"LÓPEZ MORALES, JENY LUZ",PRESENTE
NA,"LÓPEZ UREÑA, ILICH FREDY",PRESENTE
PB,"MARTICORENA MENDOZA, JORGE ALFONSO",PRESENTE
NA,"MARTÍNEZ TALAVERA, PEDRO EDWIN",PRESENTE
BM,"MEDINA HERMOSILLA, ELIZABETH SARA",PRESENTE
UDP,"MEDINA MINAYA, ESDRAS RICARDO",PRESENTE
PL,"MITA ALANOCA, ISAAC",PRESENTE
PL,"MONTALVO CUBAS, SEGUNDO TORIBIO",AUSENTE
NA,"MONTEZA FACHO, SILVIA MARÍA",PRESENTE
RP,"MONTOYA MANRIQUE, JORGE CARLOS",AUSENTE
FP,"MORANTE FIGARI, JORGE ALBERTO",PRESENTE
NA,"MORI CELIS, JUAN CARLOS",AUSENTE
FP,"MOYANO DELGADO, MARTHA LUPE",PRESENTE
RP,"MUÑANTE BARRIOS, ALEJANDRO",AUSENTE
NA,"MÁLAGA TRILLO, GEORGE EDWARD",PRESENTE
FP,"OBANDO MORGAN, AURISTELA ANA",AUSENTE
FP,"OLIVOS MARTÍNEZ, VIVIAN",PRESENTE
NA,"PABLO MEDINA, FLOR AIDEE",PRESENTE
RP,"PADILLA ROMERO, JAVIER ROMMEL",PRESENTE
PL,"PALACIOS HUÁMAN, MARGOT",AUSENTE
PP,"PAREDES CASTRO, FRANCIS JHASMINA",PRESENTE
NA,"PAREDES FONSECA, KAROL IVETT",AUSENTE
BM,"PAREDES GONZALES, ALEX ANTONIO",PRESENTE
CD-JPP,"PAREDES PIQUÉ, SUSEL ANA MARÍA",AUSENTE
NA,"PARIONA SINCHE, ALFREDO",PRESENTE
SP,"PAZO NUNURA, JOSE BERNARDO",PRESENTE
PP,"PICÓN QUEDO, LUIS RAÚL",AUSENTE
PL,"PORTALATINO ÁVALOS, KELLY ROXANA",AUSENTE
AP,"PORTERO LÓPEZ, HILDA MARLENY",LICENCIA_POR_ENFERMEDAD
BM,"QUIROZ BARBOZA, SEGUNDO TEODOMIRO",AUSENTE
PL,"QUISPE MAMANI, WILSON RUSBEL",PRESENTE
NA,"QUITO SARMIENTO, BERNARDO JAIME",PRESENTE
FP,"RAMÍREZ GARCÍA, TANIA ESTEFANY",PRESENTE
FP,"REVILLA VILLANUEVA, CÉSAR MANUEL",PRESENTE
PL,"REYES CAM, ABEL AUGUSTO",PRESENTE
CD-JPP,"REYMUNDO MERCADO, EDGARD CORNELIO",LICENCIA_POR_ENFERMEDAD
PL,"RIVAS CHACARA, JANET MILAGROS",PRESENTE
NA,"ROBLES ARAUJO, SILVANA EMPERATRIZ",PRESENTE
APP,"RUÍZ RODRÍGUEZ, MAGALY ROSMERY",AUSENTE
SP,"SAAVEDRA CASTERNOQUE, HITLER",PRESENTE
APP,"SALHUANA CAVIDES, EDUARDO",PRESENTE
AP,"SOTO PALACIOS, WILSON",AUSENTE
APP,"SOTO REYES, ALEJANDRO",PRESENTE
CD-JPP,"SÁNCHEZ PALOMINO, ROBERTO HELBERT",PRESENTE
BM,"TACURI VALDIVIA, GERMÁN ADOLFO",PRESENTE
PL,"TAIPE CORONADO, MARÍA ELIZABETH",PRESENTE
BM,"TELLO MONTES, NIVARDO EDGAR",AUSENTE
APP,"TORRES SALINAS, ROSIO",PRESENTE
APP,"TRIGOZO REÁTEGUI, CHERYL",AUSENTE
AP-PIS,"TUDELA GUTIÉRREZ, ADRIANA JOSEFINA",AUSENTE
UDP,"UGARTE MAMANI, JHAKELINE KATY",AUSENTE
SP,"VALER PINTO, HÉCTOR",PRESENTE
PB,"VARAS MELÉNDEZ, ELÍAS MARCIAL",AUSENTE
FP,"VENTURA ANGEL, HÉCTOR JOSÉ",PRESENTE
AP,"VERGARA MENDOZA, ELVIS HERNÁN",PRESENTE
BM,"VÁSQUEZ VELA, LUCINDA",PRESENTE
AP-PIS,"WILLIAMS ZAPATA, JOSÉ DANIEL",PRESENTE
PP,"WONG PUJADA, ENRIQUE",AUSENTE
AP-PIS,"YARROW LUMBRERAS, NORMA MARTINA",PRESENTE
BM,"ZEA CHOQUECHAMBI, OSCAR",PRESENTE
RP,"ZEBALLOS APONTE, JORGE ARTURO",AUSENTE
PP,"ZEBALLOS MADARIAGA, CARLOS JAVIER",AUSENTE
FP,"ZETA CHUNGA, CRUZ MARÍA",AUSENTE
