grupo_parlamentario,congresista,votacion
APP,"ACUÑA PERALTA, MARÍA GRIMANEZA",SIN_RESPONDER
NA,"ACUÑA PERALTA, SEGUNDO HÉCTOR",AUSENTE
FP,"AGUINAGA RECUENCO, ALEJANDRO AURELIO",SI
PL,"AGÜERO GUTIÉRREZ, MARÍA ANTONIETA",AUSENTE
PP,"ALCARRAZ AGUERO, YOREL KIRA",SI
FP,"ALEGRÍA GARCÍA, ARTURO",ABSTENCION
AP,"ALVA PRIETO, MARÍA DEL CARMEN",SI
NA,"ALVA ROJAS, CARLOS ENRIQUE",SI
AP-PIS,"AMURUZ DULANTO, YESSICA ROSSELLI",AUSENTE
NA,"ANDERSON RAMÍREZ, CARLOS ANTONIO",NO
AP,"ARAGÓN CARREÑO, LUIS ÁNGEL",SI
AP,"ARRIOLA TUEROS, JOSÉ ALBERTO",SI
SP,"AZURÍN LOAYZA, ALFREDO",SI
PB,"BALCÁZAR ZELADA, JOSÉ MARÍA",AUSENTE
FP,"BARBARÁN REYES, ROSANGELLA ANDREA",ABSTENCION
AP-PIS,"BAZÁN CALDERÓN, DIEGO ALONSO FERNANDO",AUSENTE
CD-JPP,"BAZÁN NARRO, SIGRID TESORO",SI
PB,"BELLIDO UGARTE, GUIDO",SI
CD-JPP,"BERMEJO ROJAS, GUILLERMO",SI
NA,"BURGOS OLIVEROS, JUAN BARTOLOMÉ",SI
FP,"BUSTAMANTE DONAYRE, ERNESTO",ABSTENCION
PP,"CALLE LOBATÓN, DIGNA",LICENCIA_PERSONAL
APP,"CAMONES SORIANO, LADY MERCEDES",NO
FP,"CASTILLO RIVAS, EDUARDO ENRIQUE",SI
AP-PIS,"CAVERO ALVA, ALEJANDRO ENRIQUE",NO
PL,"CERRÓN ROJAS, WALDEMAR JOSÉ",SI
FP,"CHACÓN TRUJILLO, NILZA MERLY",SI
APP,"CHIABRA LEÓN, ROBERTO ENRIQUE",SI
AP-PIS,"CHIRINOS VENEGAS, PATRICIA ROSA",AUSENTE
RP,"CICCIA VÁSQUEZ, MIGUEL ANGEL",SI
PB,"COAYLA JUÁREZ, JORGE SAMUEL",SI
FP,"CORDERO JON TAY, LUIS GUSTAVO",SI
FP,"CORDERO JON TAY, MARÍA DEL PILAR",LICENCIA_POR_ENFERMEDAD
CD-JPP,"CORTEZ AGUIRRE, ISABEL",SI
PL,"CRUZ MAMANI, FLAVIO",SI
RP,"CUETO ASERVI, JOSÉ ERNESTO",SI
PB,"CUTIPA CCAMA, VÍCTOR RAÚL",SI
AP-PIS,"CÓRDOVA LOBATÓN, MARÍA JESSICA",SI
AP,"DOROTEO CARBAJO, RAÚL FELIPE",AUSENTE
BM,"DÁVILA ATANACIO, PASIÓN NEOMIAS",SUSPENDIDO
RP,"ECHAÍZ DE NÚÑEZ IZAGA, GLADYS MARGOT",SI
CD-JPP,"ECHEVERRÍA RODRÍGUEZ, HAMLET",SI
PP,"ELÍAS ÁVALOS, JOSÉ LUIS",SIN_RESPONDER
AP,"ESPINOZA VARGAS, JHAEC DARWIN",SI
AP,"FLORES ANCACHI, JORGE LUIS",SI
PL,"FLORES RAMÍREZ, ALEX RANDU",SI
FP,"FLORES RUÍZ, VÍCTOR SEFERINO",SI
APP,"GARCÍA CORREA, IDELSO MANUEL",SI
PL,"GONZA CASTILLO, AMERICO",SI
AP-PIS,"GONZALES DELGADO, DIANA CAROLINA",ABSTENCION
FP,"GUERRA GARCÍA, CAMPOS HERNANDO",SI
BM,"GUTIÉRREZ TICONA, PAUL SILVIO",SI
APP,"HEIDINGER BALLESTEROS, NELCY",SI
RP,"HERRERA MEDINA, NOELIA ROSSVITH",SI
FP,"HUAMÁN CORONADO, RAÚL",AUSENTE
FP,"INFANTES CASTAÑEDA, MERY ELIANA",SI
SP,"JERI ORÉ, JOSÉ ENRIQUE",AUSENTE
FP,"JIMÉNEZ HEREDIA, DAVID JULIO",AUSENTE
APP,"JULON IRIGOIN, ELVA EDHIT",SI
PP,"JUÁREZ CALLE, HEIDY LISBETH",SI
FP,"JUÁREZ GALLEGOS, CARMEN PATRICIA",ABSTENCION
RP,"JÁUREGUI MARTÍNEZ DE AGUAYO, MARÍA DE LOS MILAGROS JACKELINE",AUSENTE
CD-JPP,"KAMICHE MORANTE, LUIS ROBERTO",SI
CD-JPP,"LIMACHI QUISPE, NIEVES ESMERALDA",LICENCIA_POR_ENFERMEDAD
FP,"LIZARZABURU LIZARZABURU, JUAN CARLOS MARTIN",AUSENTE
PP,"LUNA GÁLVEZ, JOSÉ LEÓN",AUSENTE
CD-JPP,"LUQUE IBARRA, RUTH",SI
FP,"LÓPEZ MORALES, JENY LUZ",SI
AP,"LÓPEZ UREÑA, ILICH FREDY",SI
PB,"MARTICORENA MENDOZA, JORGE ALFONSO",SI
AP,"MARTÍNEZ TALAVERA, PEDRO EDWIN",SI
BM,"MEDINA HERMOSILLA, ELIZABETH SARA",SI
SP,"MEDINA MINAYA, ESDRAS RICARDO",SI
PL,"MITA ALANOCA, ISAAC",SI
PL,"MONTALVO CUBAS, SEGUNDO TORIBIO",SI
AP,"MONTEZA FACHO, SILVIA MARÍA",SI
RP,"MONTOYA MANRIQUE, JORGE CARLOS",SIN_RESPONDER
FP,"MORANTE FIGARI, JORGE ALBERTO",ABSTENCION
AP,"MORI CELIS, JUAN CARLOS",SI
FP,"MOYANO DELGADO, MARTHA LUPE",SI
RP,"MUÑANTE BARRIOS, ALEJANDRO",AUSENTE
NA,"MÁLAGA TRILLO, GEORGE EDWARD",ABSTENCION
FP,"OBANDO MORGAN, AURISTELA ANA",LICENCIA_POR_ENFERMEDAD
FP,"OLIVOS MARTÍNEZ, VIVIAN",SI
NA,"PABLO MEDINA, FLOR AIDEE",SI
RP,"PADILLA ROMERO, JAVIER ROMMEL",SI
PL,"PALACIOS HUÁMAN, MARGOT",SI
BM,"PAREDES CASTRO, FRANCIS JHASMINA",LICENCIA_POR_ENFERMEDAD
AP,"PAREDES FONSECA, KAROL IVETT",AUSENTE
BM,"PAREDES GONZALES, ALEX ANTONIO",SI
NA,"PAREDES PIQUÉ, SUSEL ANA MARÍA",AUSENTE
PL,"PARIONA SINCHE, ALFREDO",SI
SP,"PAZO NUNURA, JOSE BERNARDO",LICENCIA_POR_ENFERMEDAD
NA,"PICÓN QUEDO, LUIS RAÚL",SI
PL,"PORTALATINO ÁVALOS, KELLY ROXANA",SI
AP,"PORTERO LÓPEZ, HILDA MARLENY",SI
BM,"QUIROZ BARBOZA, SEGUNDO TEODOMIRO",SI
PL,"QUISPE MAMANI, WILSON RUSBEL",SI
PL,"QUITO SARMIENTO, BERNARDO JAIME",SI
FP,"RAMÍREZ GARCÍA, TANIA ESTEFANY",SI
FP,"REVILLA VILLANUEVA, CÉSAR MANUEL",SI
PL,"REYES CAM, ABEL AUGUSTO",SI
CD-JPP,"REYMUNDO MERCADO, EDGARD CORNELIO",SI
PL,"RIVAS CHACARA, JANET MILAGROS",SI
PL,"ROBLES ARAUJO, SILVANA EMPERATRIZ",LICENCIA_POR_ENFERMEDAD
APP,"RUÍZ RODRÍGUEZ, MAGALY ROSMERY",SI
SP,"SAAVEDRA CASTERNOQUE, HITLER",AUSENTE
APP,"SALHUANA CAVIDES, EDUARDO",SI
AP,"SOTO PALACIOS, WILSON",LICENCIA_POR_ENFERMEDAD
APP,"SOTO REYES, ALEJANDRO",SI
CD-JPP,"SÁNCHEZ PALOMINO, ROBERTO HELBERT",SI
BM,"TACURI VALDIVIA, GERMÁN ADOLFO",SI
PL,"TAIPE CORONADO, MARÍA ELIZABETH",SI
BM,"TELLO MONTES, NIVARDO EDGAR",SI
APP,"TORRES SALINAS, ROSIO",AUSENTE
APP,"TRIGOZO REÁTEGUI, CHERYL",SI
AP-PIS,"TUDELA GUTIÉRREZ, ADRIANA JOSEFINA",ABSTENCION
NA,"UGARTE MAMANI, JHAKELINE KATY",SI
SP,"VALER PINTO, HÉCTOR",SI
PB,"VARAS MELÉNDEZ, ELÍAS MARCIAL",SI
FP,"VENTURA ANGEL, HÉCTOR JOSÉ",SI
AP,"VERGARA MENDOZA, ELVIS HERNÁN",SI
BM,"VÁSQUEZ VELA, LUCINDA",SI
AP-PIS,"WILLIAMS ZAPATA, JOSÉ DANIEL",SIN_RESPONDER
NA,"WONG PUJADA, ENRIQUE",SUSPENDIDO
AP-PIS,"YARROW LUMBRERAS, NORMA MARTINA",SI
NA,"ZEA CHOQUECHAMBI, OSCAR",LICENCIA_POR_ENFERMEDAD
RP,"ZEBALLOS APONTE, JORGE ARTURO",AUSENTE
PP,"ZEBALLOS MADARIAGA, CARLOS JAVIER",SI
FP,"ZETA CHUNGA, CRUZ MARÍA",NO