grupo_parlamentario,congresista,votacion
APP,"ACUÑA PERALTA, MARÍA GRIMANEZA",NO
APP,"ACUÑA PERALTA, SEGUNDO HÉCTOR",NO
FP,"AGUINAGA RECUENCO, ALEJANDRO AURELIO",NO
PL,"AGÜERO GUTIÉRREZ, MARÍA ANTONIETA",SI
SP,"ALCARRAZ AGUERO, YOREL KIRA",SI
FP,"ALEGRÍA GARCÍA, ARTURO",NO
AP,"ALVA PRIETO, MARÍA DEL CARMEN",SIN_RESPONDER
AP,"ALVA ROJAS, CARLOS ENRIQUE",NO
AP-PIS,"AMURUZ DULANTO, YESSICA ROSSELLI",SI
PP,"ANDERSON RAMÍREZ, CARLOS ANTONIO",NO
AP,"ARAGÓN CARREÑO, LUIS ÁNGEL",NO
AP,"ARRIOLA TUEROS, JOSÉ ALBERTO",NO
SP,"AZURÍN LOAYZA, ALFREDO",SI
PL,"BALCÁZAR ZELADA, JOSÉ MARÍA",SI
FP,"BARBARÁN REYES, ROSANGELLA ANDREA",NO
AP-PIS,"BAZÁN CALDERÓN, DIEGO ALONSO FERNANDO",SI
JP,"BAZÁN NARRO, SIGRID TESORO",NO
PL,"BELLIDO UGARTE, GUIDO",SI
PD,"BERMEJO ROJAS, GUILLERMO",NO
AP-PIS,"BURGOS OLIVEROS, JUAN BARTOLOMÉ",SI
FP,"BUSTAMANTE DONAYRE, ERNESTO",NO
PP,"CALLE LOBATÓN, DIGNA",AUSENTE
APP,"CAMONES SORIANO, LADY MERCEDES",NO
FP,"CASTILLO RIVAS, EDUARDO ENRIQUE",NO
AP-PIS,"CAVERO ALVA, ALEJANDRO ENRIQUE",SI
PL,"CERRÓN ROJAS, WALDEMAR JOSÉ",SI
FP,"CHACÓN TRUJILLO, NILZA MERLY",NO
APP,"CHIABRA LEÓN, ROBERTO ENRIQUE",NO
AP-PIS,"CHIRINOS VENEGAS, PATRICIA ROSA",SI
PD,"CHÁVEZ CHINO, BETSSY BETZABET",LICENCIA_OFICIAL
RP,"CICCIA VÁSQUEZ, MIGUEL ANGEL",NO
PL,"COAYLA JUÁREZ, JORGE SAMUEL",SI
FP,"CORDERO JON TAY, LUIS GUSTAVO",NO
FP,"CORDERO JON TAY, MARÍA DEL PILAR",NO
JP,"CORTEZ AGUIRRE, ISABEL",NO
PL,"CRUZ MAMANI, FLAVIO",SI
RP,"CUETO ASERVI, JOSÉ ERNESTO",NO
PL,"CUTIPA CCAMA, VÍCTOR RAÚL",SI
AP-PIS,"CÓRDOVA LOBATÓN, MARÍA JESSICA",SI
AP,"DOROTEO CARBAJO, RAÚL FELIPE",NO
PL,"DÁVILA ATANACIO, PASIÓN NEOMIAS",SI
APP,"DÍAZ MONAGO, FREDDY RONALD",LICENCIA_POR_ENFERMEDAD
APP,"ECHAÍZ DE NÚÑEZ IZAGA, GLADYS MARGOT",SI
PD,"ECHEVERRÍA RODRÍGUEZ, HAMLET",NO
SP,"ELERA GARCÍA, WILMAR ALBERTO",SI
PP,"ELÍAS ÁVALOS, JOSÉ LUIS",AUSENTE
AP,"ESPINOZA VARGAS, JHAEC DARWIN",NO
AP,"FLORES ANCACHI, JORGE LUIS",NO
PL,"FLORES RAMÍREZ, ALEX RANDU",SI
FP,"FLORES RUÍZ, VÍCTOR SEFERINO",NO
APP,"GARCÍA CORREA, IDELSO MANUEL",NO
PL,"GONZA CASTILLO, AMERICO",SI
AP-PIS,"GONZALES DELGADO, DIANA CAROLINA",SI
FP,"GUERRA GARCÍA, CAMPOS HERNANDO",NO
PL,"GUTIÉRREZ TICONA, PAUL SILVIO",AUSENTE
RP,"HERRERA MEDINA, NOELIA ROSSVITH",SI
FP,"HUAMÁN CORONADO, RAÚL",NO
FP,"INFANTES CASTAÑEDA, MERY ELIANA",NO
SP,"JERI ORÉ, JOSÉ ENRIQUE",SI
FP,"JIMÉNEZ HEREDIA, DAVID JULIO",NO
APP,"JULON IRIGOIN, ELVA EDHIT",AUSENTE
APP,"JUÁREZ CALLE, HEIDY LISBETH",SI
FP,"JUÁREZ GALLEGOS, CARMEN PATRICIA",NO
RP,"JÁUREGUI MARTÍNEZ DE AGUAYO, MARÍA DE LOS MILAGROS JACKELINE",NO
PD,"KAMICHE MORANTE, LUIS ROBERTO",LICENCIA_POR_ENFERMEDAD
PD,"LIMACHI QUISPE, NIEVES ESMERALDA",NO
FP,"LIZARZABURU LIZARZABURU, JUAN CARLOS MARTIN",NO
PP,"LUNA GÁLVEZ, JOSÉ LEÓN",NO
JP,"LUQUE IBARRA, RUTH",NO
FP,"LÓPEZ MORALES, JENY LUZ",NO
AP,"LÓPEZ UREÑA, ILICH FREDY",NO
PL,"MARTICORENA MENDOZA, JORGE ALFONSO",SI
AP,"MARTÍNEZ TALAVERA, PEDRO EDWIN",NO
PL,"MEDINA HERMOSILLA, ELIZABETH SARA",SI
RP,"MEDINA MINAYA, ESDRAS RICARDO",NO
PL,"MONTALVO CUBAS, SEGUNDO TORIBIO",SI
AP,"MONTEZA FACHO, SILVIA MARÍA",NO
RP,"MONTOYA MANRIQUE, JORGE CARLOS",SIN_RESPONDER
FP,"MORANTE FIGARI, JORGE ALBERTO",NO
AP,"MORI CELIS, JUAN CARLOS",NO
FP,"MOYANO DELGADO, MARTHA LUPE",NO
RP,"MUÑANTE BARRIOS, ALEJANDRO",ABSTENCION
NA,"MÁLAGA TRILLO, GEORGE EDWARD",AUSENTE
FP,"OBANDO MORGAN, AURISTELA ANA",NO
FP,"OLIVOS MARTÍNEZ, VIVIAN",NO
NA,"PABLO MEDINA, FLOR AIDEE",NO
RP,"PADILLA ROMERO, JAVIER ROMMEL",NO
PL,"PALACIOS HUÁMAN, MARGOT",SI
PL,"PAREDES CASTRO, FRANCIS JHASMINA",SI
AP,"PAREDES FONSECA, KAROL IVETT",NO
PL,"PAREDES GONZALES, ALEX ANTONIO",SI
NA,"PAREDES PIQUÉ, SUSEL ANA MARÍA",NO
PL,"PARIONA SINCHE, ALFREDO",SI
APP,"PICÓN QUEDO, LUIS RAÚL",SI
PL,"PORTALATINO ÁVALOS, KELLY ROXANA",AUSENTE
AP,"PORTERO LÓPEZ, HILDA MARLENY",NO
PL,"QUIROZ BARBOZA, SEGUNDO TEODOMIRO",LICENCIA_PERSONAL
PL,"QUISPE MAMANI, WILSON RUSBEL",SI
PL,"QUITO SARMIENTO, BERNARDO JAIME",SI
FP,"RAMÍREZ GARCÍA, TANIA ESTEFANY",NO
FP,"REVILLA VILLANUEVA, CÉSAR MANUEL",NO
PL,"REYES CAM, ABEL AUGUSTO",AUSENTE
JP,"REYMUNDO MERCADO, EDGARD CORNELIO",NO
PL,"RIVAS CHACARA, JANET MILAGROS",SI
PL,"ROBLES ARAUJO, SILVANA EMPERATRIZ",SI
APP,"RUÍZ RODRÍGUEZ, MAGALY ROSMERY",NO
SP,"SAAVEDRA CASTERNOQUE, HITLER",SI
APP,"SALHUANA CAVIDES, EDUARDO",NO
AP,"SOTO PALACIOS, WILSON",NO
APP,"SOTO REYES, ALEJANDRO",NO
JP,"SÁNCHEZ PALOMINO, ROBERTO HELBERT",NO
PL,"TACURI VALDIVIA, GERMÁN ADOLFO",SI
PL,"TAIPE CORONADO, MARÍA ELIZABETH",LICENCIA_POR_ENFERMEDAD
PL,"TELLO MONTES, NIVARDO EDGAR",SI
APP,"TORRES SALINAS, ROSIO",NO
APP,"TRIGOZO REÁTEGUI, CHERYL",AUSENTE
AP-PIS,"TUDELA GUTIÉRREZ, ADRIANA JOSEFINA",SI
PL,"UGARTE MAMANI, JHAKELINE KATY",SI
PD,"VALER PINTO, HÉCTOR",NO
PL,"VARAS MELÉNDEZ, ELÍAS MARCIAL",SI
FP,"VENTURA ANGEL, HÉCTOR JOSÉ",NO
AP,"VERGARA MENDOZA, ELVIS HERNÁN",LICENCIA_OFICIAL
PL,"VÁSQUEZ VELA, LUCINDA",SI
AP-PIS,"WILLIAMS ZAPATA, JOSÉ DANIEL",SI
PP,"WONG PUJADA, ENRIQUE",NO
AP-PIS,"YARROW LUMBRERAS, NORMA MARTINA",SI
PL,"ZEA CHOQUECHAMBI, OSCAR",SI
RP,"ZEBALLOS APONTE, JORGE ARTURO",NO
PD,"ZEBALLOS MADARIAGA, CARLOS JAVIER",NO
FP,"ZETA CHUNGA, CRUZ MARÍA",NO