grupo_parlamentario,congresista,asistencia
APP,"ACUÑA PERALTA, MARÍA GRIMANEZA",PRESENTE
UDP,"ACUÑA PERALTA, SEGUNDO HÉCTOR",PRESENTE
FP,"AGUINAGA RECUENCO, ALEJANDRO AURELIO",AUSENTE
PL,"AGÜERO GUTIÉRREZ, MARÍA ANTONIETA",AUSENTE
PP,"ALCARRAZ AGUERO, YOREL KIRA",AUSENTE
FP,"ALEGRÍA GARCÍA, ARTURO",PRESENTE
NA,"ALVA PRIETO, MARÍA DEL CARMEN",AUSENTE
NA,"ALVA ROJAS, CARLOS ENRIQUE",PRESENTE
AP-PIS,"AMURUZ DULANTO, YESSICA ROSSELLI",PRESENTE
NA,"ANDERSON RAMÍREZ, CARLOS ANTONIO",AUSENTE
AP,"ARAGÓN CARREÑO, LUIS ÁNGEL",PRESENTE
NA,"ARRIOLA TUEROS, JOSÉ ALBERTO",PRESENTE
SP,"AZURÍN LOAYZA, ALFREDO",PRESENTE
PB,"BALCÁZAR ZELADA, JOSÉ MARÍA",PRESENTE
FP,"BARBARÁN REYES, ROSANGELLA ANDREA",AUSENTE
AP-PIS,"BAZÁN CALDERÓN, DIEGO ALONSO FERNANDO",AUSENTE
CD-JPP,"BAZÁN NARRO, SIGRID TESORO",PRESENTE
PB,"BELLIDO UGARTE, GUIDO",PRESENTE
CD-JPP,"BERMEJO ROJAS, GUILLERMO",AUSENTE
UDP,"BURGOS OLIVEROS, JUAN BARTOLOMÉ",PRESENTE
FP,"BUSTAMANTE DONAYRE, ERNESTO",PRESENTE
PP,"CALLE LOBATÓN, DIGNA",PRESENTE
APP,"CAMONES SORIANO, LADY MERCEDES",AUSENTE
FP,"CASTILLO RIVAS, EDUARDO ENRIQUE",PRESENTE
AP-PIS,"CAVERO ALVA, ALEJANDRO ENRIQUE",PRESENTE
PL,"CERRÓN ROJAS, WALDEMAR JOSÉ",LICENCIA_POR_ENFERMEDAD
FP,"CHACÓN TRUJILLO, NILZA MERLY",AUSENTE
APP,"CHIABRA LEÓN, ROBERTO ENRIQUE",PRESENTE
AP-PIS,"CHIRINOS VENEGAS, PATRICIA ROSA",AUSENTE
RP,"CICCIA VÁSQUEZ, MIGUEL ANGEL",PRESENTE
PB,"COAYLA JUÁREZ, JORGE SAMUEL",PRESENTE
UDP,"CORDERO JON TAY, LUIS GUSTAVO",PRESENTE
NA,"CORDERO JON TAY, MARÍA DEL PILAR",AUSENTE
CD-JPP,"CORTEZ AGUIRRE, ISABEL",PRESENTE
PL,"CRUZ MAMANI, FLAVIO",PRESENTE
RP,"CUETO ASERVI, JOSÉ ERNESTO",PRESENTE
NA,"CUTIPA CCAMA, VÍCTOR RAÚL",PRESENTE
AP-PIS,"CÓRDOVA LOBATÓN, MARÍA JESSICA",PRESENTE
AP,"DOROTEO CARBAJO, RAÚL FELIPE",PRESENTE
BM,"DÁVILA ATANACIO, PASIÓN NEOMIAS",AUSENTE
RP,"ECHAÍZ DE NÚÑEZ IZAGA, GLADYS MARGOT",PRESENTE
CD-JPP,"ECHEVERRÍA RODRÍGUEZ, HAMLET",PRESENTE
PP,"ELÍAS ÁVALOS, JOSÉ LUIS",PRESENTE
AP,"ESPINOZA VARGAS, JHAEC DARWIN",AUSENTE
AP,"FLORES ANCACHI, JORGE LUIS",PRESENTE
NA,"FLORES RAMÍREZ, ALEX RANDU",PRESENTE
FP,"FLORES RUÍZ, VÍCTOR SEFERINO",AUSENTE
APP,"GARCÍA CORREA, IDELSO MANUEL",PRESENTE
PL,"GONZA CASTILLO, AMERICO",AUSENTE
AP-PIS,"GONZALES DELGADO, DIANA CAROLINA",PRESENTE
FP,"GUERRA GARCÍA, CAMPOS HERNANDO",AUSENTE
BM,"GUTIÉRREZ TICONA, PAUL SILVIO",AUSENTE
APP,"HEIDINGER BALLESTEROS, NELCY",PRESENTE
RP,"HERRERA MEDINA, NOELIA ROSSVITH",PRESENTE
FP,"HUAMÁN CORONADO, RAÚL",PRESENTE
FP,"INFANTES CASTAÑEDA, MERY ELIANA",PRESENTE
SP,"JERI ORÉ, JOSÉ ENRIQUE",PRESENTE
FP,"JIMÉNEZ HEREDIA, DAVID JULIO",AUSENTE
APP,"JULON IRIGOIN, ELVA EDHIT",AUSENTE
PP,"JUÁREZ CALLE, HEIDY LISBETH",PRESENTE
FP,"JUÁREZ GALLEGOS, CARMEN PATRICIA",PRESENTE
RP,"JÁUREGUI MARTÍNEZ DE AGUAYO, MARÍA DE LOS MILAGROS JACKELINE",PRESENTE
CD-JPP,"KAMICHE MORANTE, LUIS ROBERTO",PRESENTE
CD-JPP,"LIMACHI QUISPE, NIEVES ESMERALDA",AUSENTE
FP,"LIZARZABURU LIZARZABURU, JUAN CARLOS MARTIN",PRESENTE
PP,"LUNA GÁLVEZ, JOSÉ LEÓN",AUSENTE
CD-JPP,"LUQUE IBARRA, RUTH",PRESENTE
FP,"LÓPEZ MORALES, JENY LUZ",PRESENTE
NA,"LÓPEZ UREÑA, ILICH FREDY",AUSENTE
PB,"MARTICORENA MENDOZA, JORGE ALFONSO",AUSENTE
NA,"MARTÍNEZ TALAVERA, PEDRO EDWIN",PRESENTE
BM,"MEDINA HERMOSILLA, ELIZABETH SARA",PRESENTE
UDP,"MEDINA MINAYA, ESDRAS RICARDO",PRESENTE
PL,"MITA ALANOCA, ISAAC",PRESENTE
PL,"MONTALVO CUBAS, SEGUNDO TORIBIO",AUSENTE
NA,"MONTEZA FACHO, SILVIA MARÍA",AUSENTE
RP,"MONTOYA MANRIQUE, JORGE CARLOS",PRESENTE
FP,"MORANTE FIGARI, JORGE ALBERTO",PRESENTE
NA,"MORI CELIS, JUAN CARLOS",AUSENTE
FP,"MOYANO DELGADO, MARTHA LUPE",PRESENTE
RP,"MUÑANTE BARRIOS, ALEJANDRO",PRESENTE
NA,"MÁLAGA TRILLO, GEORGE EDWARD",PRESENTE
FP,"OBANDO MORGAN, AURISTELA ANA",PRESENTE
FP,"OLIVOS MARTÍNEZ, VIVIAN",AUSENTE
NA,"PABLO MEDINA, FLOR AIDEE",AUSENTE
RP,"PADILLA ROMERO, JAVIER ROMMEL",PRESENTE
PL,"PALACIOS HUÁMAN, MARGOT",AUSENTE
PP,"PAREDES CASTRO, FRANCIS JHASMINA",PRESENTE
NA,"PAREDES FONSECA, KAROL IVETT",PRESENTE
BM,"PAREDES GONZALES, ALEX ANTONIO",PRESENTE
CD-JPP,"PAREDES PIQUÉ, SUSEL ANA MARÍA",LICENCIA_POR_ENFERMEDAD
NA,"PARIONA SINCHE, ALFREDO",PRESENTE
SP,"PAZO NUNURA, JOSE BERNARDO",AUSENTE
PP,"PICÓN QUEDO, LUIS RAÚL",AUSENTE
PL,"PORTALATINO ÁVALOS, KELLY ROXANA",PRESENTE
AP,"PORTERO LÓPEZ, HILDA MARLENY",PRESENTE
BM,"QUIROZ BARBOZA, SEGUNDO TEODOMIRO",PRESENTE
PL,"QUISPE MAMANI, WILSON RUSBEL",AUSENTE
NA,"QUITO SARMIENTO, BERNARDO JAIME",AUSENTE
FP,"RAMÍREZ GARCÍA, TANIA ESTEFANY",PRESENTE
FP,"REVILLA VILLANUEVA, CÉSAR MANUEL",AUSENTE
PL,"REYES CAM, ABEL AUGUSTO",AUSENTE
CD-JPP,"REYMUNDO MERCADO, EDGARD CORNELIO",AUSENTE
PL,"RIVAS CHACARA, JANET MILAGROS",AUSENTE
NA,"ROBLES ARAUJO, SILVANA EMPERATRIZ",AUSENTE
APP,"RUÍZ RODRÍGUEZ, MAGALY ROSMERY",PRESENTE
SP,"SAAVEDRA CASTERNOQUE, HITLER",PRESENTE
APP,"SALHUANA CAVIDES, EDUARDO",AUSENTE
AP,"SOTO PALACIOS, WILSON",AUSENTE
APP,"SOTO REYES, ALEJANDRO",PRESENTE
CD-JPP,"SÁNCHEZ PALOMINO, ROBERTO HELBERT",PRESENTE
BM,"TACURI VALDIVIA, GERMÁN ADOLFO",AUSENTE
PL,"TAIPE CORONADO, MARÍA ELIZABETH",AUSENTE
BM,"TELLO MONTES, NIVARDO EDGAR",AUSENTE
APP,"TORRES SALINAS, ROSIO",AUSENTE
APP,"TRIGOZO REÁTEGUI, CHERYL",AUSENTE
AP-PIS,"TUDELA GUTIÉRREZ, ADRIANA JOSEFINA",AUSENTE
UDP,"UGARTE MAMANI, JHAKELINE KATY",AUSENTE
SP,"VALER PINTO, HÉCTOR",PRESENTE
PB,"VARAS MELÉNDEZ, ELÍAS MARCIAL",AUSENTE
FP,"VENTURA ANGEL, HÉCTOR JOSÉ",PRESENTE
AP,"VERGARA MENDOZA, ELVIS HERNÁN",AUSENTE
BM,"VÁSQUEZ VELA, LUCINDA",PRESENTE
AP-PIS,"WILLIAMS ZAPATA, JOSÉ DANIEL",PRESENTE
PP,"WONG PUJADA, ENRIQUE",AUSENTE
AP-PIS,"YARROW LUMBRERAS, NORMA MARTINA",PRESENTE
BM,"ZEA CHOQUECHAMBI, OSCAR",AUSENTE
RP,"ZEBALLOS APONTE, JORGE ARTURO",PRESENTE
PP,"ZEBALLOS MADARIAGA, CARLOS JAVIER",PRESENTE
FP,"ZETA CHUNGA, CRUZ MARÍA",AUSENTE