grupo_parlamentario,congresista,asistencia
APP,"ACUÑA PERALTA, MARÍA GRIMANEZA",PRESENTE
APP,"ACUÑA PERALTA, SEGUNDO HÉCTOR",PRESENTE
FP,"AGUINAGA RECUENCO, ALEJANDRO AURELIO",AUSENTE
PL,"AGÜERO GUTIÉRREZ, MARÍA ANTONIETA",LICENCIA_POR_ENFERMEDAD
SP,"ALCARRAZ AGUERO, YOREL KIRA",PRESENTE
FP,"ALEGRÍA GARCÍA, ARTURO",AUSENTE
AP,"ALVA PRIETO, MARÍA DEL CARMEN",AUSENTE
AP,"ALVA ROJAS, CARLOS ENRIQUE",AUSENTE
AP-PIS,"AMURUZ DULANTO, YESSICA ROSSELLI",PRESENTE
NA,"ANDERSON RAMÍREZ, CARLOS ANTONIO",AUSENTE
AP,"ARAGÓN CARREÑO, LUIS ÁNGEL",AUSENTE
AP,"ARRIOLA TUEROS, JOSÉ ALBERTO",PRESENTE
SP,"AZURÍN LOAYZA, ALFREDO",PRESENTE
PL,"BALCÁZAR ZELADA, JOSÉ MARÍA",AUSENTE
FP,"BARBARÁN REYES, ROSANGELLA ANDREA",PRESENTE
AP-PIS,"BAZÁN CALDERÓN, DIEGO ALONSO FERNANDO",PRESENTE
CD,"BAZÁN NARRO, SIGRID TESORO",AUSENTE
PL,"BELLIDO UGARTE, GUIDO",PRESENTE
PD,"BERMEJO ROJAS, GUILLERMO",PRESENTE
AP-PIS,"BURGOS OLIVEROS, JUAN BARTOLOMÉ",PRESENTE
FP,"BUSTAMANTE DONAYRE, ERNESTO",PRESENTE
NA,"CALLE LOBATÓN, DIGNA",PRESENTE
APP,"CAMONES SORIANO, LADY MERCEDES",PRESENTE
FP,"CASTILLO RIVAS, EDUARDO ENRIQUE",PRESENTE
AP-PIS,"CAVERO ALVA, ALEJANDRO ENRIQUE",PRESENTE
PL,"CERRÓN ROJAS, WALDEMAR JOSÉ",AUSENTE
FP,"CHACÓN TRUJILLO, NILZA MERLY",PRESENTE
APP,"CHIABRA LEÓN, ROBERTO ENRIQUE",PRESENTE
AP-PIS,"CHIRINOS VENEGAS, PATRICIA ROSA",PRESENTE
PD,"CHÁVEZ CHINO, BETSSY BETZABET",LICENCIA_OFICIAL
RP,"CICCIA VÁSQUEZ, MIGUEL ANGEL",PRESENTE
PL,"COAYLA JUÁREZ, JORGE SAMUEL",PRESENTE
FP,"CORDERO JON TAY, LUIS GUSTAVO",PRESENTE
FP,"CORDERO JON TAY, MARÍA DEL PILAR",AUSENTE
CD,"CORTEZ AGUIRRE, ISABEL",PRESENTE
PL,"CRUZ MAMANI, FLAVIO",PRESENTE
RP,"CUETO ASERVI, JOSÉ ERNESTO",PRESENTE
PL,"CUTIPA CCAMA, VÍCTOR RAÚL",AUSENTE
AP-PIS,"CÓRDOVA LOBATÓN, MARÍA JESSICA",PRESENTE
AP,"DOROTEO CARBAJO, RAÚL FELIPE",PRESENTE
PL,"DÁVILA ATANACIO, PASIÓN NEOMIAS",AUSENTE
APP,"DÍAZ MONAGO, FREDDY RONALD",PRESENTE
APP,"ECHAÍZ DE NÚÑEZ IZAGA, GLADYS MARGOT",PRESENTE
PD,"ECHEVERRÍA RODRÍGUEZ, HAMLET",PRESENTE
SP,"ELERA GARCÍA, WILMAR ALBERTO",AUSENTE
NA,"ELÍAS ÁVALOS, JOSÉ LUIS",AUSENTE
AP,"ESPINOZA VARGAS, JHAEC DARWIN",PRESENTE
AP,"FLORES ANCACHI, JORGE LUIS",PRESENTE
PL,"FLORES RAMÍREZ, ALEX RANDU",AUSENTE
FP,"FLORES RUÍZ, VÍCTOR SEFERINO",PRESENTE
APP,"GARCÍA CORREA, IDELSO MANUEL",PRESENTE
PL,"GONZA CASTILLO, AMERICO",AUSENTE
AP-PIS,"GONZALES DELGADO, DIANA CAROLINA",PRESENTE
FP,"GUERRA GARCÍA, CAMPOS HERNANDO",PRESENTE
PL,"GUTIÉRREZ TICONA, PAUL SILVIO",AUSENTE
RP,"HERRERA MEDINA, NOELIA ROSSVITH",PRESENTE
FP,"HUAMÁN CORONADO, RAÚL",PRESENTE
FP,"INFANTES CASTAÑEDA, MERY ELIANA",PRESENTE
SP,"JERI ORÉ, JOSÉ ENRIQUE",AUSENTE
FP,"JIMÉNEZ HEREDIA, DAVID JULIO",PRESENTE
APP,"JULON IRIGOIN, ELVA EDHIT",LICENCIA_OFICIAL
APP,"JUÁREZ CALLE, HEIDY LISBETH",PRESENTE
FP,"JUÁREZ GALLEGOS, CARMEN PATRICIA",PRESENTE
RP,"JÁUREGUI MARTÍNEZ DE AGUAYO, MARÍA DE LOS MILAGROS JACKELINE",PRESENTE
PD,"KAMICHE MORANTE, LUIS ROBERTO",LICENCIA_POR_ENFERMEDAD
PD,"LIMACHI QUISPE, NIEVES ESMERALDA",PRESENTE
FP,"LIZARZABURU LIZARZABURU, JUAN CARLOS MARTIN",AUSENTE
NA,"LUNA GÁLVEZ, JOSÉ LEÓN",AUSENTE
CD,"LUQUE IBARRA, RUTH",PRESENTE
FP,"LÓPEZ MORALES, JENY LUZ",PRESENTE
AP,"LÓPEZ UREÑA, ILICH FREDY",AUSENTE
PL,"MARTICORENA MENDOZA, JORGE ALFONSO",PRESENTE
AP,"MARTÍNEZ TALAVERA, PEDRO EDWIN",PRESENTE
PL,"MEDINA HERMOSILLA, ELIZABETH SARA",PRESENTE
RP,"MEDINA MINAYA, ESDRAS RICARDO",PRESENTE
PL,"MONTALVO CUBAS, SEGUNDO TORIBIO",PRESENTE
AP,"MONTEZA FACHO, SILVIA MARÍA",AUSENTE
RP,"MONTOYA MANRIQUE, JORGE CARLOS",PRESENTE
FP,"MORANTE FIGARI, JORGE ALBERTO",LICENCIA_POR_ENFERMEDAD
AP,"MORI CELIS, JUAN CARLOS",PRESENTE
FP,"MOYANO DELGADO, MARTHA LUPE",PRESENTE
RP,"MUÑANTE BARRIOS, ALEJANDRO",LICENCIA_OFICIAL
NA,"MÁLAGA TRILLO, GEORGE EDWARD",AUSENTE
FP,"OBANDO MORGAN, AURISTELA ANA",PRESENTE
FP,"OLIVOS MARTÍNEZ, VIVIAN",AUSENTE
NA,"PABLO MEDINA, FLOR AIDEE",PRESENTE
RP,"PADILLA ROMERO, JAVIER ROMMEL",PRESENTE
PL,"PALACIOS HUÁMAN, MARGOT",AUSENTE
PL,"PAREDES CASTRO, FRANCIS JHASMINA",PRESENTE
AP,"PAREDES FONSECA, KAROL IVETT",PRESENTE
PL,"PAREDES GONZALES, ALEX ANTONIO",PRESENTE
NA,"PAREDES PIQUÉ, SUSEL ANA MARÍA",AUSENTE
PL,"PARIONA SINCHE, ALFREDO",PRESENTE
NA,"PICÓN QUEDO, LUIS RAÚL",AUSENTE
PL,"PORTALATINO ÁVALOS, KELLY ROXANA",AUSENTE
AP,"PORTERO LÓPEZ, HILDA MARLENY",PRESENTE
PL,"QUIROZ BARBOZA, SEGUNDO TEODOMIRO",AUSENTE
PL,"QUISPE MAMANI, WILSON RUSBEL",AUSENTE
PL,"QUITO SARMIENTO, BERNARDO JAIME",PRESENTE
FP,"RAMÍREZ GARCÍA, TANIA ESTEFANY",PRESENTE
FP,"REVILLA VILLANUEVA, CÉSAR MANUEL",PRESENTE
PL,"REYES CAM, ABEL AUGUSTO",PRESENTE
CD,"REYMUNDO MERCADO, EDGARD CORNELIO",PRESENTE
PL,"RIVAS CHACARA, JANET MILAGROS",PRESENTE
PL,"ROBLES ARAUJO, SILVANA EMPERATRIZ",PRESENTE
APP,"RUÍZ RODRÍGUEZ, MAGALY ROSMERY",PRESENTE
SP,"SAAVEDRA CASTERNOQUE, HITLER",PRESENTE
APP,"SALHUANA CAVIDES, EDUARDO",PRESENTE
AP,"SOTO PALACIOS, WILSON",PRESENTE
APP,"SOTO REYES, ALEJANDRO",PRESENTE
CD,"SÁNCHEZ PALOMINO, ROBERTO HELBERT",LICENCIA_OFICIAL
PL,"TACURI VALDIVIA, GERMÁN ADOLFO",AUSENTE
PL,"TAIPE CORONADO, MARÍA ELIZABETH",PRESENTE
PL,"TELLO MONTES, NIVARDO EDGAR",PRESENTE
APP,"TORRES SALINAS, ROSIO",PRESENTE
APP,"TRIGOZO REÁTEGUI, CHERYL",PRESENTE
AP-PIS,"TUDELA GUTIÉRREZ, ADRIANA JOSEFINA",AUSENTE
PL,"UGARTE MAMANI, JHAKELINE KATY",AUSENTE
PD,"VALER PINTO, HÉCTOR",PRESENTE
PL,"VARAS MELÉNDEZ, ELÍAS MARCIAL",PRESENTE
FP,"VENTURA ANGEL, HÉCTOR JOSÉ",PRESENTE
AP,"VERGARA MENDOZA, ELVIS HERNÁN",AUSENTE
PL,"VÁSQUEZ VELA, LUCINDA",LICENCIA_OFICIAL
AP-PIS,"WILLIAMS ZAPATA, JOSÉ DANIEL",AUSENTE
NA,"WONG PUJADA, ENRIQUE",AUSENTE
AP-PIS,"YARROW LUMBRERAS, NORMA MARTINA",LICENCIA_OFICIAL
PL,"ZEA CHOQUECHAMBI, OSCAR",LICENCIA_OFICIAL
RP,"ZEBALLOS APONTE, JORGE ARTURO",AUSENTE
PD,"ZEBALLOS MADARIAGA, CARLOS JAVIER",PRESENTE
FP,"ZETA CHUNGA, CRUZ MARÍA",PRESENTE