grupo_parlamentario,congresista,asistencia
APP,"ACUÑA PERALTA, MARÍA GRIMANEZA",PRESENTE
NA,"ACUÑA PERALTA, SEGUNDO HÉCTOR",PRESENTE
FP,"AGUINAGA RECUENCO, ALEJANDRO AURELIO",PRESENTE
PL,"AGÜERO GUTIÉRREZ, MARÍA ANTONIETA",AUSENTE
PP,"ALCARRAZ AGUERO, YOREL KIRA",PRESENTE
FP,"ALEGRÍA GARCÍA, ARTURO",PRESENTE
AP,"ALVA PRIETO, MARÍA DEL CARMEN",PRESENTE
NA,"ALVA ROJAS, CARLOS ENRIQUE",AUSENTE
AP-PIS,"AMURUZ DULANTO, YESSICA ROSSELLI",AUSENTE
NA,"ANDERSON RAMÍREZ, CARLOS ANTONIO",AUSENTE
AP,"ARAGÓN CARREÑO, LUIS ÁNGEL",PRESENTE
AP,"ARRIOLA TUEROS, JOSÉ ALBERTO",PRESENTE
SP,"AZURÍN LOAYZA, ALFREDO",PRESENTE
PB,"BALCÁZAR ZELADA, JOSÉ MARÍA",AUSENTE
FP,"BARBARÁN REYES, ROSANGELLA ANDREA",AUSENTE
AP-PIS,"BAZÁN CALDERÓN, DIEGO ALONSO FERNANDO",PRESENTE
CD-JPP,"BAZÁN NARRO, SIGRID TESORO",AUSENTE
PB,"BELLIDO UGARTE, GUIDO",AUSENTE
CD-JPP,"BERMEJO ROJAS, GUILLERMO",PRESENTE
NA,"BURGOS OLIVEROS, JUAN BARTOLOMÉ",PRESENTE
FP,"BUSTAMANTE DONAYRE, ERNESTO",PRESENTE
PP,"CALLE LOBATÓN, DIGNA",LICENCIA_PERSONAL
APP,"CAMONES SORIANO, LADY MERCEDES",AUSENTE
FP,"CASTILLO RIVAS, EDUARDO ENRIQUE",AUSENTE
AP-PIS,"CAVERO ALVA, ALEJANDRO ENRIQUE",PRESENTE
PL,"CERRÓN ROJAS, WALDEMAR JOSÉ",PRESENTE
FP,"CHACÓN TRUJILLO, NILZA MERLY",AUSENTE
APP,"CHIABRA LEÓN, ROBERTO ENRIQUE",PRESENTE
AP-PIS,"CHIRINOS VENEGAS, PATRICIA ROSA",AUSENTE
RP,"CICCIA VÁSQUEZ, MIGUEL ANGEL",AUSENTE
PB,"COAYLA JUÁREZ, JORGE SAMUEL",AUSENTE
FP,"CORDERO JON TAY, LUIS GUSTAVO",AUSENTE
FP,"CORDERO JON TAY, MARÍA DEL PILAR",LICENCIA_POR_ENFERMEDAD
CD-JPP,"CORTEZ AGUIRRE, ISABEL",AUSENTE
PL,"CRUZ MAMANI, FLAVIO",PRESENTE
RP,"CUETO ASERVI, JOSÉ ERNESTO",PRESENTE
PB,"CUTIPA CCAMA, VÍCTOR RAÚL",AUSENTE
AP-PIS,"CÓRDOVA LOBATÓN, MARÍA JESSICA",PRESENTE
AP,"DOROTEO CARBAJO, RAÚL FELIPE",AUSENTE
BM,"DÁVILA ATANACIO, PASIÓN NEOMIAS",SUSPENDIDO
RP,"ECHAÍZ DE NÚÑEZ IZAGA, GLADYS MARGOT",AUSENTE
CD-JPP,"ECHEVERRÍA RODRÍGUEZ, HAMLET",PRESENTE
PP,"ELÍAS ÁVALOS, JOSÉ LUIS",AUSENTE
AP,"ESPINOZA VARGAS, JHAEC DARWIN",AUSENTE
AP,"FLORES ANCACHI, JORGE LUIS",PRESENTE
PL,"FLORES RAMÍREZ, ALEX RANDU",PRESENTE
FP,"FLORES RUÍZ, VÍCTOR SEFERINO",PRESENTE
APP,"GARCÍA CORREA, IDELSO MANUEL",AUSENTE
PL,"GONZA CASTILLO, AMERICO",PRESENTE
AP-PIS,"GONZALES DELGADO, DIANA CAROLINA",PRESENTE
FP,"GUERRA GARCÍA, CAMPOS HERNANDO",PRESENTE
BM,"GUTIÉRREZ TICONA, PAUL SILVIO",PRESENTE
APP,"HEIDINGER BALLESTEROS, NELCY",PRESENTE
RP,"HERRERA MEDINA, NOELIA ROSSVITH",PRESENTE
FP,"HUAMÁN CORONADO, RAÚL",AUSENTE
FP,"INFANTES CASTAÑEDA, MERY ELIANA",PRESENTE
SP,"JERI ORÉ, JOSÉ ENRIQUE",AUSENTE
FP,"JIMÉNEZ HEREDIA, DAVID JULIO",LICENCIA_PERSONAL
APP,"JULON IRIGOIN, ELVA EDHIT",PRESENTE
PP,"JUÁREZ CALLE, HEIDY LISBETH",PRESENTE
FP,"JUÁREZ GALLEGOS, CARMEN PATRICIA",PRESENTE
RP,"JÁUREGUI MARTÍNEZ DE AGUAYO, MARÍA DE LOS MILAGROS JACKELINE",AUSENTE
CD-JPP,"KAMICHE MORANTE, LUIS ROBERTO",PRESENTE
CD-JPP,"LIMACHI QUISPE, NIEVES ESMERALDA",LICENCIA_POR_ENFERMEDAD
FP,"LIZARZABURU LIZARZABURU, JUAN CARLOS MARTIN",PRESENTE
PP,"LUNA GÁLVEZ, JOSÉ LEÓN",AUSENTE
CD-JPP,"LUQUE IBARRA, RUTH",PRESENTE
FP,"LÓPEZ MORALES, JENY LUZ",PRESENTE
AP,"LÓPEZ UREÑA, ILICH FREDY",PRESENTE
PB,"MARTICORENA MENDOZA, JORGE ALFONSO",PRESENTE
AP,"MARTÍNEZ TALAVERA, PEDRO EDWIN",PRESENTE
BM,"MEDINA HERMOSILLA, ELIZABETH SARA",AUSENTE
SP,"MEDINA MINAYA, ESDRAS RICARDO",PRESENTE
PL,"MITA ALANOCA, ISAAC",PRESENTE
PL,"MONTALVO CUBAS, SEGUNDO TORIBIO",AUSENTE
AP,"MONTEZA FACHO, SILVIA MARÍA",AUSENTE
RP,"MONTOYA MANRIQUE, JORGE CARLOS",PRESENTE
FP,"MORANTE FIGARI, JORGE ALBERTO",PRESENTE
AP,"MORI CELIS, JUAN CARLOS",PRESENTE
FP,"MOYANO DELGADO, MARTHA LUPE",PRESENTE
RP,"MUÑANTE BARRIOS, ALEJANDRO",AUSENTE
NA,"MÁLAGA TRILLO, GEORGE EDWARD",PRESENTE
FP,"OBANDO MORGAN, AURISTELA ANA",PRESENTE
FP,"OLIVOS MARTÍNEZ, VIVIAN",PRESENTE
NA,"PABLO MEDINA, FLOR AIDEE",PRESENTE
RP,"PADILLA ROMERO, JAVIER ROMMEL",PRESENTE
PL,"PALACIOS HUÁMAN, MARGOT",AUSENTE
BM,"PAREDES CASTRO, FRANCIS JHASMINA",PRESENTE
AP,"PAREDES FONSECA, KAROL IVETT",PRESENTE
BM,"PAREDES GONZALES, ALEX ANTONIO",PRESENTE
NA,"PAREDES PIQUÉ, SUSEL ANA MARÍA",AUSENTE
PL,"PARIONA SINCHE, ALFREDO",PRESENTE
SP,"PAZO NUNURA, JOSE BERNARDO",LICENCIA_POR_ENFERMEDAD
NA,"PICÓN QUEDO, LUIS RAÚL",PRESENTE
PL,"PORTALATINO ÁVALOS, KELLY ROXANA",AUSENTE
AP,"PORTERO LÓPEZ, HILDA MARLENY",PRESENTE
BM,"QUIROZ BARBOZA, SEGUNDO TEODOMIRO",PRESENTE
PL,"QUISPE MAMANI, WILSON RUSBEL",AUSENTE
PL,"QUITO SARMIENTO, BERNARDO JAIME",PRESENTE
FP,"RAMÍREZ GARCÍA, TANIA ESTEFANY",AUSENTE
FP,"REVILLA VILLANUEVA, CÉSAR MANUEL",AUSENTE
PL,"REYES CAM, ABEL AUGUSTO",PRESENTE
CD-JPP,"REYMUNDO MERCADO, EDGARD CORNELIO",PRESENTE
PL,"RIVAS CHACARA, JANET MILAGROS",AUSENTE
PL,"ROBLES ARAUJO, SILVANA EMPERATRIZ",PRESENTE
APP,"RUÍZ RODRÍGUEZ, MAGALY ROSMERY",AUSENTE
SP,"SAAVEDRA CASTERNOQUE, HITLER",PRESENTE
APP,"SALHUANA CAVIDES, EDUARDO",AUSENTE
AP,"SOTO PALACIOS, WILSON",LICENCIA_POR_ENFERMEDAD
APP,"SOTO REYES, ALEJANDRO",PRESENTE
CD-JPP,"SÁNCHEZ PALOMINO, ROBERTO HELBERT",PRESENTE
BM,"TACURI VALDIVIA, GERMÁN ADOLFO",PRESENTE
PL,"TAIPE CORONADO, MARÍA ELIZABETH",AUSENTE
BM,"TELLO MONTES, NIVARDO EDGAR",LICENCIA_OFICIAL
APP,"TORRES SALINAS, ROSIO",AUSENTE
APP,"TRIGOZO REÁTEGUI, CHERYL",AUSENTE
AP-PIS,"TUDELA GUTIÉRREZ, ADRIANA JOSEFINA",AUSENTE
NA,"UGARTE MAMANI, JHAKELINE KATY",PRESENTE
SP,"VALER PINTO, HÉCTOR",PRESENTE
PB,"VARAS MELÉNDEZ, ELÍAS MARCIAL",AUSENTE
FP,"VENTURA ANGEL, HÉCTOR JOSÉ",AUSENTE
AP,"VERGARA MENDOZA, ELVIS HERNÁN",AUSENTE
BM,"VÁSQUEZ VELA, LUCINDA",PRESENTE
AP-PIS,"WILLIAMS ZAPATA, JOSÉ DANIEL",PRESENTE
NA,"WONG PUJADA, ENRIQUE",SUSPENDIDO
AP-PIS,"YARROW LUMBRERAS, NORMA MARTINA",PRESENTE
NA,"ZEA CHOQUECHAMBI, OSCAR",AUSENTE
RP,"ZEBALLOS APONTE, JORGE ARTURO",PRESENTE
PP,"ZEBALLOS MADARIAGA, CARLOS JAVIER",PRESENTE
FP,"ZETA CHUNGA, CRUZ MARÍA",AUSENTE
