grupo_parlamentario,congresista,votacion
APP,"ACUÑA PERALTA, MARÍA GRIMANEZA",SI
APP,"ACUÑA PERALTA, SEGUNDO HÉCTOR",AUSENTE
FP,"AGUINAGA RECUENCO, ALEJANDRO AURELIO",SI
PL,"AGÜERO GUTIÉRREZ, MARÍA ANTONIETA",SI
SP,"ALCARRAZ AGUERO, YOREL KIRA",SI
FP,"ALEGRÍA GARCÍA, ARTURO",SI
AP,"ALVA PRIETO, MARÍA DEL CARMEN",AUSENTE
AP,"ALVA ROJAS, CARLOS ENRIQUE",SI
AP-PIS,"AMURUZ DULANTO, YESSICA ROSSELLI",AUSENTE
NA,"ANDERSON RAMÍREZ, CARLOS ANTONIO",AUSENTE
AP,"ARAGÓN CARREÑO, LUIS ÁNGEL",AUSENTE
AP,"ARRIOLA TUEROS, JOSÉ ALBERTO",SI
SP,"AZURÍN LOAYZA, ALFREDO",SI
PL,"BALCÁZAR ZELADA, JOSÉ MARÍA",SI
FP,"BARBARÁN REYES, ROSANGELLA ANDREA",SI
AP-PIS,"BAZÁN CALDERÓN, DIEGO ALONSO FERNANDO",SI
CD-JPP,"BAZÁN NARRO, SIGRID TESORO",SI
PL,"BELLIDO UGARTE, GUIDO",AUSENTE
PD,"BERMEJO ROJAS, GUILLERMO",SI
AP-PIS,"BURGOS OLIVEROS, JUAN BARTOLOMÉ",NO
FP,"BUSTAMANTE DONAYRE, ERNESTO",SI
NA,"CALLE LOBATÓN, DIGNA",SI
APP,"CAMONES SORIANO, LADY MERCEDES",SI
FP,"CASTILLO RIVAS, EDUARDO ENRIQUE",SI
AP-PIS,"CAVERO ALVA, ALEJANDRO ENRIQUE",SI
PL,"CERRÓN ROJAS, WALDEMAR JOSÉ",SI
FP,"CHACÓN TRUJILLO, NILZA MERLY",SI
APP,"CHIABRA LEÓN, ROBERTO ENRIQUE",AUSENTE
AP-PIS,"CHIRINOS VENEGAS, PATRICIA ROSA",AUSENTE
PD,"CHÁVEZ CHINO, BETSSY BETZABET",LICENCIA_OFICIAL
RP,"CICCIA VÁSQUEZ, MIGUEL ANGEL",SI
PL,"COAYLA JUÁREZ, JORGE SAMUEL",SI
FP,"CORDERO JON TAY, LUIS GUSTAVO",SI
FP,"CORDERO JON TAY, MARÍA DEL PILAR",SI
CD-JPP,"CORTEZ AGUIRRE, ISABEL",SI
PL,"CRUZ MAMANI, FLAVIO",SI
RP,"CUETO ASERVI, JOSÉ ERNESTO",SI
PL,"CUTIPA CCAMA, VÍCTOR RAÚL",SI
AP-PIS,"CÓRDOVA LOBATÓN, MARÍA JESSICA",SI
AP,"DOROTEO CARBAJO, RAÚL FELIPE",SI
NA,"DÁVILA ATANACIO, PASIÓN NEOMIAS",SI
APP,"DÍAZ MONAGO, FREDDY RONALD",SIN_RESPONDER
APP,"ECHAÍZ DE NÚÑEZ IZAGA, GLADYS MARGOT",AUSENTE
PD,"ECHEVERRÍA RODRÍGUEZ, HAMLET",SI
SP,"ELERA GARCÍA, WILMAR ALBERTO",SI
NA,"ELÍAS ÁVALOS, JOSÉ LUIS",AUSENTE
AP,"ESPINOZA VARGAS, JHAEC DARWIN",AUSENTE
AP,"FLORES ANCACHI, JORGE LUIS",SI
PL,"FLORES RAMÍREZ, ALEX RANDU",SI
FP,"FLORES RUÍZ, VÍCTOR SEFERINO",SI
APP,"GARCÍA CORREA, IDELSO MANUEL",SIN_RESPONDER
PL,"GONZA CASTILLO, AMERICO",AUSENTE
AP-PIS,"GONZALES DELGADO, DIANA CAROLINA",SI
FP,"GUERRA GARCÍA, CAMPOS HERNANDO",SI
NA,"GUTIÉRREZ TICONA, PAUL SILVIO",SI
RP,"HERRERA MEDINA, NOELIA ROSSVITH",SI
FP,"HUAMÁN CORONADO, RAÚL",LICENCIA_POR_ENFERMEDAD
FP,"INFANTES CASTAÑEDA, MERY ELIANA",SI
SP,"JERI ORÉ, JOSÉ ENRIQUE",SI
FP,"JIMÉNEZ HEREDIA, DAVID JULIO",AUSENTE
APP,"JULON IRIGOIN, ELVA EDHIT",SI
APP,"JUÁREZ CALLE, HEIDY LISBETH",SI
FP,"JUÁREZ GALLEGOS, CARMEN PATRICIA",SI
RP,"JÁUREGUI MARTÍNEZ DE AGUAYO, MARÍA DE LOS MILAGROS JACKELINE",SI
PD,"KAMICHE MORANTE, LUIS ROBERTO",SI
PD,"LIMACHI QUISPE, NIEVES ESMERALDA",SI
FP,"LIZARZABURU LIZARZABURU, JUAN CARLOS MARTIN",SI
NA,"LUNA GÁLVEZ, JOSÉ LEÓN",SI
CD-JPP,"LUQUE IBARRA, RUTH",SI
FP,"LÓPEZ MORALES, JENY LUZ",LICENCIA_POR_ENFERMEDAD
AP,"LÓPEZ UREÑA, ILICH FREDY",SI
PL,"MARTICORENA MENDOZA, JORGE ALFONSO",SI
AP,"MARTÍNEZ TALAVERA, PEDRO EDWIN",SI
NA,"MEDINA HERMOSILLA, ELIZABETH SARA",SI
RP,"MEDINA MINAYA, ESDRAS RICARDO",SI
PL,"MONTALVO CUBAS, SEGUNDO TORIBIO",SI
AP,"MONTEZA FACHO, SILVIA MARÍA",SI
RP,"MONTOYA MANRIQUE, JORGE CARLOS",AUSENTE
FP,"MORANTE FIGARI, JORGE ALBERTO",SI
AP,"MORI CELIS, JUAN CARLOS",SI
FP,"MOYANO DELGADO, MARTHA LUPE",SIN_RESPONDER
RP,"MUÑANTE BARRIOS, ALEJANDRO",SI
NA,"MÁLAGA TRILLO, GEORGE EDWARD",NO
FP,"OBANDO MORGAN, AURISTELA ANA",SI
FP,"OLIVOS MARTÍNEZ, VIVIAN",SI
NA,"PABLO MEDINA, FLOR AIDEE",SI
RP,"PADILLA ROMERO, JAVIER ROMMEL",ABSTENCION
PL,"PALACIOS HUÁMAN, MARGOT",AUSENTE
NA,"PAREDES CASTRO, FRANCIS JHASMINA",SI
AP,"PAREDES FONSECA, KAROL IVETT",SI
NA,"PAREDES GONZALES, ALEX ANTONIO",SI
NA,"PAREDES PIQUÉ, SUSEL ANA MARÍA",SI
PL,"PARIONA SINCHE, ALFREDO",SI
NA,"PICÓN QUEDO, LUIS RAÚL",AUSENTE
PL,"PORTALATINO ÁVALOS, KELLY ROXANA",SIN_RESPONDER
AP,"PORTERO LÓPEZ, HILDA MARLENY",SI
NA,"QUIROZ BARBOZA, SEGUNDO TEODOMIRO",SI
PL,"QUISPE MAMANI, WILSON RUSBEL",AUSENTE
PL,"QUITO SARMIENTO, BERNARDO JAIME",SI
FP,"RAMÍREZ GARCÍA, TANIA ESTEFANY",SI
FP,"REVILLA VILLANUEVA, CÉSAR MANUEL",SI
PL,"REYES CAM, ABEL AUGUSTO",AUSENTE
CD-JPP,"REYMUNDO MERCADO, EDGARD CORNELIO",SI
PL,"RIVAS CHACARA, JANET MILAGROS",SI
PL,"ROBLES ARAUJO, SILVANA EMPERATRIZ",SI
APP,"RUÍZ RODRÍGUEZ, MAGALY ROSMERY",SI
SP,"SAAVEDRA CASTERNOQUE, HITLER",SI
APP,"SALHUANA CAVIDES, EDUARDO",SI
AP,"SOTO PALACIOS, WILSON",SI
APP,"SOTO REYES, ALEJANDRO",SI
CD-JPP,"SÁNCHEZ PALOMINO, ROBERTO HELBERT",LICENCIA_OFICIAL
NA,"TACURI VALDIVIA, GERMÁN ADOLFO",SI
PL,"TAIPE CORONADO, MARÍA ELIZABETH",AUSENTE
NA,"TELLO MONTES, NIVARDO EDGAR",SI
APP,"TORRES SALINAS, ROSIO",SI
APP,"TRIGOZO REÁTEGUI, CHERYL",SI
AP-PIS,"TUDELA GUTIÉRREZ, ADRIANA JOSEFINA",SI
NA,"UGARTE MAMANI, JHAKELINE KATY",SI
PD,"VALER PINTO, HÉCTOR",SI
PL,"VARAS MELÉNDEZ, ELÍAS MARCIAL",SI
FP,"VENTURA ANGEL, HÉCTOR JOSÉ",SI
AP,"VERGARA MENDOZA, ELVIS HERNÁN",SI
NA,"VÁSQUEZ VELA, LUCINDA",SI
AP-PIS,"WILLIAMS ZAPATA, JOSÉ DANIEL",SI
NA,"WONG PUJADA, ENRIQUE",SIN_RESPONDER
AP-PIS,"YARROW LUMBRERAS, NORMA MARTINA",NO
PL,"ZEA CHOQUECHAMBI, OSCAR",LICENCIA_OFICIAL
RP,"ZEBALLOS APONTE, JORGE ARTURO",SI
PD,"ZEBALLOS MADARIAGA, CARLOS JAVIER",SI
FP,"ZETA CHUNGA, CRUZ MARÍA",AUSENTE
