grupo_parlamentario,congresista,votacion
APP,"ACUÑA PERALTA, MARÍA GRIMANEZA",NO
APP,"ACUÑA PERALTA, SEGUNDO HÉCTOR",NO
FP,"AGUINAGA RECUENCO, ALEJANDRO AURELIO",NO
PL,"AGÜERO GUTIÉRREZ, MARÍA ANTONIETA",LICENCIA_POR_ENFERMEDAD
SP,"ALCARRAZ AGUERO, YOREL KIRA",SI
FP,"ALEGRÍA GARCÍA, ARTURO",NO
AP,"ALVA PRIETO, MARÍA DEL CARMEN",AUSENTE
AP,"ALVA ROJAS, CARLOS ENRIQUE",NO
AP-PIS,"AMURUZ DULANTO, YESSICA ROSSELLI",SI
NA,"ANDERSON RAMÍREZ, CARLOS ANTONIO",NO
AP,"ARAGÓN CARREÑO, LUIS ÁNGEL",NO
AP,"ARRIOLA TUEROS, JOSÉ ALBERTO",NO
SP,"AZURÍN LOAYZA, ALFREDO",SI
PL,"BALCÁZAR ZELADA, JOSÉ MARÍA",AUSENTE
FP,"BARBARÁN REYES, ROSANGELLA ANDREA",NO
AP-PIS,"BAZÁN CALDERÓN, DIEGO ALONSO FERNANDO",SI
JP,"BAZÁN NARRO, SIGRID TESORO",NO
PL,"BELLIDO UGARTE, GUIDO",ABSTENCION
PD,"BERMEJO ROJAS, GUILLERMO",NO
AP-PIS,"BURGOS OLIVEROS, JUAN BARTOLOMÉ",AUSENTE
FP,"BUSTAMANTE DONAYRE, ERNESTO",NO
NA,"CALLE LOBATÓN, DIGNA",AUSENTE
APP,"CAMONES SORIANO, LADY MERCEDES",SIN_RESPONDER
FP,"CASTILLO RIVAS, EDUARDO ENRIQUE",NO
AP-PIS,"CAVERO ALVA, ALEJANDRO ENRIQUE",SI
PL,"CERRÓN ROJAS, WALDEMAR JOSÉ",LICENCIA_OFICIAL
FP,"CHACÓN TRUJILLO, NILZA MERLY",NO
APP,"CHIABRA LEÓN, ROBERTO ENRIQUE",NO
AP-PIS,"CHIRINOS VENEGAS, PATRICIA ROSA",SI
PD,"CHÁVEZ CHINO, BETSSY BETZABET",LICENCIA_OFICIAL
RP,"CICCIA VÁSQUEZ, MIGUEL ANGEL",SI
PL,"COAYLA JUÁREZ, JORGE SAMUEL",NO
FP,"CORDERO JON TAY, LUIS GUSTAVO",NO
FP,"CORDERO JON TAY, MARÍA DEL PILAR",NO
JP,"CORTEZ AGUIRRE, ISABEL",NO
PL,"CRUZ MAMANI, FLAVIO",NO
RP,"CUETO ASERVI, JOSÉ ERNESTO",SI
PL,"CUTIPA CCAMA, VÍCTOR RAÚL",NO
AP-PIS,"CÓRDOVA LOBATÓN, MARÍA JESSICA",SI
AP,"DOROTEO CARBAJO, RAÚL FELIPE",NO
PL,"DÁVILA ATANACIO, PASIÓN NEOMIAS",NO
APP,"DÍAZ MONAGO, FREDDY RONALD",NO
APP,"ECHAÍZ DE NÚÑEZ IZAGA, GLADYS MARGOT",NO
PD,"ECHEVERRÍA RODRÍGUEZ, HAMLET",NO
SP,"ELERA GARCÍA, WILMAR ALBERTO",AUSENTE
NA,"ELÍAS ÁVALOS, JOSÉ LUIS",ABSTENCION
AP,"ESPINOZA VARGAS, JHAEC DARWIN",NO
AP,"FLORES ANCACHI, JORGE LUIS",NO
PL,"FLORES RAMÍREZ, ALEX RANDU",NO
FP,"FLORES RUÍZ, VÍCTOR SEFERINO",NO
APP,"GARCÍA CORREA, IDELSO MANUEL",NO
PL,"GONZA CASTILLO, AMERICO",NO
AP-PIS,"GONZALES DELGADO, DIANA CAROLINA",SI
FP,"GUERRA GARCÍA, CAMPOS HERNANDO",NO
PL,"GUTIÉRREZ TICONA, PAUL SILVIO",NO
RP,"HERRERA MEDINA, NOELIA ROSSVITH",SI
FP,"HUAMÁN CORONADO, RAÚL",LICENCIA_OFICIAL
FP,"INFANTES CASTAÑEDA, MERY ELIANA",NO
SP,"JERI ORÉ, JOSÉ ENRIQUE",NO
FP,"JIMÉNEZ HEREDIA, DAVID JULIO",NO
APP,"JULON IRIGOIN, ELVA EDHIT",NO
APP,"JUÁREZ CALLE, HEIDY LISBETH",NO
FP,"JUÁREZ GALLEGOS, CARMEN PATRICIA",NO
RP,"JÁUREGUI MARTÍNEZ DE AGUAYO, MARÍA DE LOS MILAGROS JACKELINE",SI
PD,"KAMICHE MORANTE, LUIS ROBERTO",NO
PD,"LIMACHI QUISPE, NIEVES ESMERALDA",NO
FP,"LIZARZABURU LIZARZABURU, JUAN CARLOS MARTIN",AUSENTE
NA,"LUNA GÁLVEZ, JOSÉ LEÓN",NO
JP,"LUQUE IBARRA, RUTH",NO
FP,"LÓPEZ MORALES, JENY LUZ",LICENCIA_OFICIAL
AP,"LÓPEZ UREÑA, ILICH FREDY",AUSENTE
PL,"MARTICORENA MENDOZA, JORGE ALFONSO",ABSTENCION
AP,"MARTÍNEZ TALAVERA, PEDRO EDWIN",NO
PL,"MEDINA HERMOSILLA, ELIZABETH SARA",NO
RP,"MEDINA MINAYA, ESDRAS RICARDO",SI
PL,"MONTALVO CUBAS, SEGUNDO TORIBIO",ABSTENCION
AP,"MONTEZA FACHO, SILVIA MARÍA",NO
RP,"MONTOYA MANRIQUE, JORGE CARLOS",SI
FP,"MORANTE FIGARI, JORGE ALBERTO",NO
AP,"MORI CELIS, JUAN CARLOS",NO
FP,"MOYANO DELGADO, MARTHA LUPE",NO
RP,"MUÑANTE BARRIOS, ALEJANDRO",NO
NA,"MÁLAGA TRILLO, GEORGE EDWARD",AUSENTE
FP,"OBANDO MORGAN, AURISTELA ANA",NO
FP,"OLIVOS MARTÍNEZ, VIVIAN",NO
NA,"PABLO MEDINA, FLOR AIDEE",AUSENTE
RP,"PADILLA ROMERO, JAVIER ROMMEL",SI
PL,"PALACIOS HUÁMAN, MARGOT",NO
PL,"PAREDES CASTRO, FRANCIS JHASMINA",NO
AP,"PAREDES FONSECA, KAROL IVETT",NO
PL,"PAREDES GONZALES, ALEX ANTONIO",NO
NA,"PAREDES PIQUÉ, SUSEL ANA MARÍA",AUSENTE
PL,"PARIONA SINCHE, ALFREDO",NO
APP,"PICÓN QUEDO, LUIS RAÚL",LICENCIA_OFICIAL
PL,"PORTALATINO ÁVALOS, KELLY ROXANA",ABSTENCION
AP,"PORTERO LÓPEZ, HILDA MARLENY",NO
PL,"QUIROZ BARBOZA, SEGUNDO TEODOMIRO",NO
PL,"QUISPE MAMANI, WILSON RUSBEL",ABSTENCION
PL,"QUITO SARMIENTO, BERNARDO JAIME",ABSTENCION
FP,"RAMÍREZ GARCÍA, TANIA ESTEFANY",NO
FP,"REVILLA VILLANUEVA, CÉSAR MANUEL",NO
PL,"REYES CAM, ABEL AUGUSTO",NO
JP,"REYMUNDO MERCADO, EDGARD CORNELIO",LICENCIA_OFICIAL
PL,"RIVAS CHACARA, JANET MILAGROS",NO
PL,"ROBLES ARAUJO, SILVANA EMPERATRIZ",NO
APP,"RUÍZ RODRÍGUEZ, MAGALY ROSMERY",NO
SP,"SAAVEDRA CASTERNOQUE, HITLER",NO
APP,"SALHUANA CAVIDES, EDUARDO",NO
AP,"SOTO PALACIOS, WILSON",NO
APP,"SOTO REYES, ALEJANDRO",NO
JP,"SÁNCHEZ PALOMINO, ROBERTO HELBERT",LICENCIA_OFICIAL
PL,"TACURI VALDIVIA, GERMÁN ADOLFO",LICENCIA_OFICIAL
PL,"TAIPE CORONADO, MARÍA ELIZABETH",NO
PL,"TELLO MONTES, NIVARDO EDGAR",NO
APP,"TORRES SALINAS, ROSIO",NO
APP,"TRIGOZO REÁTEGUI, CHERYL",LICENCIA_PERSONAL
AP-PIS,"TUDELA GUTIÉRREZ, ADRIANA JOSEFINA",SI
PL,"UGARTE MAMANI, JHAKELINE KATY",NO
PD,"VALER PINTO, HÉCTOR",NO
PL,"VARAS MELÉNDEZ, ELÍAS MARCIAL",NO
FP,"VENTURA ANGEL, HÉCTOR JOSÉ",LICENCIA_OFICIAL
AP,"VERGARA MENDOZA, ELVIS HERNÁN",NO
PL,"VÁSQUEZ VELA, LUCINDA",NO
AP-PIS,"WILLIAMS ZAPATA, JOSÉ DANIEL",SI
NA,"WONG PUJADA, ENRIQUE",AUSENTE
AP-PIS,"YARROW LUMBRERAS, NORMA MARTINA",SI
PL,"ZEA CHOQUECHAMBI, OSCAR",LICENCIA_OFICIAL
RP,"ZEBALLOS APONTE, JORGE ARTURO",SI
PD,"ZEBALLOS MADARIAGA, CARLOS JAVIER",NO
FP,"ZETA CHUNGA, CRUZ MARÍA",NO
