grupo_parlamentario,congresista,votacion
APP,"ACUÑA PERALTA, MARÍA GRIMANEZA",SI
ID,"ACUÑA PERALTA, SEGUNDO HÉCTOR",SIN_RESPONDER
FP,"AGUINAGA RECUENCO, ALEJANDRO AURELIO",SI
PL,"AGÜERO GUTIÉRREZ, MARÍA ANTONIETA",SI
ID,"ALCARRAZ AGUERO, YOREL KIRA",AUSENTE
FP,"ALEGRÍA GARCÍA, ARTURO",SI
AP,"ALVA PRIETO, MARÍA DEL CARMEN",AUSENTE
ID,"ALVA ROJAS, CARLOS ENRIQUE",SI
AP-PIS,"AMURUZ DULANTO, YESSICA ROSSELLI",AUSENTE
NA,"ANDERSON RAMÍREZ, CARLOS ANTONIO",SI
AP,"ARAGÓN CARREÑO, LUIS ÁNGEL",SI
AP,"ARRIOLA TUEROS, JOSÉ ALBERTO",AUSENTE
SP,"AZURÍN LOAYZA, ALFREDO",SI
PB,"BALCÁZAR ZELADA, JOSÉ MARÍA",SIN_RESPONDER
FP,"BARBARÁN REYES, ROSANGELLA ANDREA",AUSENTE
AP-PIS,"BAZÁN CALDERÓN, DIEGO ALONSO FERNANDO",SIN_RESPONDER
CD-JPP,"BAZÁN NARRO, SIGRID TESORO",SI
NA,"BELLIDO UGARTE, GUIDO",SI
PD,"BERMEJO ROJAS, GUILLERMO",AUSENTE
NA,"BURGOS OLIVEROS, JUAN BARTOLOMÉ",SI
FP,"BUSTAMANTE DONAYRE, ERNESTO",SI
NA,"CALLE LOBATÓN, DIGNA",AUSENTE
APP,"CAMONES SORIANO, LADY MERCEDES",SI
FP,"CASTILLO RIVAS, EDUARDO ENRIQUE",SI
AP-PIS,"CAVERO ALVA, ALEJANDRO ENRIQUE",LICENCIA_PERSONAL
PL,"CERRÓN ROJAS, WALDEMAR JOSÉ",SI
FP,"CHACÓN TRUJILLO, NILZA MERLY",LICENCIA_POR_ENFERMEDAD
APP,"CHIABRA LEÓN, ROBERTO ENRIQUE",SI
AP-PIS,"CHIRINOS VENEGAS, PATRICIA ROSA",LICENCIA_PERSONAL
PD,"CHÁVEZ CHINO, BETSSY BETZABET",SI
RP,"CICCIA VÁSQUEZ, MIGUEL ANGEL",SI
PB,"COAYLA JUÁREZ, JORGE SAMUEL",SI
FP,"CORDERO JON TAY, LUIS GUSTAVO",SI
FP,"CORDERO JON TAY, MARÍA DEL PILAR",SIN_RESPONDER
CD-JPP,"CORTEZ AGUIRRE, ISABEL",SI
PL,"CRUZ MAMANI, FLAVIO",SI
RP,"CUETO ASERVI, JOSÉ ERNESTO",SI
PB,"CUTIPA CCAMA, VÍCTOR RAÚL",AUSENTE
AP-PIS,"CÓRDOVA LOBATÓN, MARÍA JESSICA",AUSENTE
AP,"DOROTEO CARBAJO, RAÚL FELIPE",SI
BM,"DÁVILA ATANACIO, PASIÓN NEOMIAS",SI
NA,"DÍAZ MONAGO, FREDDY RONALD",SUSPENDIDO
RP,"ECHAÍZ DE NÚÑEZ IZAGA, GLADYS MARGOT",SI
PD,"ECHEVERRÍA RODRÍGUEZ, HAMLET",SI
SP,"ELERA GARCÍA, WILMAR ALBERTO",AUSENTE
NA,"ELÍAS ÁVALOS, JOSÉ LUIS",SI
AP,"ESPINOZA VARGAS, JHAEC DARWIN",SI
AP,"FLORES ANCACHI, JORGE LUIS",SI
PL,"FLORES RAMÍREZ, ALEX RANDU",AUSENTE
FP,"FLORES RUÍZ, VÍCTOR SEFERINO",SI
APP,"GARCÍA CORREA, IDELSO MANUEL",SI
PL,"GONZA CASTILLO, AMERICO",SI
AP-PIS,"GONZALES DELGADO, DIANA CAROLINA",SI
FP,"GUERRA GARCÍA, CAMPOS HERNANDO",SI
BM,"GUTIÉRREZ TICONA, PAUL SILVIO",SI
RP,"HERRERA MEDINA, NOELIA ROSSVITH",LICENCIA_POR_ENFERMEDAD
FP,"HUAMÁN CORONADO, RAÚL",SI
FP,"INFANTES CASTAÑEDA, MERY ELIANA",SI
SP,"JERI ORÉ, JOSÉ ENRIQUE",SI
FP,"JIMÉNEZ HEREDIA, DAVID JULIO",SI
APP,"JULON IRIGOIN, ELVA EDHIT",SI
NA,"JUÁREZ CALLE, HEIDY LISBETH",SI
FP,"JUÁREZ GALLEGOS, CARMEN PATRICIA",SI
RP,"JÁUREGUI MARTÍNEZ DE AGUAYO, MARÍA DE LOS MILAGROS JACKELINE",AUSENTE
PD,"KAMICHE MORANTE, LUIS ROBERTO",SI
PD,"LIMACHI QUISPE, NIEVES ESMERALDA",SI
FP,"LIZARZABURU LIZARZABURU, JUAN CARLOS MARTIN",AUSENTE
NA,"LUNA GÁLVEZ, JOSÉ LEÓN",SI
CD-JPP,"LUQUE IBARRA, RUTH",SI
FP,"LÓPEZ MORALES, JENY LUZ",SI
AP,"LÓPEZ UREÑA, ILICH FREDY",SI
PB,"MARTICORENA MENDOZA, JORGE ALFONSO",SI
AP,"MARTÍNEZ TALAVERA, PEDRO EDWIN",SI
BM,"MEDINA HERMOSILLA, ELIZABETH SARA",SI
SP,"MEDINA MINAYA, ESDRAS RICARDO",SI
PL,"MONTALVO CUBAS, SEGUNDO TORIBIO",SIN_RESPONDER
AP,"MONTEZA FACHO, SILVIA MARÍA",SI
RP,"MONTOYA MANRIQUE, JORGE CARLOS",SI
FP,"MORANTE FIGARI, JORGE ALBERTO",SI
AP,"MORI CELIS, JUAN CARLOS",SI
FP,"MOYANO DELGADO, MARTHA LUPE",SI
RP,"MUÑANTE BARRIOS, ALEJANDRO",SI
NA,"MÁLAGA TRILLO, GEORGE EDWARD",SI
FP,"OBANDO MORGAN, AURISTELA ANA",SI
FP,"OLIVOS MARTÍNEZ, VIVIAN",SI
ID,"PABLO MEDINA, FLOR AIDEE",SIN_RESPONDER
RP,"PADILLA ROMERO, JAVIER ROMMEL",SI
PL,"PALACIOS HUÁMAN, MARGOT",SI
BM,"PAREDES CASTRO, FRANCIS JHASMINA",SI
AP,"PAREDES FONSECA, KAROL IVETT",SI
BM,"PAREDES GONZALES, ALEX ANTONIO",SI
ID,"PAREDES PIQUÉ, SUSEL ANA MARÍA",SI
PL,"PARIONA SINCHE, ALFREDO",SI
NA,"PICÓN QUEDO, LUIS RAÚL",SI
PL,"PORTALATINO ÁVALOS, KELLY ROXANA",SIN_RESPONDER
AP,"PORTERO LÓPEZ, HILDA MARLENY",SI
BM,"QUIROZ BARBOZA, SEGUNDO TEODOMIRO",SI
PL,"QUISPE MAMANI, WILSON RUSBEL",SI
PL,"QUITO SARMIENTO, BERNARDO JAIME",SIN_RESPONDER
FP,"RAMÍREZ GARCÍA, TANIA ESTEFANY",AUSENTE
FP,"REVILLA VILLANUEVA, CÉSAR MANUEL",AUSENTE
PL,"REYES CAM, ABEL AUGUSTO",AUSENTE
CD-JPP,"REYMUNDO MERCADO, EDGARD CORNELIO",SI
PL,"RIVAS CHACARA, JANET MILAGROS",SI
PL,"ROBLES ARAUJO, SILVANA EMPERATRIZ",SI
APP,"RUÍZ RODRÍGUEZ, MAGALY ROSMERY",SI
SP,"SAAVEDRA CASTERNOQUE, HITLER",SI
APP,"SALHUANA CAVIDES, EDUARDO",SIN_RESPONDER
AP,"SOTO PALACIOS, WILSON",SI
APP,"SOTO REYES, ALEJANDRO",SI
CD-JPP,"SÁNCHEZ PALOMINO, ROBERTO HELBERT",AUSENTE
BM,"TACURI VALDIVIA, GERMÁN ADOLFO",SI
PL,"TAIPE CORONADO, MARÍA ELIZABETH",AUSENTE
BM,"TELLO MONTES, NIVARDO EDGAR",SI
APP,"TORRES SALINAS, ROSIO",SI
APP,"TRIGOZO REÁTEGUI, CHERYL",SI
AP-PIS,"TUDELA GUTIÉRREZ, ADRIANA JOSEFINA",SI
BM,"UGARTE MAMANI, JHAKELINE KATY",AUSENTE
SP,"VALER PINTO, HÉCTOR",AUSENTE
PB,"VARAS MELÉNDEZ, ELÍAS MARCIAL",SI
FP,"VENTURA ANGEL, HÉCTOR JOSÉ",SI
AP,"VERGARA MENDOZA, ELVIS HERNÁN",SI
BM,"VÁSQUEZ VELA, LUCINDA",LICENCIA_POR_ENFERMEDAD
AP-PIS,"WILLIAMS ZAPATA, JOSÉ DANIEL",SIN_RESPONDER
NA,"WONG PUJADA, ENRIQUE",SI
AP-PIS,"YARROW LUMBRERAS, NORMA MARTINA",SI
NA,"ZEA CHOQUECHAMBI, OSCAR",SI
RP,"ZEBALLOS APONTE, JORGE ARTURO",SI
ID,"ZEBALLOS MADARIAGA, CARLOS JAVIER",SI
FP,"ZETA CHUNGA, CRUZ MARÍA",SI