grupo_parlamentario,congresista,asistencia
APP,"ACUÑA PERALTA, MARÍA GRIMANEZA",PRESENTE
NA,"ACUÑA PERALTA, SEGUNDO HÉCTOR",PRESENTE
FP,"AGUINAGA RECUENCO, ALEJANDRO AURELIO",PRESENTE
PL,"AGÜERO GUTIÉRREZ, MARÍA ANTONIETA",PRESENTE
PP,"ALCARRAZ AGUERO, YOREL KIRA",AUSENTE
FP,"ALEGRÍA GARCÍA, ARTURO",PRESENTE
NA,"ALVA PRIETO, MARÍA DEL CARMEN",PRESENTE
NA,"ALVA ROJAS, CARLOS ENRIQUE",AUSENTE
AP-PIS,"AMURUZ DULANTO, YESSICA ROSSELLI",PRESENTE
NA,"ANDERSON RAMÍREZ, CARLOS ANTONIO",PRESENTE
AP,"ARAGÓN CARREÑO, LUIS ÁNGEL",PRESENTE
NA,"ARRIOLA TUEROS, JOSÉ ALBERTO",PRESENTE
SP,"AZURÍN LOAYZA, ALFREDO",PRESENTE
PB,"BALCÁZAR ZELADA, JOSÉ MARÍA",PRESENTE
FP,"BARBARÁN REYES, ROSANGELLA ANDREA",PRESENTE
AP-PIS,"BAZÁN CALDERÓN, DIEGO ALONSO FERNANDO",PRESENTE
CD-JPP,"BAZÁN NARRO, SIGRID TESORO",LICENCIA_PERSONAL
PB,"BELLIDO UGARTE, GUIDO",PRESENTE
CD-JPP,"BERMEJO ROJAS, GUILLERMO",PRESENTE
NA,"BURGOS OLIVEROS, JUAN BARTOLOMÉ",AUSENTE
FP,"BUSTAMANTE DONAYRE, ERNESTO",PRESENTE
PP,"CALLE LOBATÓN, DIGNA",PRESENTE
APP,"CAMONES SORIANO, LADY MERCEDES",AUSENTE
FP,"CASTILLO RIVAS, EDUARDO ENRIQUE",PRESENTE
AP-PIS,"CAVERO ALVA, ALEJANDRO ENRIQUE",PRESENTE
PL,"CERRÓN ROJAS, WALDEMAR JOSÉ",PRESENTE
FP,"CHACÓN TRUJILLO, NILZA MERLY",AUSENTE
APP,"CHIABRA LEÓN, ROBERTO ENRIQUE",PRESENTE
AP-PIS,"CHIRINOS VENEGAS, PATRICIA ROSA",PRESENTE
RP,"CICCIA VÁSQUEZ, MIGUEL ANGEL",AUSENTE
PB,"COAYLA JUÁREZ, JORGE SAMUEL",AUSENTE
AP,"CORDERO JON TAY, LUIS GUSTAVO",PRESENTE
NA,"CORDERO JON TAY, MARÍA DEL PILAR",SUSPENDIDO
CD-JPP,"CORTEZ AGUIRRE, ISABEL",AUSENTE
PL,"CRUZ MAMANI, FLAVIO",PRESENTE
RP,"CUETO ASERVI, JOSÉ ERNESTO",PRESENTE
NA,"CUTIPA CCAMA, VÍCTOR RAÚL",PRESENTE
AP-PIS,"CÓRDOVA LOBATÓN, MARÍA JESSICA",AUSENTE
AP,"DOROTEO CARBAJO, RAÚL FELIPE",PRESENTE
BM,"DÁVILA ATANACIO, PASIÓN NEOMIAS",PRESENTE
RP,"ECHAÍZ DE NÚÑEZ IZAGA, GLADYS MARGOT",PRESENTE
CD-JPP,"ECHEVERRÍA RODRÍGUEZ, HAMLET",LICENCIA_PERSONAL
PP,"ELÍAS ÁVALOS, JOSÉ LUIS",AUSENTE
AP,"ESPINOZA VARGAS, JHAEC DARWIN",PRESENTE
AP,"FLORES ANCACHI, JORGE LUIS",AUSENTE
NA,"FLORES RAMÍREZ, ALEX RANDU",PRESENTE
FP,"FLORES RUÍZ, VÍCTOR SEFERINO",AUSENTE
APP,"GARCÍA CORREA, IDELSO MANUEL",PRESENTE
PL,"GONZA CASTILLO, AMERICO",PRESENTE
AP-PIS,"GONZALES DELGADO, DIANA CAROLINA",PRESENTE
BM,"GUTIÉRREZ TICONA, PAUL SILVIO",AUSENTE
APP,"HEIDINGER BALLESTEROS, NELCY",PRESENTE
RP,"HERRERA MEDINA, NOELIA ROSSVITH",AUSENTE
FP,"HUAMÁN CORONADO, RAÚL",PRESENTE
FP,"INFANTES CASTAÑEDA, MERY ELIANA",AUSENTE
SP,"JERI ORÉ, JOSÉ ENRIQUE",PRESENTE
FP,"JIMÉNEZ HEREDIA, DAVID JULIO",PRESENTE
APP,"JULON IRIGOIN, ELVA EDHIT",AUSENTE
PP,"JUÁREZ CALLE, HEIDY LISBETH",AUSENTE
FP,"JUÁREZ GALLEGOS, CARMEN PATRICIA",PRESENTE
RP,"JÁUREGUI MARTÍNEZ DE AGUAYO, MARÍA DE LOS MILAGROS JACKELINE",AUSENTE
CD-JPP,"KAMICHE MORANTE, LUIS ROBERTO",LICENCIA_POR_ENFERMEDAD
CD-JPP,"LIMACHI QUISPE, NIEVES ESMERALDA",AUSENTE
FP,"LIZARZABURU LIZARZABURU, JUAN CARLOS MARTIN",AUSENTE
PP,"LUNA GÁLVEZ, JOSÉ LEÓN",AUSENTE
CD-JPP,"LUQUE IBARRA, RUTH",AUSENTE
FP,"LÓPEZ MORALES, JENY LUZ",PRESENTE
NA,"LÓPEZ UREÑA, ILICH FREDY",PRESENTE
PB,"MARTICORENA MENDOZA, JORGE ALFONSO",AUSENTE
NA,"MARTÍNEZ TALAVERA, PEDRO EDWIN",PRESENTE
BM,"MEDINA HERMOSILLA, ELIZABETH SARA",LICENCIA_POR_ENFERMEDAD
NA,"MEDINA MINAYA, ESDRAS RICARDO",PRESENTE
PL,"MITA ALANOCA, ISAAC",AUSENTE
PL,"MONTALVO CUBAS, SEGUNDO TORIBIO",AUSENTE
NA,"MONTEZA FACHO, SILVIA MARÍA",AUSENTE
RP,"MONTOYA MANRIQUE, JORGE CARLOS",PRESENTE
FP,"MORANTE FIGARI, JORGE ALBERTO",PRESENTE
NA,"MORI CELIS, JUAN CARLOS",PRESENTE
FP,"MOYANO DELGADO, MARTHA LUPE",PRESENTE
RP,"MUÑANTE BARRIOS, ALEJANDRO",AUSENTE
NA,"MÁLAGA TRILLO, GEORGE EDWARD",PRESENTE
FP,"OBANDO MORGAN, AURISTELA ANA",AUSENTE
FP,"OLIVOS MARTÍNEZ, VIVIAN",PRESENTE
NA,"PABLO MEDINA, FLOR AIDEE",AUSENTE
RP,"PADILLA ROMERO, JAVIER ROMMEL",AUSENTE
PL,"PALACIOS HUÁMAN, MARGOT",AUSENTE
PP,"PAREDES CASTRO, FRANCIS JHASMINA",PRESENTE
NA,"PAREDES FONSECA, KAROL IVETT",AUSENTE
BM,"PAREDES GONZALES, ALEX ANTONIO",PRESENTE
CD-JPP,"PAREDES PIQUÉ, SUSEL ANA MARÍA",LICENCIA_OFICIAL
NA,"PARIONA SINCHE, ALFREDO",PRESENTE
SP,"PAZO NUNURA, JOSE BERNARDO",PRESENTE
PP,"PICÓN QUEDO, LUIS RAÚL",AUSENTE
PL,"PORTALATINO ÁVALOS, KELLY ROXANA",AUSENTE
AP,"PORTERO LÓPEZ, HILDA MARLENY",AUSENTE
BM,"QUIROZ BARBOZA, SEGUNDO TEODOMIRO",PRESENTE
PL,"QUISPE MAMANI, WILSON RUSBEL",AUSENTE
NA,"QUITO SARMIENTO, BERNARDO JAIME",PRESENTE
FP,"RAMÍREZ GARCÍA, TANIA ESTEFANY",PRESENTE
FP,"REVILLA VILLANUEVA, CÉSAR MANUEL",AUSENTE
PL,"REYES CAM, ABEL AUGUSTO",AUSENTE
CD-JPP,"REYMUNDO MERCADO, EDGARD CORNELIO",PRESENTE
PL,"RIVAS CHACARA, JANET MILAGROS",PRESENTE
NA,"ROBLES ARAUJO, SILVANA EMPERATRIZ",AUSENTE
FP,"ROSPIGLIOSI CAPURRO, FERNANDO MIGUEL",PRESENTE
APP,"RUÍZ RODRÍGUEZ, MAGALY ROSMERY",PRESENTE
SP,"SAAVEDRA CASTERNOQUE, HITLER",AUSENTE
APP,"SALHUANA CAVIDES, EDUARDO",AUSENTE
AP,"SOTO PALACIOS, WILSON",AUSENTE
APP,"SOTO REYES, ALEJANDRO",PRESENTE
CD-JPP,"SÁNCHEZ PALOMINO, ROBERTO HELBERT",AUSENTE
BM,"TACURI VALDIVIA, GERMÁN ADOLFO",PRESENTE
PL,"TAIPE CORONADO, MARÍA ELIZABETH",AUSENTE
BM,"TELLO MONTES, NIVARDO EDGAR",PRESENTE
APP,"TORRES SALINAS, ROSIO",PRESENTE
APP,"TRIGOZO REÁTEGUI, CHERYL",AUSENTE
AP-PIS,"TUDELA GUTIÉRREZ, ADRIANA JOSEFINA",PRESENTE
NA,"UGARTE MAMANI, JHAKELINE KATY",PRESENTE
SP,"VALER PINTO, HÉCTOR",AUSENTE
PB,"VARAS MELÉNDEZ, ELÍAS MARCIAL",AUSENTE
FP,"VENTURA ANGEL, HÉCTOR JOSÉ",PRESENTE
AP,"VERGARA MENDOZA, ELVIS HERNÁN",AUSENTE
BM,"VÁSQUEZ VELA, LUCINDA",PRESENTE
AP-PIS,"WILLIAMS ZAPATA, JOSÉ DANIEL",PRESENTE
PP,"WONG PUJADA, ENRIQUE",AUSENTE
AP-PIS,"YARROW LUMBRERAS, NORMA MARTINA",PRESENTE
BM,"ZEA CHOQUECHAMBI, OSCAR",PRESENTE
RP,"ZEBALLOS APONTE, JORGE ARTURO",AUSENTE
PP,"ZEBALLOS MADARIAGA, CARLOS JAVIER",PRESENTE
FP,"ZETA CHUNGA, CRUZ MARÍA",PRESENTE
