numero,grupo_parlamentario,congresista,votacion
1,APP,"ACUÑA PERALTA, MARÍA GRIMANEZA",SINRES
2,APP,"ACUÑA PERALTA, SEGUNDO HÉCTOR",SI
3,PL,"AGÜERO GUTIÉRREZ, MARÍA ANTONIETA",LE
4,FP,"AGUINAGA RECUENCO, ALEJANDRO AURELIO",SINRES
5,SP,"ALCARRAZ AGUERO, YOREL KIRA",NO
6,FP,"ALEGRÍA GARCÍA, ARTURO",SI
7,AP,"ALVA PRIETO, MARÍA DEL CARMEN",AUS
8,AP,"ALVA ROJAS, CARLOS ENRIQUE",AUS
9,AP-PIS,"AMURUZ DULANTO, YESSICA ROSSELLI",SINRES
10,NA,"ANDERSON RAMÍREZ, CARLOS ANTONIO",SI
11,AP,"ARAGÓN CARREÑO, LUIS ÁNGEL",LO
12,AP,"ARRIOLA TUEROS, JOSÉ ALBERTO",SI
13,SP,"AZURÍN LOAYZA, ALFREDO",ABST
14,PL,"BALCÁZAR ZELADA, JOSÉ MARÍA",AUS
15,FP,"BARBARÁN REYES, ROSANGELLA ANDREA",SI
16,AP-PIS,"BAZÁN CALDERÓN, DIEGO ALONSO FERNANDO",SI
17,CD,"BAZÁN NARRO, SIGRID TESORO",SI
18,PL,"BELLIDO UGARTE, GUIDO",ABST
19,PD,"BERMEJO ROJAS, GUILLERMO",ABST
20,AP-PIS,"BURGOS OLIVEROS, JUAN BARTOLOMÉ",SI
21,FP,"BUSTAMANTE DONAYRE, ERNESTO",SINRES
22,NA,"CALLE LOBATÓN, DIGNA",SI
23,APP,"CAMONES SORIANO, LADY MERCEDES",SINRES
24,FP,"CASTILLO RIVAS, EDUARDO ENRIQUE",SI
25,AP-PIS,"CAVERO ALVA, ALEJANDRO ENRIQUE",SINRES
26,PL,"CERRÓN ROJAS, WALDEMAR JOSÉ",SINRES
27,FP,"CHACÓN TRUJILLO, NILZA MERLY",SI
28,PD,"CHÁVEZ CHINO, BETSSY BETZABET",LO
29,APP,"CHIABRA LEÓN, ROBERTO ENRIQUE",SINRES
30,AP-PIS,"CHIRINOS VENEGAS, PATRICIA ROSA",SINRES
31,RP,"CICCIA VÁSQUEZ, MIGUEL ANGEL",SI
32,PL,"COAYLA JUÁREZ, JORGE SAMUEL",ABST
33,FP,"CORDERO JON TAY, LUIS GUSTAVO",SI
34,FP,"CORDERO JON TAY, MARÍA DEL PILAR",SI
35,AP-PIS,"CÓRDOVA LOBATÓN, MARÍA JESSICA",SI
36,CD,"CORTEZ AGUIRRE, ISABEL",ABST
37,PL,"CRUZ MAMANI, FLAVIO",ABST
38,RP,"CUETO ASERVI, JOSÉ ERNESTO",SI
39,PL,"CUTIPA CCAMA, VÍCTOR RAÚL",ABST
40,PL,"DÁVILA ATANACIO, PASIÓN NEOMIAS",ABST
41,APP,"DÍAZ MONAGO, FREDDY RONALD",SI
42,AP,"DOROTEO CARBAJO, RAÚL FELIPE",ABST
43,APP,"ECHAÍZ DE NÚÑEZ IZAGA, GLADYS MARGOT",SI
44,PD,"ECHEVERRÍA RODRÍGUEZ, HAMLET",ABST
45,SP,"ELERA GARCÍA, WILMAR ALBERTO",ABST
46,NA,"ELÍAS ÁVALOS, JOSÉ LUIS",AUS
47,AP,"ESPINOZA VARGAS, JHAEC DARWIN",ABST
48,AP,"FLORES ANCACHI, JORGE LUIS",ABST
49,PL,"FLORES RAMÍREZ, ALEX RANDU",LO
50,FP,"FLORES RUÍZ, VÍCTOR SEFERINO",SI
51,APP,"GARCÍA CORREA, IDELSO MANUEL",SI
52,PL,"GONZA CASTILLO, AMERICO",ABST
53,AP-PIS,"GONZALES DELGADO, DIANA CAROLINA",SI
54,FP,"GUERRA GARCÍA, CAMPOS HERNANDO",SINRES
55,PL,"GUTIÉRREZ TICONA, PAUL SILVIO",SINRES
56,RP,"HERRERA MEDINA, NOELIA ROSSVITH",SI
57,FP,"HUAMÁN CORONADO, RAÚL",SI
58,FP,"INFANTES CASTAÑEDA, MERY ELIANA",SI
59,RP,"JÁUREGUI MARTÍNEZ DE AGUAYO, MARÍA DE LOS MILAGROS JACKELINE",SINRES
60,SP,"JERI ORÉ, JOSÉ ENRIQUE",SINRES
61,FP,"JIMÉNEZ HEREDIA, DAVID JULIO",SI
62,APP,"JUÁREZ CALLE, HEIDY LISBETH",SI
63,FP,"JUÁREZ GALLEGOS, CARMEN PATRICIA",SI
64,APP,"JULON IRIGOIN, ELVA EDHIT",LO
65,PD,"KAMICHE MORANTE, LUIS ROBERTO",LE
66,PD,"LIMACHI QUISPE, NIEVES ESMERALDA",ABST
67,FP,"LIZARZABURU LIZARZABURU, JUAN CARLOS MARTIN",SI
68,FP,"LÓPEZ MORALES, JENY LUZ",SI
69,AP,"LÓPEZ UREÑA, ILICH FREDY",AUS
70,NA,"LUNA GÁLVEZ, JOSÉ LEÓN",AUS
71,CD,"LUQUE IBARRA, RUTH",SI
72,NA,"MÁLAGA TRILLO, GEORGE EDWARD",AUS
73,PL,"MARTICORENA MENDOZA, JORGE ALFONSO",ABST
74,AP,"MARTÍNEZ TALAVERA, PEDRO EDWIN",SINRES
75,PL,"MEDINA HERMOSILLA, ELIZABETH SARA",ABST
76,RP,"MEDINA MINAYA, ESDRAS RICARDO",SI
77,PL,"MONTALVO CUBAS, SEGUNDO TORIBIO",SI
78,AP,"MONTEZA FACHO, SILVIA MARÍA",LO
79,RP,"MONTOYA MANRIQUE, JORGE CARLOS",SINRES
80,FP,"MORANTE FIGARI, JORGE ALBERTO",LE
81,AP,"MORI CELIS, JUAN CARLOS",SI
82,FP,"MOYANO DELGADO, MARTHA LUPE",SINRES
83,RP,"MUÑANTE BARRIOS, ALEJANDRO",LO
84,FP,"OBANDO MORGAN, AURISTELA ANA",SINRES
85,FP,"OLIVOS MARTÍNEZ, VIVIAN",SI
86,NA,"PABLO MEDINA, FLOR AIDEE",SI
87,RP,"PADILLA ROMERO, JAVIER ROMMEL",SI
88,PL,"PALACIOS HUÁMAN, MARGOT",AUS
89,PL,"PAREDES CASTRO, FRANCIS JHASMINA",AUS
90,AP,"PAREDES FONSECA, KAROL IVETT",SI
91,PL,"PAREDES GONZALES, ALEX ANTONIO",ABST
92,NA,"PAREDES PIQUÉ, SUSEL ANA MARÍA",SI
93,PL,"PARIONA SINCHE, ALFREDO",SINRES
94,NA,"PICÓN QUEDO, LUIS RAÚL",ABST
95,PL,"PORTALATINO ÁVALOS, KELLY ROXANA",ABST
96,AP,"PORTERO LÓPEZ, HILDA MARLENY",SI
97,PL,"QUIROZ BARBOZA, SEGUNDO TEODOMIRO",SINRES
98,PL,"QUISPE MAMANI, WILSON RUSBEL",LO
99,PL,"QUITO SARMIENTO, BERNARDO JAIME",ABST
100,FP,"RAMÍREZ GARCÍA, TANIA ESTEFANY",SI
101,FP,"REVILLA VILLANUEVA, CÉSAR MANUEL",SI
102,PL,"REYES CAM, ABEL AUGUSTO",ABST
103,CD,"REYMUNDO MERCADO, EDGARD CORNELIO",SINRES
104,PL,"RIVAS CHACARA, JANET MILAGROS",NO
105,PL,"ROBLES ARAUJO, SILVANA EMPERATRIZ",SINRES
106,APP,"RUÍZ RODRÍGUEZ, MAGALY ROSMERY",SI
107,SP,"SAAVEDRA CASTERNOQUE, HITLER",ABST
108,APP,"SALHUANA CAVIDES, EDUARDO",SINRES
109,CD,"SÁNCHEZ PALOMINO, ROBERTO HELBERT",ABST
110,AP,"SOTO PALACIOS, WILSON",SINRES
111,APP,"SOTO REYES, ALEJANDRO",SI
112,PL,"TACURI VALDIVIA, GERMÁN ADOLFO",AUS
113,PL,"TAIPE CORONADO, MARÍA ELIZABETH",SINRES
114,PL,"TELLO MONTES, NIVARDO EDGAR",ABST
115,APP,"TORRES SALINAS, ROSIO",SINRES
116,APP,"TRIGOZO REÁTEGUI, CHERYL",SI
117,AP-PIS,"TUDELA GUTIÉRREZ, ADRIANA JOSEFINA",SI
118,PL,"UGARTE MAMANI, JHAKELINE KATY",ABST
119,PD,"VALER PINTO, HÉCTOR",ABST
120,PL,"VARAS MELÉNDEZ, ELÍAS MARCIAL",NO
121,PL,"VÁSQUEZ VELA, LUCINDA",SINRES
122,FP,"VENTURA ANGEL, HÉCTOR JOSÉ",SINRES
123,AP,"VERGARA MENDOZA, ELVIS HERNÁN",AUS
124,AP-PIS,"WILLIAMS ZAPATA, JOSÉ DANIEL",SI
125,NA,"WONG PUJADA, ENRIQUE",SINRES
126,AP-PIS,"YARROW LUMBRERAS, NORMA MARTINA",SI
127,PL,"ZEA CHOQUECHAMBI, OSCAR",LO
128,RP,"ZEBALLOS APONTE, JORGE ARTURO",AUS
129,PD,"ZEBALLOS MADARIAGA, CARLOS JAVIER",ABST
130,FP,"ZETA CHUNGA, CRUZ MARÍA",SI
