grupo_parlamentario,congresista,votacion
APP,"ACUÑA PERALTA, MARÍA GRIMANEZA",NO
NA,"ACUÑA PERALTA, SEGUNDO HÉCTOR",SIN_RESPONDER
FP,"AGUINAGA RECUENCO, ALEJANDRO AURELIO",NO
PL,"AGÜERO GUTIÉRREZ, MARÍA ANTONIETA",NO
PP,"ALCARRAZ AGUERO, YOREL KIRA",SI
FP,"ALEGRÍA GARCÍA, ARTURO",NO
AP,"ALVA PRIETO, MARÍA DEL CARMEN",SI
NA,"ALVA ROJAS, CARLOS ENRIQUE",SI
AP-PIS,"AMURUZ DULANTO, YESSICA ROSSELLI",SI
NA,"ANDERSON RAMÍREZ, CARLOS ANTONIO",NO
AP,"ARAGÓN CARREÑO, LUIS ÁNGEL",SI
AP,"ARRIOLA TUEROS, JOSÉ ALBERTO",SI
SP,"AZURÍN LOAYZA, ALFREDO",LICENCIA_POR_ENFERMEDAD
PB,"BALCÁZAR ZELADA, JOSÉ MARÍA",NO
FP,"BARBARÁN REYES, ROSANGELLA ANDREA",NO
AP-PIS,"BAZÁN CALDERÓN, DIEGO ALONSO FERNANDO",SI
CD-JPP,"BAZÁN NARRO, SIGRID TESORO",NO
PB,"BELLIDO UGARTE, GUIDO",NO
PD,"BERMEJO ROJAS, GUILLERMO",ABSTENCION
NA,"BURGOS OLIVEROS, JUAN BARTOLOMÉ",SI
FP,"BUSTAMANTE DONAYRE, ERNESTO",NO
PP,"CALLE LOBATÓN, DIGNA",LICENCIA_PERSONAL
APP,"CAMONES SORIANO, LADY MERCEDES",AUSENTE
FP,"CASTILLO RIVAS, EDUARDO ENRIQUE",NO
AP-PIS,"CAVERO ALVA, ALEJANDRO ENRIQUE",SI
PL,"CERRÓN ROJAS, WALDEMAR JOSÉ",NO
FP,"CHACÓN TRUJILLO, NILZA MERLY",NO
APP,"CHIABRA LEÓN, ROBERTO ENRIQUE",SI
AP-PIS,"CHIRINOS VENEGAS, PATRICIA ROSA",SI
PD,"CHÁVEZ CHINO, BETSSY BETZABET",LICENCIA_POR_ENFERMEDAD
RP,"CICCIA VÁSQUEZ, MIGUEL ANGEL",SI
PB,"COAYLA JUÁREZ, JORGE SAMUEL",SI
FP,"CORDERO JON TAY, LUIS GUSTAVO",SIN_RESPONDER
FP,"CORDERO JON TAY, MARÍA DEL PILAR",NO
CD-JPP,"CORTEZ AGUIRRE, ISABEL",NO
PL,"CRUZ MAMANI, FLAVIO",NO
RP,"CUETO ASERVI, JOSÉ ERNESTO",SI
PB,"CUTIPA CCAMA, VÍCTOR RAÚL",SI
AP-PIS,"CÓRDOVA LOBATÓN, MARÍA JESSICA",SI
AP,"DOROTEO CARBAJO, RAÚL FELIPE",SI
BM,"DÁVILA ATANACIO, PASIÓN NEOMIAS",SUSPENDIDO
RP,"ECHAÍZ DE NÚÑEZ IZAGA, GLADYS MARGOT",SI
PD,"ECHEVERRÍA RODRÍGUEZ, HAMLET",ABSTENCION
PP,"ELÍAS ÁVALOS, JOSÉ LUIS",NO
AP,"ESPINOZA VARGAS, JHAEC DARWIN",SI
AP,"FLORES ANCACHI, JORGE LUIS",ABSTENCION
PL,"FLORES RAMÍREZ, ALEX RANDU",NO
FP,"FLORES RUÍZ, VÍCTOR SEFERINO",NO
APP,"GARCÍA CORREA, IDELSO MANUEL",NO
PL,"GONZA CASTILLO, AMERICO",LICENCIA_OFICIAL
AP-PIS,"GONZALES DELGADO, DIANA CAROLINA",SI
FP,"GUERRA GARCÍA, CAMPOS HERNANDO",NO
BM,"GUTIÉRREZ TICONA, PAUL SILVIO",SI
APP,"HEIDINGER BALLESTEROS, NELCY",NO
RP,"HERRERA MEDINA, NOELIA ROSSVITH",SI
FP,"HUAMÁN CORONADO, RAÚL",NO
FP,"INFANTES CASTAÑEDA, MERY ELIANA",NO
SP,"JERI ORÉ, JOSÉ ENRIQUE",NO
FP,"JIMÉNEZ HEREDIA, DAVID JULIO",NO
APP,"JULON IRIGOIN, ELVA EDHIT",NO
NA,"JUÁREZ CALLE, HEIDY LISBETH",NO
FP,"JUÁREZ GALLEGOS, CARMEN PATRICIA",NO
RP,"JÁUREGUI MARTÍNEZ DE AGUAYO, MARÍA DE LOS MILAGROS JACKELINE",SI
PD,"KAMICHE MORANTE, LUIS ROBERTO",ABSTENCION
PD,"LIMACHI QUISPE, NIEVES ESMERALDA",ABSTENCION
FP,"LIZARZABURU LIZARZABURU, JUAN CARLOS MARTIN",NO
PP,"LUNA GÁLVEZ, JOSÉ LEÓN",NO
CD-JPP,"LUQUE IBARRA, RUTH",NO
FP,"LÓPEZ MORALES, JENY LUZ",NO
AP,"LÓPEZ UREÑA, ILICH FREDY",SI
PB,"MARTICORENA MENDOZA, JORGE ALFONSO",SI
AP,"MARTÍNEZ TALAVERA, PEDRO EDWIN",SI
BM,"MEDINA HERMOSILLA, ELIZABETH SARA",SI
SP,"MEDINA MINAYA, ESDRAS RICARDO",SI
PL,"MONTALVO CUBAS, SEGUNDO TORIBIO",ABSTENCION
AP,"MONTEZA FACHO, SILVIA MARÍA",SI
RP,"MONTOYA MANRIQUE, JORGE CARLOS",SI
FP,"MORANTE FIGARI, JORGE ALBERTO",NO
AP,"MORI CELIS, JUAN CARLOS",SI
FP,"MOYANO DELGADO, MARTHA LUPE",NO
RP,"MUÑANTE BARRIOS, ALEJANDRO",SI
NA,"MÁLAGA TRILLO, GEORGE EDWARD",SI
FP,"OBANDO MORGAN, AURISTELA ANA",NO
FP,"OLIVOS MARTÍNEZ, VIVIAN",NO
NA,"PABLO MEDINA, FLOR AIDEE",NO
RP,"PADILLA ROMERO, JAVIER ROMMEL",SI
PL,"PALACIOS HUÁMAN, MARGOT",NO
BM,"PAREDES CASTRO, FRANCIS JHASMINA",SI
AP,"PAREDES FONSECA, KAROL IVETT",SI
BM,"PAREDES GONZALES, ALEX ANTONIO",SI
NA,"PAREDES PIQUÉ, SUSEL ANA MARÍA",NO
PL,"PARIONA SINCHE, ALFREDO",NO
SP,"PAZO NUNURA, JOSE BERNARDO",ABSTENCION
NA,"PICÓN QUEDO, LUIS RAÚL",SI
PL,"PORTALATINO ÁVALOS, KELLY ROXANA",NO
AP,"PORTERO LÓPEZ, HILDA MARLENY",NO
BM,"QUIROZ BARBOZA, SEGUNDO TEODOMIRO",SI
PL,"QUISPE MAMANI, WILSON RUSBEL",NO
PL,"QUITO SARMIENTO, BERNARDO JAIME",NO
FP,"RAMÍREZ GARCÍA, TANIA ESTEFANY",NO
FP,"REVILLA VILLANUEVA, CÉSAR MANUEL",NO
PL,"REYES CAM, ABEL AUGUSTO",AUSENTE
CD-JPP,"REYMUNDO MERCADO, EDGARD CORNELIO",NO
PL,"RIVAS CHACARA, JANET MILAGROS",NO
PL,"ROBLES ARAUJO, SILVANA EMPERATRIZ",NO
APP,"RUÍZ RODRÍGUEZ, MAGALY ROSMERY",ABSTENCION
SP,"SAAVEDRA CASTERNOQUE, HITLER",SIN_RESPONDER
APP,"SALHUANA CAVIDES, EDUARDO",NO
AP,"SOTO PALACIOS, WILSON",SI
APP,"SOTO REYES, ALEJANDRO",NO
CD-JPP,"SÁNCHEZ PALOMINO, ROBERTO HELBERT",NO
BM,"TACURI VALDIVIA, GERMÁN ADOLFO",SI
PL,"TAIPE CORONADO, MARÍA ELIZABETH",NO
BM,"TELLO MONTES, NIVARDO EDGAR",SI
APP,"TORRES SALINAS, ROSIO",SI
APP,"TRIGOZO REÁTEGUI, CHERYL",AUSENTE
AP-PIS,"TUDELA GUTIÉRREZ, ADRIANA JOSEFINA",SI
BM,"UGARTE MAMANI, JHAKELINE KATY",SI
SP,"VALER PINTO, HÉCTOR",SIN_RESPONDER
PB,"VARAS MELÉNDEZ, ELÍAS MARCIAL",SI
FP,"VENTURA ANGEL, HÉCTOR JOSÉ",NO
AP,"VERGARA MENDOZA, ELVIS HERNÁN",SI
BM,"VÁSQUEZ VELA, LUCINDA",SI
AP-PIS,"WILLIAMS ZAPATA, JOSÉ DANIEL",SIN_RESPONDER
PP,"WONG PUJADA, ENRIQUE",SI
AP-PIS,"YARROW LUMBRERAS, NORMA MARTINA",SI
NA,"ZEA CHOQUECHAMBI, OSCAR",ABSTENCION
RP,"ZEBALLOS APONTE, JORGE ARTURO",SI
PP,"ZEBALLOS MADARIAGA, CARLOS JAVIER",NO
FP,"ZETA CHUNGA, CRUZ MARÍA",NO