grupo_parlamentario,congresista,votacion
APP,"ACUÑA PERALTA, MARÍA GRIMANEZA",SI
APP,"ACUÑA PERALTA, SEGUNDO HÉCTOR",SI
FP,"AGUINAGA RECUENCO, ALEJANDRO AURELIO",SI
PL,"AGÜERO GUTIÉRREZ, MARÍA ANTONIETA",ABSTENCION
SP,"ALCARRAZ AGUERO, YOREL KIRA",SI
FP,"ALEGRÍA GARCÍA, ARTURO",SI
AP,"ALVA PRIETO, MARÍA DEL CARMEN",SIN_RESPONDER
AP,"ALVA ROJAS, CARLOS ENRIQUE",AUSENTE
AP-PIS,"AMURUZ DULANTO, YESSICA ROSSELLI",SI
NA,"ANDERSON RAMÍREZ, CARLOS ANTONIO",SIN_RESPONDER
AP,"ARAGÓN CARREÑO, LUIS ÁNGEL",SI
AP,"ARRIOLA TUEROS, JOSÉ ALBERTO",SI
SP,"AZURÍN LOAYZA, ALFREDO",SI
PB,"BALCÁZAR ZELADA, JOSÉ MARÍA",AUSENTE
FP,"BARBARÁN REYES, ROSANGELLA ANDREA",SI
AP-PIS,"BAZÁN CALDERÓN, DIEGO ALONSO FERNANDO",ABSTENCION
CD-JPP,"BAZÁN NARRO, SIGRID TESORO",ABSTENCION
PL,"BELLIDO UGARTE, GUIDO",NO
PD,"BERMEJO ROJAS, GUILLERMO",ABSTENCION
AP-PIS,"BURGOS OLIVEROS, JUAN BARTOLOMÉ",SI
FP,"BUSTAMANTE DONAYRE, ERNESTO",SI
PP,"CALLE LOBATÓN, DIGNA",SI
APP,"CAMONES SORIANO, LADY MERCEDES",SI
FP,"CASTILLO RIVAS, EDUARDO ENRIQUE",SI
AP-PIS,"CAVERO ALVA, ALEJANDRO ENRIQUE",SI
PL,"CERRÓN ROJAS, WALDEMAR JOSÉ",NO
FP,"CHACÓN TRUJILLO, NILZA MERLY",SI
APP,"CHIABRA LEÓN, ROBERTO ENRIQUE",SI
AP-PIS,"CHIRINOS VENEGAS, PATRICIA ROSA",SI
PD,"CHÁVEZ CHINO, BETSSY BETZABET",LICENCIA_PERSONAL
RP,"CICCIA VÁSQUEZ, MIGUEL ANGEL",SI
PB,"COAYLA JUÁREZ, JORGE SAMUEL",ABSTENCION
FP,"CORDERO JON TAY, LUIS GUSTAVO",SI
FP,"CORDERO JON TAY, MARÍA DEL PILAR",SI
CD-JPP,"CORTEZ AGUIRRE, ISABEL",ABSTENCION
PL,"CRUZ MAMANI, FLAVIO",ABSTENCION
RP,"CUETO ASERVI, JOSÉ ERNESTO",SI
PB,"CUTIPA CCAMA, VÍCTOR RAÚL",ABSTENCION
AP-PIS,"CÓRDOVA LOBATÓN, MARÍA JESSICA",SI
AP,"DOROTEO CARBAJO, RAÚL FELIPE",SI
BM,"DÁVILA ATANACIO, PASIÓN NEOMIAS",NO
APP,"DÍAZ MONAGO, FREDDY RONALD",SI
APP,"ECHAÍZ DE NÚÑEZ IZAGA, GLADYS MARGOT",SI
PD,"ECHEVERRÍA RODRÍGUEZ, HAMLET",ABSTENCION
SP,"ELERA GARCÍA, WILMAR ALBERTO",SI
PP,"ELÍAS ÁVALOS, JOSÉ LUIS",AUSENTE
AP,"ESPINOZA VARGAS, JHAEC DARWIN",AUSENTE
AP,"FLORES ANCACHI, JORGE LUIS",SI
PL,"FLORES RAMÍREZ, ALEX RANDU",NO
FP,"FLORES RUÍZ, VÍCTOR SEFERINO",SI
APP,"GARCÍA CORREA, IDELSO MANUEL",SI
PL,"GONZA CASTILLO, AMERICO",ABSTENCION
AP-PIS,"GONZALES DELGADO, DIANA CAROLINA",SI
FP,"GUERRA GARCÍA, CAMPOS HERNANDO",SI
BM,"GUTIÉRREZ TICONA, PAUL SILVIO",NO
RP,"HERRERA MEDINA, NOELIA ROSSVITH",SI
FP,"HUAMÁN CORONADO, RAÚL",SI
FP,"INFANTES CASTAÑEDA, MERY ELIANA",SI
SP,"JERI ORÉ, JOSÉ ENRIQUE",SI
FP,"JIMÉNEZ HEREDIA, DAVID JULIO",SI
APP,"JULON IRIGOIN, ELVA EDHIT",SI
APP,"JUÁREZ CALLE, HEIDY LISBETH",ABSTENCION
FP,"JUÁREZ GALLEGOS, CARMEN PATRICIA",SI
RP,"JÁUREGUI MARTÍNEZ DE AGUAYO, MARÍA DE LOS MILAGROS JACKELINE",SI
PD,"KAMICHE MORANTE, LUIS ROBERTO",ABSTENCION
PD,"LIMACHI QUISPE, NIEVES ESMERALDA",LICENCIA_OFICIAL
FP,"LIZARZABURU LIZARZABURU, JUAN CARLOS MARTIN",SI
PP,"LUNA GÁLVEZ, JOSÉ LEÓN",SI
CD-JPP,"LUQUE IBARRA, RUTH",ABSTENCION
FP,"LÓPEZ MORALES, JENY LUZ",SI
AP,"LÓPEZ UREÑA, ILICH FREDY",SI
PB,"MARTICORENA MENDOZA, JORGE ALFONSO",ABSTENCION
AP,"MARTÍNEZ TALAVERA, PEDRO EDWIN",SI
BM,"MEDINA HERMOSILLA, ELIZABETH SARA",ABSTENCION
RP,"MEDINA MINAYA, ESDRAS RICARDO",SI
PL,"MONTALVO CUBAS, SEGUNDO TORIBIO",SI
AP,"MONTEZA FACHO, SILVIA MARÍA",SI
RP,"MONTOYA MANRIQUE, JORGE CARLOS",SI
FP,"MORANTE FIGARI, JORGE ALBERTO",SI
AP,"MORI CELIS, JUAN CARLOS",LICENCIA_OFICIAL
FP,"MOYANO DELGADO, MARTHA LUPE",SI
RP,"MUÑANTE BARRIOS, ALEJANDRO",SI
NA,"MÁLAGA TRILLO, GEORGE EDWARD",NO
FP,"OBANDO MORGAN, AURISTELA ANA",SI
FP,"OLIVOS MARTÍNEZ, VIVIAN",SI
NA,"PABLO MEDINA, FLOR AIDEE",SI
RP,"PADILLA ROMERO, JAVIER ROMMEL",SI
PL,"PALACIOS HUÁMAN, MARGOT",LICENCIA_POR_ENFERMEDAD
BM,"PAREDES CASTRO, FRANCIS JHASMINA",ABSTENCION
AP,"PAREDES FONSECA, KAROL IVETT",LICENCIA_POR_ENFERMEDAD
BM,"PAREDES GONZALES, ALEX ANTONIO",SIN_RESPONDER
NA,"PAREDES PIQUÉ, SUSEL ANA MARÍA",ABSTENCION
PL,"PARIONA SINCHE, ALFREDO",NO
NA,"PICÓN QUEDO, LUIS RAÚL",SI
PL,"PORTALATINO ÁVALOS, KELLY ROXANA",ABSTENCION
AP,"PORTERO LÓPEZ, HILDA MARLENY",SI
BM,"QUIROZ BARBOZA, SEGUNDO TEODOMIRO",ABSTENCION
PL,"QUISPE MAMANI, WILSON RUSBEL",ABSTENCION
PL,"QUITO SARMIENTO, BERNARDO JAIME",NO
FP,"RAMÍREZ GARCÍA, TANIA ESTEFANY",AUSENTE
FP,"REVILLA VILLANUEVA, CÉSAR MANUEL",SI
PL,"REYES CAM, ABEL AUGUSTO",AUSENTE
CD-JPP,"REYMUNDO MERCADO, EDGARD CORNELIO",ABSTENCION
PL,"RIVAS CHACARA, JANET MILAGROS",ABSTENCION
PL,"ROBLES ARAUJO, SILVANA EMPERATRIZ",ABSTENCION
APP,"RUÍZ RODRÍGUEZ, MAGALY ROSMERY",SI
SP,"SAAVEDRA CASTERNOQUE, HITLER",SI
APP,"SALHUANA CAVIDES, EDUARDO",SI
AP,"SOTO PALACIOS, WILSON",SI
APP,"SOTO REYES, ALEJANDRO",SI
CD-JPP,"SÁNCHEZ PALOMINO, ROBERTO HELBERT",ABSTENCION
BM,"TACURI VALDIVIA, GERMÁN ADOLFO",NO
PL,"TAIPE CORONADO, MARÍA ELIZABETH",ABSTENCION
BM,"TELLO MONTES, NIVARDO EDGAR",ABSTENCION
APP,"TORRES SALINAS, ROSIO",SI
APP,"TRIGOZO REÁTEGUI, CHERYL",SI
AP-PIS,"TUDELA GUTIÉRREZ, ADRIANA JOSEFINA",SI
BM,"UGARTE MAMANI, JHAKELINE KATY",ABSTENCION
PD,"VALER PINTO, HÉCTOR",ABSTENCION
PB,"VARAS MELÉNDEZ, ELÍAS MARCIAL",ABSTENCION
FP,"VENTURA ANGEL, HÉCTOR JOSÉ",SI
AP,"VERGARA MENDOZA, ELVIS HERNÁN",SI
BM,"VÁSQUEZ VELA, LUCINDA",ABSTENCION
AP-PIS,"WILLIAMS ZAPATA, JOSÉ DANIEL",SI
PP,"WONG PUJADA, ENRIQUE",SI
AP-PIS,"YARROW LUMBRERAS, NORMA MARTINA",SI
PP,"ZEA CHOQUECHAMBI, OSCAR",LICENCIA_POR_ENFERMEDAD
RP,"ZEBALLOS APONTE, JORGE ARTURO",SI
PD,"ZEBALLOS MADARIAGA, CARLOS JAVIER",SI
FP,"ZETA CHUNGA, CRUZ MARÍA",SI