grupo_parlamentario,congresista,votacion
APP,"ACUÑA PERALTA, MARÍA GRIMANEZA",SI
CD,"ACUÑA PERALTA, SEGUNDO HÉCTOR",AUSENTE
FP,"AGUINAGA RECUENCO, ALEJANDRO AURELIO",SI
PL,"AGÜERO GUTIÉRREZ, MARÍA ANTONIETA",SI
CD,"ALCARRAZ AGUERO, YOREL KIRA",SI
FP,"ALEGRÍA GARCÍA, ARTURO",SI
AP,"ALVA PRIETO, MARÍA DEL CARMEN",SI
CD,"ALVA ROJAS, CARLOS ENRIQUE",SI
AP-PIS,"AMURUZ DULANTO, YESSICA ROSSELLI",SI
NA,"ANDERSON RAMÍREZ, CARLOS ANTONIO",SI
AP,"ARAGÓN CARREÑO, LUIS ÁNGEL",SI
AP,"ARRIOLA TUEROS, JOSÉ ALBERTO",SI
SP,"AZURÍN LOAYZA, ALFREDO",SI
PB,"BALCÁZAR ZELADA, JOSÉ MARÍA",NO
FP,"BARBARÁN REYES, ROSANGELLA ANDREA",SI
AP-PIS,"BAZÁN CALDERÓN, DIEGO ALONSO FERNANDO",SI
CD-JPP,"BAZÁN NARRO, SIGRID TESORO",NO
PL,"BELLIDO UGARTE, GUIDO",SI
PD,"BERMEJO ROJAS, GUILLERMO",LICENCIA_POR_ENFERMEDAD
PP,"BURGOS OLIVEROS, JUAN BARTOLOMÉ",SI
FP,"BUSTAMANTE DONAYRE, ERNESTO",SI
PP,"CALLE LOBATÓN, DIGNA",SI
FP,"CASTILLO RIVAS, EDUARDO ENRIQUE",SI
AP-PIS,"CAVERO ALVA, ALEJANDRO ENRIQUE",SI
PL,"CERRÓN ROJAS, WALDEMAR JOSÉ",SI
FP,"CHACÓN TRUJILLO, NILZA MERLY",SI
APP,"CHIABRA LEÓN, ROBERTO ENRIQUE",SI
AP-PIS,"CHIRINOS VENEGAS, PATRICIA ROSA",SIN_RESPONDER
PD,"CHÁVEZ CHINO, BETSSY BETZABET",LICENCIA_OFICIAL
RP,"CICCIA VÁSQUEZ, MIGUEL ANGEL",SI
PB,"COAYLA JUÁREZ, JORGE SAMUEL",NO
FP,"CORDERO JON TAY, LUIS GUSTAVO",SI
FP,"CORDERO JON TAY, MARÍA DEL PILAR",SI
CD-JPP,"CORTEZ AGUIRRE, ISABEL",NO
PL,"CRUZ MAMANI, FLAVIO",SI
RP,"CUETO ASERVI, JOSÉ ERNESTO",SI
PB,"CUTIPA CCAMA, VÍCTOR RAÚL",SI
AP-PIS,"CÓRDOVA LOBATÓN, MARÍA JESSICA",SI
AP,"DOROTEO CARBAJO, RAÚL FELIPE",SI
BM,"DÁVILA ATANACIO, PASIÓN NEOMIAS",NO
NA,"DÍAZ MONAGO, FREDDY RONALD",SI
RP,"ECHAÍZ DE NÚÑEZ IZAGA, GLADYS MARGOT",AUSENTE
PD,"ECHEVERRÍA RODRÍGUEZ, HAMLET",NO
SP,"ELERA GARCÍA, WILMAR ALBERTO",LICENCIA_POR_ENFERMEDAD
PP,"ELÍAS ÁVALOS, JOSÉ LUIS",SI
AP,"ESPINOZA VARGAS, JHAEC DARWIN",SI
AP,"FLORES ANCACHI, JORGE LUIS",SI
PL,"FLORES RAMÍREZ, ALEX RANDU",NO
FP,"FLORES RUÍZ, VÍCTOR SEFERINO",SI
APP,"GARCÍA CORREA, IDELSO MANUEL",SI
PL,"GONZA CASTILLO, AMERICO",SI
AP-PIS,"GONZALES DELGADO, DIANA CAROLINA",SI
FP,"GUERRA GARCÍA, CAMPOS HERNANDO",SI
BM,"GUTIÉRREZ TICONA, PAUL SILVIO",SI
RP,"HERRERA MEDINA, NOELIA ROSSVITH",SI
FP,"HUAMÁN CORONADO, RAÚL",SI
FP,"INFANTES CASTAÑEDA, MERY ELIANA",SI
SP,"JERI ORÉ, JOSÉ ENRIQUE",SI
FP,"JIMÉNEZ HEREDIA, DAVID JULIO",SI
APP,"JULON IRIGOIN, ELVA EDHIT",SI
APP,"JUÁREZ CALLE, HEIDY LISBETH",SI
FP,"JUÁREZ GALLEGOS, CARMEN PATRICIA",SI
RP,"JÁUREGUI MARTÍNEZ DE AGUAYO, MARÍA DE LOS MILAGROS JACKELINE",SI
PD,"KAMICHE MORANTE, LUIS ROBERTO",SI
PD,"LIMACHI QUISPE, NIEVES ESMERALDA",NO
APP,"LIZARZABURU LIZARZABURU, JUAN CARLOS MARTIN",SI
PP,"LUNA GÁLVEZ, JOSÉ LEÓN",SI
CD-JPP,"LUQUE IBARRA, RUTH",NO
FP,"LÓPEZ MORALES, JENY LUZ",SI
AP,"LÓPEZ UREÑA, ILICH FREDY",SI
PB,"MARTICORENA MENDOZA, JORGE ALFONSO",NO
AP,"MARTÍNEZ TALAVERA, PEDRO EDWIN",SI
BM,"MEDINA HERMOSILLA, ELIZABETH SARA",LICENCIA_OFICIAL
SP,"MEDINA MINAYA, ESDRAS RICARDO",SI
PL,"MONTALVO CUBAS, SEGUNDO TORIBIO",SI
AP,"MONTEZA FACHO, SILVIA MARÍA",SI
RP,"MONTOYA MANRIQUE, JORGE CARLOS",SI
FP,"MORANTE FIGARI, JORGE ALBERTO",SI
AP,"MORI CELIS, JUAN CARLOS",LICENCIA_POR_ENFERMEDAD
FP,"MOYANO DELGADO, MARTHA LUPE",SI
RP,"MUÑANTE BARRIOS, ALEJANDRO",SI
NA,"MÁLAGA TRILLO, GEORGE EDWARD",SI
FP,"OBANDO MORGAN, AURISTELA ANA",SI
FP,"OLIVOS MARTÍNEZ, VIVIAN",SI
CD,"PABLO MEDINA, FLOR AIDEE",SI
RP,"PADILLA ROMERO, JAVIER ROMMEL",SI
PL,"PALACIOS HUÁMAN, MARGOT",SI
BM,"PAREDES CASTRO, FRANCIS JHASMINA",NO
AP,"PAREDES FONSECA, KAROL IVETT",SI
BM,"PAREDES GONZALES, ALEX ANTONIO",LICENCIA_POR_ENFERMEDAD
CD,"PAREDES PIQUÉ, SUSEL ANA MARÍA",NO
PL,"PARIONA SINCHE, ALFREDO",ABSTENCION
NA,"PICÓN QUEDO, LUIS RAÚL",SI
PL,"PORTALATINO ÁVALOS, KELLY ROXANA",SI
AP,"PORTERO LÓPEZ, HILDA MARLENY",SI
BM,"QUIROZ BARBOZA, SEGUNDO TEODOMIRO",NO
PL,"QUISPE MAMANI, WILSON RUSBEL",ABSTENCION
PL,"QUITO SARMIENTO, BERNARDO JAIME",SI
FP,"RAMÍREZ GARCÍA, TANIA ESTEFANY",SI
FP,"REVILLA VILLANUEVA, CÉSAR MANUEL",SI
PL,"REYES CAM, ABEL AUGUSTO",AUSENTE
CD-JPP,"REYMUNDO MERCADO, EDGARD CORNELIO",SI
PL,"RIVAS CHACARA, JANET MILAGROS",SI
PL,"ROBLES ARAUJO, SILVANA EMPERATRIZ",NO
APP,"RUÍZ RODRÍGUEZ, MAGALY ROSMERY",LICENCIA_POR_ENFERMEDAD
SP,"SAAVEDRA CASTERNOQUE, HITLER",SI
APP,"SALHUANA CAVIDES, EDUARDO",SI
AP,"SOTO PALACIOS, WILSON",SI
APP,"SOTO REYES, ALEJANDRO",SI
CD-JPP,"SÁNCHEZ PALOMINO, ROBERTO HELBERT",NO
BM,"TACURI VALDIVIA, GERMÁN ADOLFO",NO
PL,"TAIPE CORONADO, MARÍA ELIZABETH",SI
BM,"TELLO MONTES, NIVARDO EDGAR",SI
APP,"TORRES SALINAS, ROSIO",SI
APP,"TRIGOZO REÁTEGUI, CHERYL",SI
AP-PIS,"TUDELA GUTIÉRREZ, ADRIANA JOSEFINA",SI
BM,"UGARTE MAMANI, JHAKELINE KATY",NO
PD,"VALER PINTO, HÉCTOR",LICENCIA_POR_ENFERMEDAD
PB,"VARAS MELÉNDEZ, ELÍAS MARCIAL",NO
FP,"VENTURA ANGEL, HÉCTOR JOSÉ",SI
AP,"VERGARA MENDOZA, ELVIS HERNÁN",SI
BM,"VÁSQUEZ VELA, LUCINDA",SI
AP-PIS,"WILLIAMS ZAPATA, JOSÉ DANIEL",SI
PP,"WONG PUJADA, ENRIQUE",SI
AP-PIS,"YARROW LUMBRERAS, NORMA MARTINA",SI
PP,"ZEA CHOQUECHAMBI, OSCAR",SI
RP,"ZEBALLOS APONTE, JORGE ARTURO",LICENCIA_POR_ENFERMEDAD
CD,"ZEBALLOS MADARIAGA, CARLOS JAVIER",SI
FP,"ZETA CHUNGA, CRUZ MARÍA",SI