grupo_parlamentario,congresista,votacion
APP,"ACUÑA PERALTA, MARÍA GRIMANEZA",LICENCIA_PERSONAL
NA,"ACUÑA PERALTA, SEGUNDO HÉCTOR",SI
FP,"AGUINAGA RECUENCO, ALEJANDRO AURELIO",AUSENTE
PL,"AGÜERO GUTIÉRREZ, MARÍA ANTONIETA",SI
PP,"ALCARRAZ AGUERO, YOREL KIRA",SI
FP,"ALEGRÍA GARCÍA, ARTURO",SI
AP,"ALVA PRIETO, MARÍA DEL CARMEN",SI
NA,"ALVA ROJAS, CARLOS ENRIQUE",SI
AP-PIS,"AMURUZ DULANTO, YESSICA ROSSELLI",AUSENTE
NA,"ANDERSON RAMÍREZ, CARLOS ANTONIO",SI
AP,"ARAGÓN CARREÑO, LUIS ÁNGEL",SI
AP,"ARRIOLA TUEROS, JOSÉ ALBERTO",SI
SP,"AZURÍN LOAYZA, ALFREDO",SI
PB,"BALCÁZAR ZELADA, JOSÉ MARÍA",NO
FP,"BARBARÁN REYES, ROSANGELLA ANDREA",SI
AP-PIS,"BAZÁN CALDERÓN, DIEGO ALONSO FERNANDO",AUSENTE
CD-JPP,"BAZÁN NARRO, SIGRID TESORO",NO
PB,"BELLIDO UGARTE, GUIDO",SI
CD-JPP,"BERMEJO ROJAS, GUILLERMO",ABSTENCION
NA,"BURGOS OLIVEROS, JUAN BARTOLOMÉ",AUSENTE
FP,"BUSTAMANTE DONAYRE, ERNESTO",LICENCIA_POR_ENFERMEDAD
PP,"CALLE LOBATÓN, DIGNA",LICENCIA_PERSONAL
APP,"CAMONES SORIANO, LADY MERCEDES",LICENCIA_OFICIAL
FP,"CASTILLO RIVAS, EDUARDO ENRIQUE",SI
AP-PIS,"CAVERO ALVA, ALEJANDRO ENRIQUE",AUSENTE
PL,"CERRÓN ROJAS, WALDEMAR JOSÉ",SI
FP,"CHACÓN TRUJILLO, NILZA MERLY",SI
APP,"CHIABRA LEÓN, ROBERTO ENRIQUE",SI
AP-PIS,"CHIRINOS VENEGAS, PATRICIA ROSA",SI
RP,"CICCIA VÁSQUEZ, MIGUEL ANGEL",SI
PB,"COAYLA JUÁREZ, JORGE SAMUEL",SI
FP,"CORDERO JON TAY, LUIS GUSTAVO",SI
NA,"CORDERO JON TAY, MARÍA DEL PILAR",LICENCIA_POR_ENFERMEDAD
CD-JPP,"CORTEZ AGUIRRE, ISABEL",SI
PL,"CRUZ MAMANI, FLAVIO",SI
RP,"CUETO ASERVI, JOSÉ ERNESTO",SI
PB,"CUTIPA CCAMA, VÍCTOR RAÚL",AUSENTE
AP-PIS,"CÓRDOVA LOBATÓN, MARÍA JESSICA",SI
AP,"DOROTEO CARBAJO, RAÚL FELIPE",AUSENTE
BM,"DÁVILA ATANACIO, PASIÓN NEOMIAS",SI
RP,"ECHAÍZ DE NÚÑEZ IZAGA, GLADYS MARGOT",SI
CD-JPP,"ECHEVERRÍA RODRÍGUEZ, HAMLET",ABSTENCION
PP,"ELÍAS ÁVALOS, JOSÉ LUIS",SI
AP,"ESPINOZA VARGAS, JHAEC DARWIN",ABSTENCION
AP,"FLORES ANCACHI, JORGE LUIS",NO
PL,"FLORES RAMÍREZ, ALEX RANDU",NO
FP,"FLORES RUÍZ, VÍCTOR SEFERINO",SI
APP,"GARCÍA CORREA, IDELSO MANUEL",SI
PL,"GONZA CASTILLO, AMERICO",SI
AP-PIS,"GONZALES DELGADO, DIANA CAROLINA",SI
FP,"GUERRA GARCÍA, CAMPOS HERNANDO",SI
BM,"GUTIÉRREZ TICONA, PAUL SILVIO",SI
APP,"HEIDINGER BALLESTEROS, NELCY",SI
RP,"HERRERA MEDINA, NOELIA ROSSVITH",LICENCIA_POR_ENFERMEDAD
FP,"HUAMÁN CORONADO, RAÚL",SI
FP,"INFANTES CASTAÑEDA, MERY ELIANA",SI
SP,"JERI ORÉ, JOSÉ ENRIQUE",SI
FP,"JIMÉNEZ HEREDIA, DAVID JULIO",SI
APP,"JULON IRIGOIN, ELVA EDHIT",SI
PP,"JUÁREZ CALLE, HEIDY LISBETH",AUSENTE
FP,"JUÁREZ GALLEGOS, CARMEN PATRICIA",SI
RP,"JÁUREGUI MARTÍNEZ DE AGUAYO, MARÍA DE LOS MILAGROS JACKELINE",LICENCIA_POR_ENFERMEDAD
CD-JPP,"KAMICHE MORANTE, LUIS ROBERTO",LICENCIA_POR_ENFERMEDAD
CD-JPP,"LIMACHI QUISPE, NIEVES ESMERALDA",LICENCIA_POR_ENFERMEDAD
FP,"LIZARZABURU LIZARZABURU, JUAN CARLOS MARTIN",SI
PP,"LUNA GÁLVEZ, JOSÉ LEÓN",SI
CD-JPP,"LUQUE IBARRA, RUTH",NO
FP,"LÓPEZ MORALES, JENY LUZ",SI
AP,"LÓPEZ UREÑA, ILICH FREDY",AUSENTE
PB,"MARTICORENA MENDOZA, JORGE ALFONSO",SI
AP,"MARTÍNEZ TALAVERA, PEDRO EDWIN",SI
BM,"MEDINA HERMOSILLA, ELIZABETH SARA",SI
SP,"MEDINA MINAYA, ESDRAS RICARDO",SI
PL,"MITA ALANOCA, ISAAC",SI
PL,"MONTALVO CUBAS, SEGUNDO TORIBIO",SI
AP,"MONTEZA FACHO, SILVIA MARÍA",SI
RP,"MONTOYA MANRIQUE, JORGE CARLOS",SI
FP,"MORANTE FIGARI, JORGE ALBERTO",LICENCIA_POR_ENFERMEDAD
AP,"MORI CELIS, JUAN CARLOS",SI
FP,"MOYANO DELGADO, MARTHA LUPE",SIN_RESPONDER
RP,"MUÑANTE BARRIOS, ALEJANDRO",SI
NA,"MÁLAGA TRILLO, GEORGE EDWARD",ABSTENCION
FP,"OBANDO MORGAN, AURISTELA ANA",SI
FP,"OLIVOS MARTÍNEZ, VIVIAN",SI
NA,"PABLO MEDINA, FLOR AIDEE",NO
RP,"PADILLA ROMERO, JAVIER ROMMEL",SI
PL,"PALACIOS HUÁMAN, MARGOT",SI
BM,"PAREDES CASTRO, FRANCIS JHASMINA",SI
AP,"PAREDES FONSECA, KAROL IVETT",SI
BM,"PAREDES GONZALES, ALEX ANTONIO",AUSENTE
NA,"PAREDES PIQUÉ, SUSEL ANA MARÍA",NO
PL,"PARIONA SINCHE, ALFREDO",LICENCIA_POR_ENFERMEDAD
SP,"PAZO NUNURA, JOSE BERNARDO",LICENCIA_POR_ENFERMEDAD
NA,"PICÓN QUEDO, LUIS RAÚL",SI
PL,"PORTALATINO ÁVALOS, KELLY ROXANA",AUSENTE
AP,"PORTERO LÓPEZ, HILDA MARLENY",SI
BM,"QUIROZ BARBOZA, SEGUNDO TEODOMIRO",LICENCIA_OFICIAL
PL,"QUISPE MAMANI, WILSON RUSBEL",NO
PL,"QUITO SARMIENTO, BERNARDO JAIME",SIN_RESPONDER
FP,"RAMÍREZ GARCÍA, TANIA ESTEFANY",SI
FP,"REVILLA VILLANUEVA, CÉSAR MANUEL",SI
PL,"REYES CAM, ABEL AUGUSTO",SI
CD-JPP,"REYMUNDO MERCADO, EDGARD CORNELIO",ABSTENCION
PL,"RIVAS CHACARA, JANET MILAGROS",SI
PL,"ROBLES ARAUJO, SILVANA EMPERATRIZ",NO
APP,"RUÍZ RODRÍGUEZ, MAGALY ROSMERY",SI
SP,"SAAVEDRA CASTERNOQUE, HITLER",SI
APP,"SALHUANA CAVIDES, EDUARDO",AUSENTE
AP,"SOTO PALACIOS, WILSON",LICENCIA_POR_ENFERMEDAD
APP,"SOTO REYES, ALEJANDRO",SI
CD-JPP,"SÁNCHEZ PALOMINO, ROBERTO HELBERT",ABSTENCION
BM,"TACURI VALDIVIA, GERMÁN ADOLFO",SI
PL,"TAIPE CORONADO, MARÍA ELIZABETH",SI
BM,"TELLO MONTES, NIVARDO EDGAR",SI
APP,"TORRES SALINAS, ROSIO",AUSENTE
APP,"TRIGOZO REÁTEGUI, CHERYL",SI
AP-PIS,"TUDELA GUTIÉRREZ, ADRIANA JOSEFINA",AUSENTE
NA,"UGARTE MAMANI, JHAKELINE KATY",SI
SP,"VALER PINTO, HÉCTOR",NO
PB,"VARAS MELÉNDEZ, ELÍAS MARCIAL",SI
FP,"VENTURA ANGEL, HÉCTOR JOSÉ",SI
AP,"VERGARA MENDOZA, ELVIS HERNÁN",LICENCIA_OFICIAL
BM,"VÁSQUEZ VELA, LUCINDA",SI
AP-PIS,"WILLIAMS ZAPATA, JOSÉ DANIEL",SIN_RESPONDER
NA,"WONG PUJADA, ENRIQUE",SUSPENDIDO
AP-PIS,"YARROW LUMBRERAS, NORMA MARTINA",SI
NA,"ZEA CHOQUECHAMBI, OSCAR",SI
RP,"ZEBALLOS APONTE, JORGE ARTURO",SI
PP,"ZEBALLOS MADARIAGA, CARLOS JAVIER",ABSTENCION
FP,"ZETA CHUNGA, CRUZ MARÍA",SI
