grupo_parlamentario,congresista,votacion
APP,"ACUÑA PERALTA, MARÍA GRIMANEZA",SI
NA,"ACUÑA PERALTA, SEGUNDO HÉCTOR",SI
FP,"AGUINAGA RECUENCO, ALEJANDRO AURELIO",NO
PL,"AGÜERO GUTIÉRREZ, MARÍA ANTONIETA",AUSENTE
PP,"ALCARRAZ AGUERO, YOREL KIRA",LICENCIA_POR_ENFERMEDAD
FP,"ALEGRÍA GARCÍA, ARTURO",AUSENTE
AP,"ALVA PRIETO, MARÍA DEL CARMEN",SI
NA,"ALVA ROJAS, CARLOS ENRIQUE",SI
AP-PIS,"AMURUZ DULANTO, YESSICA ROSSELLI",ABSTENCION
NA,"ANDERSON RAMÍREZ, CARLOS ANTONIO",AUSENTE
AP,"ARAGÓN CARREÑO, LUIS ÁNGEL",SI
AP,"ARRIOLA TUEROS, JOSÉ ALBERTO",SI
SP,"AZURÍN LOAYZA, ALFREDO",ABSTENCION
PB,"BALCÁZAR ZELADA, JOSÉ MARÍA",LICENCIA_POR_ENFERMEDAD
FP,"BARBARÁN REYES, ROSANGELLA ANDREA",ABSTENCION
AP-PIS,"BAZÁN CALDERÓN, DIEGO ALONSO FERNANDO",SIN_RESPONDER
CD-JPP,"BAZÁN NARRO, SIGRID TESORO",SI
PB,"BELLIDO UGARTE, GUIDO",SI
CD-JPP,"BERMEJO ROJAS, GUILLERMO",SI
NA,"BURGOS OLIVEROS, JUAN BARTOLOMÉ",SI
FP,"BUSTAMANTE DONAYRE, ERNESTO",NO
PP,"CALLE LOBATÓN, DIGNA",LICENCIA_PERSONAL
APP,"CAMONES SORIANO, LADY MERCEDES",SI
FP,"CASTILLO RIVAS, EDUARDO ENRIQUE",AUSENTE
AP-PIS,"CAVERO ALVA, ALEJANDRO ENRIQUE",ABSTENCION
PL,"CERRÓN ROJAS, WALDEMAR JOSÉ",SI
FP,"CHACÓN TRUJILLO, NILZA MERLY",ABSTENCION
APP,"CHIABRA LEÓN, ROBERTO ENRIQUE",SI
AP-PIS,"CHIRINOS VENEGAS, PATRICIA ROSA",LICENCIA_OFICIAL
RP,"CICCIA VÁSQUEZ, MIGUEL ANGEL",SI
PB,"COAYLA JUÁREZ, JORGE SAMUEL",SI
FP,"CORDERO JON TAY, LUIS GUSTAVO",AUSENTE
FP,"CORDERO JON TAY, MARÍA DEL PILAR",AUSENTE
CD-JPP,"CORTEZ AGUIRRE, ISABEL",SI
PL,"CRUZ MAMANI, FLAVIO",SI
RP,"CUETO ASERVI, JOSÉ ERNESTO",SI
PB,"CUTIPA CCAMA, VÍCTOR RAÚL",SI
AP-PIS,"CÓRDOVA LOBATÓN, MARÍA JESSICA",SI
AP,"DOROTEO CARBAJO, RAÚL FELIPE",AUSENTE
BM,"DÁVILA ATANACIO, PASIÓN NEOMIAS",SUSPENDIDO
RP,"ECHAÍZ DE NÚÑEZ IZAGA, GLADYS MARGOT",SI
CD-JPP,"ECHEVERRÍA RODRÍGUEZ, HAMLET",SI
PP,"ELÍAS ÁVALOS, JOSÉ LUIS",AUSENTE
AP,"ESPINOZA VARGAS, JHAEC DARWIN",AUSENTE
AP,"FLORES ANCACHI, JORGE LUIS",SI
PL,"FLORES RAMÍREZ, ALEX RANDU",LICENCIA_OFICIAL
FP,"FLORES RUÍZ, VÍCTOR SEFERINO",NO
APP,"GARCÍA CORREA, IDELSO MANUEL",AUSENTE
PL,"GONZA CASTILLO, AMERICO",AUSENTE
AP-PIS,"GONZALES DELGADO, DIANA CAROLINA",ABSTENCION
FP,"GUERRA GARCÍA, CAMPOS HERNANDO",NO
BM,"GUTIÉRREZ TICONA, PAUL SILVIO",AUSENTE
APP,"HEIDINGER BALLESTEROS, NELCY",SI
RP,"HERRERA MEDINA, NOELIA ROSSVITH",SI
FP,"HUAMÁN CORONADO, RAÚL",LICENCIA_POR_ENFERMEDAD
FP,"INFANTES CASTAÑEDA, MERY ELIANA",ABSTENCION
SP,"JERI ORÉ, JOSÉ ENRIQUE",SIN_RESPONDER
FP,"JIMÉNEZ HEREDIA, DAVID JULIO",NO
APP,"JULON IRIGOIN, ELVA EDHIT",SI
PP,"JUÁREZ CALLE, HEIDY LISBETH",SI
FP,"JUÁREZ GALLEGOS, CARMEN PATRICIA",NO
RP,"JÁUREGUI MARTÍNEZ DE AGUAYO, MARÍA DE LOS MILAGROS JACKELINE",SI
CD-JPP,"KAMICHE MORANTE, LUIS ROBERTO",SI
CD-JPP,"LIMACHI QUISPE, NIEVES ESMERALDA",LICENCIA_POR_ENFERMEDAD
FP,"LIZARZABURU LIZARZABURU, JUAN CARLOS MARTIN",NO
PP,"LUNA GÁLVEZ, JOSÉ LEÓN",SI
CD-JPP,"LUQUE IBARRA, RUTH",SI
FP,"LÓPEZ MORALES, JENY LUZ",LICENCIA_OFICIAL
AP,"LÓPEZ UREÑA, ILICH FREDY",SI
PB,"MARTICORENA MENDOZA, JORGE ALFONSO",SI
AP,"MARTÍNEZ TALAVERA, PEDRO EDWIN",SI
BM,"MEDINA HERMOSILLA, ELIZABETH SARA",AUSENTE
SP,"MEDINA MINAYA, ESDRAS RICARDO",SI
PL,"MITA ALANOCA, ISAAC",SI
PL,"MONTALVO CUBAS, SEGUNDO TORIBIO",SI
AP,"MONTEZA FACHO, SILVIA MARÍA",SI
RP,"MONTOYA MANRIQUE, JORGE CARLOS",SI
FP,"MORANTE FIGARI, JORGE ALBERTO",NO
AP,"MORI CELIS, JUAN CARLOS",LICENCIA_OFICIAL
FP,"MOYANO DELGADO, MARTHA LUPE",NO
RP,"MUÑANTE BARRIOS, ALEJANDRO",SI
NA,"MÁLAGA TRILLO, GEORGE EDWARD",SI
FP,"OBANDO MORGAN, AURISTELA ANA",NO
FP,"OLIVOS MARTÍNEZ, VIVIAN",LICENCIA_POR_ENFERMEDAD
NA,"PABLO MEDINA, FLOR AIDEE",SI
RP,"PADILLA ROMERO, JAVIER ROMMEL",SI
PL,"PALACIOS HUÁMAN, MARGOT",SI
BM,"PAREDES CASTRO, FRANCIS JHASMINA",SI
AP,"PAREDES FONSECA, KAROL IVETT",LICENCIA_OFICIAL
BM,"PAREDES GONZALES, ALEX ANTONIO",AUSENTE
NA,"PAREDES PIQUÉ, SUSEL ANA MARÍA",SIN_RESPONDER
PL,"PARIONA SINCHE, ALFREDO",LICENCIA_OFICIAL
SP,"PAZO NUNURA, JOSE BERNARDO",LICENCIA_POR_ENFERMEDAD
NA,"PICÓN QUEDO, LUIS RAÚL",SI
PL,"PORTALATINO ÁVALOS, KELLY ROXANA",AUSENTE
AP,"PORTERO LÓPEZ, HILDA MARLENY",SI
BM,"QUIROZ BARBOZA, SEGUNDO TEODOMIRO",LICENCIA_PERSONAL
PL,"QUISPE MAMANI, WILSON RUSBEL",AUSENTE
PL,"QUITO SARMIENTO, BERNARDO JAIME",SI
FP,"RAMÍREZ GARCÍA, TANIA ESTEFANY",ABSTENCION
FP,"REVILLA VILLANUEVA, CÉSAR MANUEL",NO
PL,"REYES CAM, ABEL AUGUSTO",AUSENTE
CD-JPP,"REYMUNDO MERCADO, EDGARD CORNELIO",SI
PL,"RIVAS CHACARA, JANET MILAGROS",SI
PL,"ROBLES ARAUJO, SILVANA EMPERATRIZ",SI
APP,"RUÍZ RODRÍGUEZ, MAGALY ROSMERY",SI
SP,"SAAVEDRA CASTERNOQUE, HITLER",SI
APP,"SALHUANA CAVIDES, EDUARDO",SI
AP,"SOTO PALACIOS, WILSON",AUSENTE
APP,"SOTO REYES, ALEJANDRO",SI
CD-JPP,"SÁNCHEZ PALOMINO, ROBERTO HELBERT",LICENCIA_PERSONAL
BM,"TACURI VALDIVIA, GERMÁN ADOLFO",SI
PL,"TAIPE CORONADO, MARÍA ELIZABETH",LICENCIA_PERSONAL
BM,"TELLO MONTES, NIVARDO EDGAR",SI
APP,"TORRES SALINAS, ROSIO",SI
APP,"TRIGOZO REÁTEGUI, CHERYL",SI
AP-PIS,"TUDELA GUTIÉRREZ, ADRIANA JOSEFINA",AUSENTE
NA,"UGARTE MAMANI, JHAKELINE KATY",SI
SP,"VALER PINTO, HÉCTOR",SIN_RESPONDER
PB,"VARAS MELÉNDEZ, ELÍAS MARCIAL",SI
FP,"VENTURA ANGEL, HÉCTOR JOSÉ",NO
AP,"VERGARA MENDOZA, ELVIS HERNÁN",ABSTENCION
BM,"VÁSQUEZ VELA, LUCINDA",SI
AP-PIS,"WILLIAMS ZAPATA, JOSÉ DANIEL",SIN_RESPONDER
NA,"WONG PUJADA, ENRIQUE",SUSPENDIDO
AP-PIS,"YARROW LUMBRERAS, NORMA MARTINA",ABSTENCION
NA,"ZEA CHOQUECHAMBI, OSCAR",LICENCIA_POR_ENFERMEDAD
RP,"ZEBALLOS APONTE, JORGE ARTURO",SI
PP,"ZEBALLOS MADARIAGA, CARLOS JAVIER",SI
FP,"ZETA CHUNGA, CRUZ MARÍA",ABSTENCION