grupo_parlamentario,congresista,votacion
APP,"ACUÑA PERALTA, MARÍA GRIMANEZA",ABSTENCION
ID,"ACUÑA PERALTA, SEGUNDO HÉCTOR",LICENCIA_POR_ENFERMEDAD
FP,"AGUINAGA RECUENCO, ALEJANDRO AURELIO",NO
PL,"AGÜERO GUTIÉRREZ, MARÍA ANTONIETA",SI
ID,"ALCARRAZ AGUERO, YOREL KIRA",SI
FP,"ALEGRÍA GARCÍA, ARTURO",NO
AP,"ALVA PRIETO, MARÍA DEL CARMEN",NO
ID,"ALVA ROJAS, CARLOS ENRIQUE",SI
AP-PIS,"AMURUZ DULANTO, YESSICA ROSSELLI",NO
NA,"ANDERSON RAMÍREZ, CARLOS ANTONIO",NO
AP,"ARAGÓN CARREÑO, LUIS ÁNGEL",SI
AP,"ARRIOLA TUEROS, JOSÉ ALBERTO",NO
SP,"AZURÍN LOAYZA, ALFREDO",NO
PB,"BALCÁZAR ZELADA, JOSÉ MARÍA",SI
FP,"BARBARÁN REYES, ROSANGELLA ANDREA",NO
AP-PIS,"BAZÁN CALDERÓN, DIEGO ALONSO FERNANDO",NO
CD-JPP,"BAZÁN NARRO, SIGRID TESORO",SI
PL,"BELLIDO UGARTE, GUIDO",SI
PD,"BERMEJO ROJAS, GUILLERMO",SI
PP,"BURGOS OLIVEROS, JUAN BARTOLOMÉ",NO
FP,"BUSTAMANTE DONAYRE, ERNESTO",NO
PP,"CALLE LOBATÓN, DIGNA",SI
APP,"CAMONES SORIANO, LADY MERCEDES",NO
FP,"CASTILLO RIVAS, EDUARDO ENRIQUE",NO
AP-PIS,"CAVERO ALVA, ALEJANDRO ENRIQUE",NO
PL,"CERRÓN ROJAS, WALDEMAR JOSÉ",SI
FP,"CHACÓN TRUJILLO, NILZA MERLY",NO
APP,"CHIABRA LEÓN, ROBERTO ENRIQUE",NO
AP-PIS,"CHIRINOS VENEGAS, PATRICIA ROSA",NO
PD,"CHÁVEZ CHINO, BETSSY BETZABET",LICENCIA_OFICIAL
RP,"CICCIA VÁSQUEZ, MIGUEL ANGEL",LICENCIA_OFICIAL
PB,"COAYLA JUÁREZ, JORGE SAMUEL",SI
FP,"CORDERO JON TAY, LUIS GUSTAVO",NO
FP,"CORDERO JON TAY, MARÍA DEL PILAR",NO
CD-JPP,"CORTEZ AGUIRRE, ISABEL",SI
AP-PIS,"CRUZ MAMANI, FLAVIO",SI
RP,"CUETO ASERVI, JOSÉ ERNESTO",NO
PB,"CUTIPA CCAMA, VÍCTOR RAÚL",SI
AP-PIS,"CÓRDOVA LOBATÓN, MARÍA JESSICA",NO
AP,"DOROTEO CARBAJO, RAÚL FELIPE",SI
BM,"DÁVILA ATANACIO, PASIÓN NEOMIAS",SI
NA,"DÍAZ MONAGO, FREDDY RONALD",SUSPENDIDO
RP,"ECHAÍZ DE NÚÑEZ IZAGA, GLADYS MARGOT",NO
PD,"ECHEVERRÍA RODRÍGUEZ, HAMLET",SI
SP,"ELERA GARCÍA, WILMAR ALBERTO",AUSENTE
PP,"ELÍAS ÁVALOS, JOSÉ LUIS",NO
AP,"ESPINOZA VARGAS, JHAEC DARWIN",SI
AP,"FLORES ANCACHI, JORGE LUIS",SI
PL,"FLORES RAMÍREZ, ALEX RANDU",SI
FP,"FLORES RUÍZ, VÍCTOR SEFERINO",NO
APP,"GARCÍA CORREA, IDELSO MANUEL",LICENCIA_OFICIAL
PL,"GONZA CASTILLO, AMERICO",SI
AP-PIS,"GONZALES DELGADO, DIANA CAROLINA",NO
FP,"GUERRA GARCÍA, CAMPOS HERNANDO",NO
BM,"GUTIÉRREZ TICONA, PAUL SILVIO",SI
RP,"HERRERA MEDINA, NOELIA ROSSVITH",NO
FP,"HUAMÁN CORONADO, RAÚL",NO
FP,"INFANTES CASTAÑEDA, MERY ELIANA",NO
SP,"JERI ORÉ, JOSÉ ENRIQUE",ABSTENCION
FP,"JIMÉNEZ HEREDIA, DAVID JULIO",NO
APP,"JULON IRIGOIN, ELVA EDHIT",NO
NA,"JUÁREZ CALLE, HEIDY LISBETH",SI
FP,"JUÁREZ GALLEGOS, CARMEN PATRICIA",NO
RP,"JÁUREGUI MARTÍNEZ DE AGUAYO, MARÍA DE LOS MILAGROS JACKELINE",NO
PD,"KAMICHE MORANTE, LUIS ROBERTO",SI
PD,"LIMACHI QUISPE, NIEVES ESMERALDA",SI
FP,"LIZARZABURU LIZARZABURU, JUAN CARLOS MARTIN",NO
PP,"LUNA GÁLVEZ, JOSÉ LEÓN",SI
CD-JPP,"LUQUE IBARRA, RUTH",SI
FP,"LÓPEZ MORALES, JENY LUZ",NO
AP,"LÓPEZ UREÑA, ILICH FREDY",AUSENTE
PB,"MARTICORENA MENDOZA, JORGE ALFONSO",SI
AP,"MARTÍNEZ TALAVERA, PEDRO EDWIN",SI
BM,"MEDINA HERMOSILLA, ELIZABETH SARA",SI
SP,"MEDINA MINAYA, ESDRAS RICARDO",SI
PL,"MONTALVO CUBAS, SEGUNDO TORIBIO",SI
AP,"MONTEZA FACHO, SILVIA MARÍA",NO
RP,"MONTOYA MANRIQUE, JORGE CARLOS",NO
FP,"MORANTE FIGARI, JORGE ALBERTO",NO
AP,"MORI CELIS, JUAN CARLOS",LICENCIA_POR_ENFERMEDAD
FP,"MOYANO DELGADO, MARTHA LUPE",NO
RP,"MUÑANTE BARRIOS, ALEJANDRO",NO
NA,"MÁLAGA TRILLO, GEORGE EDWARD",LICENCIA_OFICIAL
FP,"OBANDO MORGAN, AURISTELA ANA",NO
FP,"OLIVOS MARTÍNEZ, VIVIAN",NO
ID,"PABLO MEDINA, FLOR AIDEE",SI
RP,"PADILLA ROMERO, JAVIER ROMMEL",NO
PL,"PALACIOS HUÁMAN, MARGOT",SI
BM,"PAREDES CASTRO, FRANCIS JHASMINA",SI
AP,"PAREDES FONSECA, KAROL IVETT",NO
BM,"PAREDES GONZALES, ALEX ANTONIO",SI
ID,"PAREDES PIQUÉ, SUSEL ANA MARÍA",SI
PL,"PARIONA SINCHE, ALFREDO",SI
NA,"PICÓN QUEDO, LUIS RAÚL",SIN_RESPONDER
PL,"PORTALATINO ÁVALOS, KELLY ROXANA",AUSENTE
AP,"PORTERO LÓPEZ, HILDA MARLENY",ABSTENCION
BM,"QUIROZ BARBOZA, SEGUNDO TEODOMIRO",SI
PL,"QUISPE MAMANI, WILSON RUSBEL",SI
PL,"QUITO SARMIENTO, BERNARDO JAIME",SI
FP,"RAMÍREZ GARCÍA, TANIA ESTEFANY",NO
FP,"REVILLA VILLANUEVA, CÉSAR MANUEL",NO
PL,"REYES CAM, ABEL AUGUSTO",AUSENTE
CD-JPP,"REYMUNDO MERCADO, EDGARD CORNELIO",SI
PL,"RIVAS CHACARA, JANET MILAGROS",SI
PL,"ROBLES ARAUJO, SILVANA EMPERATRIZ",SI
APP,"RUÍZ RODRÍGUEZ, MAGALY ROSMERY",ABSTENCION
SP,"SAAVEDRA CASTERNOQUE, HITLER",SI
APP,"SALHUANA CAVIDES, EDUARDO",NO
AP,"SOTO PALACIOS, WILSON",NO
APP,"SOTO REYES, ALEJANDRO",NO
CD-JPP,"SÁNCHEZ PALOMINO, ROBERTO HELBERT",SI
BM,"TACURI VALDIVIA, GERMÁN ADOLFO",LICENCIA_POR_ENFERMEDAD
PL,"TAIPE CORONADO, MARÍA ELIZABETH",SI
BM,"TELLO MONTES, NIVARDO EDGAR",SI
APP,"TORRES SALINAS, ROSIO",ABSTENCION
APP,"TRIGOZO REÁTEGUI, CHERYL",NO
AP-PIS,"TUDELA GUTIÉRREZ, ADRIANA JOSEFINA",NO
BM,"UGARTE MAMANI, JHAKELINE KATY",SI
PD,"VALER PINTO, HÉCTOR",SI
PB,"VARAS MELÉNDEZ, ELÍAS MARCIAL",SI
FP,"VENTURA ANGEL, HÉCTOR JOSÉ",NO
AP,"VERGARA MENDOZA, ELVIS HERNÁN",ABSTENCION
BM,"VÁSQUEZ VELA, LUCINDA",SI
PP,"WONG PUJADA, ENRIQUE",AUSENTE
AP-PIS,"YARROW LUMBRERAS, NORMA MARTINA",NO
PP,"ZEA CHOQUECHAMBI, OSCAR",SI
RP,"ZEBALLOS APONTE, JORGE ARTURO",NO
ID,"ZEBALLOS MADARIAGA, CARLOS JAVIER",SI
FP,"ZETA CHUNGA, CRUZ MARÍA",NO