numero,grupo_parlamentario,congresista,votacion
1,APP,"ACUÑA PERALTA, MARÍA GRIMANEZA",SINRES
2,APP,"ACUÑA PERALTA, SEGUNDO HÉCTOR",ABST
3,PL,"AGÜERO GUTIÉRREZ, MARÍA ANTONIETA",NO
4,FP,"AGUINAGA RECUENCO, ALEJANDRO AURELIO",ABST
5,SP-PM,"ALCARRAZ AGUERO, YOREL KIRA",LE
6,FP,"ALEGRÍA GARCÍA, ARTURO",ABST
7,AP,"ALVA PRIETO, MARÍA DEL CARMEN",SINRES
8,AP,"ALVA ROJAS, CARLOS ENRIQUE",ABST
9,AP-PIS,"AMURUZ DULANTO, YESSICA ROSSELLI",SI
10,PP,"ANDERSON RAMÍREZ, CARLOS ANTONIO",SI
11,AP,"ARAGÓN CARREÑO, LUIS ÁNGEL",NO
12,AP,"ARRIOLA TUEROS, JOSÉ ALBERTO",ABST
13,SP-PM,"AZURÍN LOAYZA, ALFREDO",SI
14,PL,"BALCÁZAR ZELADA, JOSÉ MARÍA",NO
15,FP,"BARBARÁN REYES, ROSANGELLA ANDREA",ABST
16,AP-PIS,"BAZÁN CALDERÓN, DIEGO ALONSO FERNANDO",SI
17,JP,"BAZÁN NARRO, SIGRID TESORO",NO
18,PL,"BELLIDO UGARTE, GUIDO",NO
19,PL,"BERMEJO ROJAS, GUILLERMO",NO
20,AP-PIS,"BURGOS OLIVEROS, JUAN BARTOLOMÉ",SI
21,FP,"BUSTAMANTE DONAYRE, ERNESTO",ABST
22,PP,"CALLE LOBATÓN, DIGNA",NO
23,APP,"CAMONES SORIANO, LADY MERCEDES",LO
24,FP,"CASTILLO RIVAS, EDUARDO ENRIQUE",ABST
25,AP-PIS,"CAVERO ALVA, ALEJANDRO ENRIQUE",SI
26,PL,"CERRÓN ROJAS, WALDEMAR JOSÉ",NO
27,FP,"CHACÓN TRUJILLO, NILZA MERLY",ABST
28,PL,"CHÁVEZ CHINO, BETSSY BETZABET",LO
29,APP,"CHIABRA LEÓN, ROBERTO ENRIQUE",SI
30,AP-PIS,"CHIRINOS VENEGAS, PATRICIA ROSA",AUS
31,RP,"CICCIA VÁSQUEZ, MIGUEL ANGEL",ABST
32,PL,"COAYLA JUÁREZ, JORGE SAMUEL",NO
33,FP,"CORDERO JON TAY, LUIS GUSTAVO",ABST
34,FP,"CORDERO JON TAY, MARÍA DEL PILAR",ABST
35,AP-PIS,"CÓRDOVA LOBATÓN, MARÍA JESSICA",SI
36,JP,"CORTEZ AGUIRRE, ISABEL",NO
37,PL,"CRUZ MAMANI, FLAVIO",ABST
38,RP,"CUETO ASERVI, JOSÉ ERNESTO",SI
39,PL,"CUTIPA CCAMA, VÍCTOR RAÚL",NO
40,PL,"DÁVILA ATANACIO, PASIÓN NEOMIAS",NO
41,APP,"DÍAZ MONAGO, FREDDY RONALD",NO
42,AP,"DOROTEO CARBAJO, RAÚL FELIPE",SI
43,APP,"ECHAÍZ DE NÚÑEZ IZAGA, GLADYS MARGOT",SI
44,PL,"ECHEVERRÍA RODRÍGUEZ, HAMLET",NO
45,SP-PM,"ELERA GARCÍA, WILMAR ALBERTO",SI
46,PP,"ELÍAS ÁVALOS, JOSÉ LUIS",SI
47,AP,"ESPINOZA VARGAS, JHAEC DARWIN",ABST
48,AP,"FLORES ANCACHI, JORGE LUIS",ABST
49,PL,"FLORES RAMÍREZ, ALEX RANDU",LE
50,FP,"FLORES RUÍZ, VÍCTOR SEFERINO",ABST
51,APP,"GARCÍA CORREA, IDELSO MANUEL",NO
52,PL,"GONZA CASTILLO, AMERICO",NO
53,AP-PIS,"GONZALES DELGADO, DIANA CAROLINA",SI
54,FP,"GUERRA GARCÍA, CAMPOS HERNANDO",ABST
55,PL,"GUTIÉRREZ TICONA, PAUL SILVIO",NO
56,RP,"HERRERA MEDINA, NOELIA ROSSVITH",SI
57,FP,"HUAMÁN CORONADO, RAÚL",LO
58,FP,"INFANTES CASTAÑEDA, MERY ELIANA",AUS
59,RP,"JÁUREGUI MARTÍNEZ DE AGUAYO, MARÍA DE LOS MILAGROS JACKELINE",SI
60,SP-PM,"JERI ORÉ, JOSÉ ENRIQUE",NO
61,FP,"JIMÉNEZ HEREDIA, DAVID JULIO",ABST
62,APP,"JUÁREZ CALLE, HEIDY LISBETH",LO
63,FP,"JUÁREZ GALLEGOS, CARMEN PATRICIA",ABST
64,APP,"JULON IRIGOIN, ELVA EDHIT",LE
65,PL,"KAMICHE MORANTE, LUIS ROBERTO",NO
66,PL,"LIMACHI QUISPE, NIEVES ESMERALDA",NO
67,FP,"LIZARZABURU LIZARZABURU, JUAN CARLOS MARTIN",ABST
68,FP,"LÓPEZ MORALES, JENY LUZ",ABST
69,AP,"LÓPEZ UREÑA, ILICH FREDY",ABST
70,PP,"LUNA GÁLVEZ, JOSÉ LEÓN",NO
71,JP,"LUQUE IBARRA, RUTH",NO
72,SP-PM,"MÁLAGA TRILLO, GEORGE EDWARD",SI
73,PL,"MARTICORENA MENDOZA, JORGE ALFONSO",NO
74,AP,"MARTÍNEZ TALAVERA, PEDRO EDWIN",NO
75,PL,"MEDINA HERMOSILLA, ELIZABETH SARA",NO
76,RP,"MEDINA MINAYA, ESDRAS RICARDO",SI
77,PL,"MONTALVO CUBAS, SEGUNDO TORIBIO",NO
78,AP,"MONTEZA FACHO, SILVIA MARÍA",ABST
79,RP,"MONTOYA MANRIQUE, JORGE CARLOS",SI
80,FP,"MORANTE FIGARI, JORGE ALBERTO",ABST
81,AP,"MORI CELIS, JUAN CARLOS",ABST
82,FP,"MOYANO DELGADO, MARTHA LUPE",ABST
83,RP,"MUÑANTE BARRIOS, ALEJANDRO",SI
84,FP,"OBANDO MORGAN, AURISTELA ANA",ABST
85,FP,"OLIVOS MARTÍNEZ, VIVIAN",SI
86,SP-PM,"PABLO MEDINA, FLOR AIDEE",SI
87,RP,"PADILLA ROMERO, JAVIER ROMMEL",ABST
88,PL,"PALACIOS HUÁMAN, MARGOT",ABST
89,PL,"PAREDES CASTRO, FRANCIS JHASMINA",NO
90,AP,"PAREDES FONSECA, KAROL IVETT",ABST
91,PL,"PAREDES GONZALES, ALEX ANTONIO",NO
92,SP-PM,"PAREDES PIQUÉ, SUSEL ANA MARÍA",SI
93,PL,"PARIONA SINCHE, ALFREDO",NO
94,APP,"PICÓN QUEDO, LUIS RAÚL",AUS
95,PL,"PORTALATINO ÁVALOS, KELLY ROXANA",NO
96,AP,"PORTERO LÓPEZ, HILDA MARLENY",ABST
97,PL,"QUIROZ BARBOZA, SEGUNDO TEODOMIRO",NO
98,PL,"QUISPE MAMANI, WILSON RUSBEL",NO
99,PL,"QUITO SARMIENTO, BERNARDO JAIME",NO
100,FP,"RAMÍREZ GARCÍA, TANIA ESTEFANY",AUS
101,FP,"REVILLA VILLANUEVA, CÉSAR MANUEL",ABST
102,PL,"REYES CAM, ABEL AUGUSTO",NO
103,JP,"REYMUNDO MERCADO, EDGARD CORNELIO",NO
104,PL,"RIVAS CHACARA, JANET MILAGROS",ABST
105,PL,"ROBLES ARAUJO, SILVANA EMPERATRIZ",NO
106,APP,"RUÍZ RODRÍGUEZ, MAGALY ROSMERY",NO
107,SP-PM,"SAAVEDRA CASTERNOQUE, HITLER",SI
108,APP,"SALHUANA CAVIDES, EDUARDO",ABST
109,JP,"SÁNCHEZ PALOMINO, ROBERTO HELBERT",LO
110,AP,"SOTO PALACIOS, WILSON",SINRES
111,APP,"SOTO REYES, ALEJANDRO",ABST
112,PL,"TACURI VALDIVIA, GERMÁN ADOLFO",NO
113,PL,"TAIPE CORONADO, MARÍA ELIZABETH",NO
114,PL,"TELLO MONTES, NIVARDO EDGAR",NO
115,APP,"TORRES SALINAS, ROSIO",NO
116,APP,"TRIGOZO REÁTEGUI, CHERYL",NO
117,AP-PIS,"TUDELA GUTIÉRREZ, ADRIANA JOSEFINA",SI
118,PL,"UGARTE MAMANI, JHAKELINE KATY",NO
119,SP-PM,"VALER PINTO, HÉCTOR",NO
120,PL,"VARAS MELÉNDEZ, ELÍAS MARCIAL",NO
121,PL,"VÁSQUEZ VELA, LUCINDA",NO
122,FP,"VENTURA ANGEL, HÉCTOR JOSÉ",ABST
123,AP,"VERGARA MENDOZA, ELVIS HERNÁN",ABST
124,AP-PIS,"WILLIAMS ZAPATA, JOSÉ DANIEL",SI
125,PP,"WONG PUJADA, ENRIQUE",NO
126,AP-PIS,"YARROW LUMBRERAS, NORMA MARTINA",SI
127,PL,"ZEA CHOQUECHAMBI, OSCAR",NO
128,RP,"ZEBALLOS APONTE, JORGE ARTURO",LE
129,NA,"ZEBALLOS MADARIAGA, CARLOS JAVIER",ABST
130,FP,"ZETA CHUNGA, CRUZ MARÍA",ABST
