numero,grupo_parlamentario,congresista,votacion
1,APP,"ACUÑA PERALTA, MARÍA GRIMANEZA",NO
2,APP,"ACUÑA PERALTA, SEGUNDO HÉCTOR",NO
3,PL,"AGÜERO GUTIÉRREZ, MARÍA ANTONIETA",LE
4,FP,"AGUINAGA RECUENCO, ALEJANDRO AURELIO",NO
5,SP,"ALCARRAZ AGUERO, YOREL KIRA",NO
6,FP,"ALEGRÍA GARCÍA, ARTURO",NO
7,AP,"ALVA PRIETO, MARÍA DEL CARMEN",SINRES
8,AP,"ALVA ROJAS, CARLOS ENRIQUE",AUS
9,AP-PIS,"AMURUZ DULANTO, YESSICA ROSSELLI",NO
10,PP,"ANDERSON RAMÍREZ, CARLOS ANTONIO",NO
11,AP,"ARAGÓN CARREÑO, LUIS ÁNGEL",NO
12,AP,"ARRIOLA TUEROS, JOSÉ ALBERTO",NO
13,SP,"AZURÍN LOAYZA, ALFREDO",NO
14,PL,"BALCÁZAR ZELADA, JOSÉ MARÍA",NO
15,FP,"BARBARÁN REYES, ROSANGELLA ANDREA",NO
16,AP-PIS,"BAZÁN CALDERÓN, DIEGO ALONSO FERNANDO",NO
17,JP,"BAZÁN NARRO, SIGRID TESORO",NO
18,PL,"BELLIDO UGARTE, GUIDO",NO
19,PD,"BERMEJO ROJAS, GUILLERMO",SI
20,AP-PIS,"BURGOS OLIVEROS, JUAN BARTOLOMÉ",NO
21,FP,"BUSTAMANTE DONAYRE, ERNESTO",NO
22,PP,"CALLE LOBATÓN, DIGNA",NO
23,APP,"CAMONES SORIANO, LADY MERCEDES",AUS
24,FP,"CASTILLO RIVAS, EDUARDO ENRIQUE",NO
25,AP-PIS,"CAVERO ALVA, ALEJANDRO ENRIQUE",NO
26,PL,"CERRÓN ROJAS, WALDEMAR JOSÉ",NO
27,FP,"CHACÓN TRUJILLO, NILZA MERLY",AUS
28,PD,"CHÁVEZ CHINO, BETSSY BETZABET",LO
29,APP,"CHIABRA LEÓN, ROBERTO ENRIQUE",NO
30,AP-PIS,"CHIRINOS VENEGAS, PATRICIA ROSA",AUS
31,RP,"CICCIA VÁSQUEZ, MIGUEL ANGEL",NO
32,PL,"COAYLA JUÁREZ, JORGE SAMUEL",NO
33,FP,"CORDERO JON TAY, LUIS GUSTAVO",NO
34,FP,"CORDERO JON TAY, MARÍA DEL PILAR",NO
35,AP-PIS,"CÓRDOVA LOBATÓN, MARÍA JESSICA",NO
36,JP,"CORTEZ AGUIRRE, ISABEL",NO
37,PL,"CRUZ MAMANI, FLAVIO",NO
38,RP,"CUETO ASERVI, JOSÉ ERNESTO",NO
39,PL,"CUTIPA CCAMA, VÍCTOR RAÚL",ABST
40,PL,"DÁVILA ATANACIO, PASIÓN NEOMIAS",NO
41,APP,"DÍAZ MONAGO, FREDDY RONALD",NO
42,AP,"DOROTEO CARBAJO, RAÚL FELIPE",NO
43,APP,"ECHAÍZ DE NÚÑEZ IZAGA, GLADYS MARGOT",AUS
44,PD,"ECHEVERRÍA RODRÍGUEZ, HAMLET",SI
45,SP,"ELERA GARCÍA, WILMAR ALBERTO",NO
46,PP,"ELÍAS ÁVALOS, JOSÉ LUIS",AUS
47,AP,"ESPINOZA VARGAS, JHAEC DARWIN",NO
48,AP,"FLORES ANCACHI, JORGE LUIS",NO
49,PL,"FLORES RAMÍREZ, ALEX RANDU",SI
50,FP,"FLORES RUÍZ, VÍCTOR SEFERINO",NO
51,APP,"GARCÍA CORREA, IDELSO MANUEL",NO
52,PL,"GONZA CASTILLO, AMERICO",NO
53,AP-PIS,"GONZALES DELGADO, DIANA CAROLINA",NO
54,FP,"GUERRA GARCÍA, CAMPOS HERNANDO",NO
55,PL,"GUTIÉRREZ TICONA, PAUL SILVIO",SI
56,RP,"HERRERA MEDINA, NOELIA ROSSVITH",NO
57,FP,"HUAMÁN CORONADO, RAÚL",NO
58,FP,"INFANTES CASTAÑEDA, MERY ELIANA",NO
59,RP,"JÁUREGUI MARTÍNEZ DE AGUAYO, MARÍA DE LOS MILAGROS JACKELINE",NO
60,SP,"JERI ORÉ, JOSÉ ENRIQUE",AUS
61,FP,"JIMÉNEZ HEREDIA, DAVID JULIO",NO
62,APP,"JUÁREZ CALLE, HEIDY LISBETH",NO
63,FP,"JUÁREZ GALLEGOS, CARMEN PATRICIA",NO
64,APP,"JULON IRIGOIN, ELVA EDHIT",NO
65,PD,"KAMICHE MORANTE, LUIS ROBERTO",LE
66,PD,"LIMACHI QUISPE, NIEVES ESMERALDA",SI
67,FP,"LIZARZABURU LIZARZABURU, JUAN CARLOS MARTIN",NO
68,FP,"LÓPEZ MORALES, JENY LUZ",NO
69,AP,"LÓPEZ UREÑA, ILICH FREDY",NO
70,PP,"LUNA GÁLVEZ, JOSÉ LEÓN",NO
71,JP,"LUQUE IBARRA, RUTH",NO
72,NA,"MÁLAGA TRILLO, GEORGE EDWARD",NO
73,PL,"MARTICORENA MENDOZA, JORGE ALFONSO",SI
74,AP,"MARTÍNEZ TALAVERA, PEDRO EDWIN",NO
75,PL,"MEDINA HERMOSILLA, ELIZABETH SARA",NO
76,RP,"MEDINA MINAYA, ESDRAS RICARDO",NO
77,PL,"MONTALVO CUBAS, SEGUNDO TORIBIO",NO
78,AP,"MONTEZA FACHO, SILVIA MARÍA",NO
79,RP,"MONTOYA MANRIQUE, JORGE CARLOS",NO
80,FP,"MORANTE FIGARI, JORGE ALBERTO",LE
81,AP,"MORI CELIS, JUAN CARLOS",NO
82,FP,"MOYANO DELGADO, MARTHA LUPE",NO
83,RP,"MUÑANTE BARRIOS, ALEJANDRO",NO
84,FP,"OBANDO MORGAN, AURISTELA ANA",NO
85,FP,"OLIVOS MARTÍNEZ, VIVIAN",NO
86,NA,"PABLO MEDINA, FLOR AIDEE",NO
87,RP,"PADILLA ROMERO, JAVIER ROMMEL",NO
88,PL,"PALACIOS HUÁMAN, MARGOT",SINRES
89,PL,"PAREDES CASTRO, FRANCIS JHASMINA",NO
90,AP,"PAREDES FONSECA, KAROL IVETT",NO
91,PL,"PAREDES GONZALES, ALEX ANTONIO",NO
92,NA,"PAREDES PIQUÉ, SUSEL ANA MARÍA",NO
93,PL,"PARIONA SINCHE, ALFREDO",NO
94,APP,"PICÓN QUEDO, LUIS RAÚL",AUS
95,PL,"PORTALATINO ÁVALOS, KELLY ROXANA",NO
96,AP,"PORTERO LÓPEZ, HILDA MARLENY",AUS
97,PL,"QUIROZ BARBOZA, SEGUNDO TEODOMIRO",NO
98,PL,"QUISPE MAMANI, WILSON RUSBEL",NO
99,PL,"QUITO SARMIENTO, BERNARDO JAIME",NO
100,FP,"RAMÍREZ GARCÍA, TANIA ESTEFANY",NO
101,FP,"REVILLA VILLANUEVA, CÉSAR MANUEL",NO
102,PL,"REYES CAM, ABEL AUGUSTO",SI
103,JP,"REYMUNDO MERCADO, EDGARD CORNELIO",NO
104,PL,"RIVAS CHACARA, JANET MILAGROS",ABST
105,PL,"ROBLES ARAUJO, SILVANA EMPERATRIZ",AUS
106,APP,"RUÍZ RODRÍGUEZ, MAGALY ROSMERY",NO
107,SP,"SAAVEDRA CASTERNOQUE, HITLER",NO
108,APP,"SALHUANA CAVIDES, EDUARDO",NO
109,JP,"SÁNCHEZ PALOMINO, ROBERTO HELBERT",NO
110,AP,"SOTO PALACIOS, WILSON",NO
111,APP,"SOTO REYES, ALEJANDRO",NO
112,PL,"TACURI VALDIVIA, GERMÁN ADOLFO",SI
113,PL,"TAIPE CORONADO, MARÍA ELIZABETH",SI
114,PL,"TELLO MONTES, NIVARDO EDGAR",SI
115,APP,"TORRES SALINAS, ROSIO",NO
116,APP,"TRIGOZO REÁTEGUI, CHERYL",NO
117,AP-PIS,"TUDELA GUTIÉRREZ, ADRIANA JOSEFINA",LO
118,PL,"UGARTE MAMANI, JHAKELINE KATY",LO
119,PD,"VALER PINTO, HÉCTOR",LO
120,PL,"VARAS MELÉNDEZ, ELÍAS MARCIAL",SI
121,PL,"VÁSQUEZ VELA, LUCINDA",AUS
122,FP,"VENTURA ANGEL, HÉCTOR JOSÉ",NO
123,AP,"VERGARA MENDOZA, ELVIS HERNÁN",SINRES
124,AP-PIS,"WILLIAMS ZAPATA, JOSÉ DANIEL",NO
125,PP,"WONG PUJADA, ENRIQUE",AUS
126,AP-PIS,"YARROW LUMBRERAS, NORMA MARTINA",NO
127,PL,"ZEA CHOQUECHAMBI, OSCAR",NO
128,RP,"ZEBALLOS APONTE, JORGE ARTURO",NO
129,PD,"ZEBALLOS MADARIAGA, CARLOS JAVIER",SI
130,FP,"ZETA CHUNGA, CRUZ MARÍA",NO
