grupo_parlamentario,congresista,votacion
APP,"ACUÑA PERALTA, MARÍA GRIMANEZA",SI
ID,"ACUÑA PERALTA, SEGUNDO HÉCTOR",SI
FP,"AGUINAGA RECUENCO, ALEJANDRO AURELIO",NO
PL,"AGÜERO GUTIÉRREZ, MARÍA ANTONIETA",SI
ID,"ALCARRAZ AGUERO, YOREL KIRA",SI
FP,"ALEGRÍA GARCÍA, ARTURO",NO
AP,"ALVA PRIETO, MARÍA DEL CARMEN",NO
ID,"ALVA ROJAS, CARLOS ENRIQUE",SI
AP-PIS,"AMURUZ DULANTO, YESSICA ROSSELLI",NO
NA,"ANDERSON RAMÍREZ, CARLOS ANTONIO",SI
AP,"ARAGÓN CARREÑO, LUIS ÁNGEL",SI
AP,"ARRIOLA TUEROS, JOSÉ ALBERTO",SI
SP,"AZURÍN LOAYZA, ALFREDO",NO
PB,"BALCÁZAR ZELADA, JOSÉ MARÍA",SI
FP,"BARBARÁN REYES, ROSANGELLA ANDREA",NO
AP-PIS,"BAZÁN CALDERÓN, DIEGO ALONSO FERNANDO",NO
CD-JPP,"BAZÁN NARRO, SIGRID TESORO",ABSTENCION
PL,"BELLIDO UGARTE, GUIDO",SI
PD,"BERMEJO ROJAS, GUILLERMO",SI
PP,"BURGOS OLIVEROS, JUAN BARTOLOMÉ",SI
FP,"BUSTAMANTE DONAYRE, ERNESTO",NO
PP,"CALLE LOBATÓN, DIGNA",NO
APP,"CAMONES SORIANO, LADY MERCEDES",SI
FP,"CASTILLO RIVAS, EDUARDO ENRIQUE",NO
AP-PIS,"CAVERO ALVA, ALEJANDRO ENRIQUE",AUSENTE
PL,"CERRÓN ROJAS, WALDEMAR JOSÉ",SI
FP,"CHACÓN TRUJILLO, NILZA MERLY",NO
APP,"CHIABRA LEÓN, ROBERTO ENRIQUE",SI
AP-PIS,"CHIRINOS VENEGAS, PATRICIA ROSA",LICENCIA_OFICIAL
PD,"CHÁVEZ CHINO, BETSSY BETZABET",LICENCIA_OFICIAL
RP,"CICCIA VÁSQUEZ, MIGUEL ANGEL",NO
PB,"COAYLA JUÁREZ, JORGE SAMUEL",NO
FP,"CORDERO JON TAY, LUIS GUSTAVO",NO
FP,"CORDERO JON TAY, MARÍA DEL PILAR",NO
CD-JPP,"CORTEZ AGUIRRE, ISABEL",NO
PL,"CRUZ MAMANI, FLAVIO",SI
RP,"CUETO ASERVI, JOSÉ ERNESTO",NO
PB,"CUTIPA CCAMA, VÍCTOR RAÚL",SI
AP-PIS,"CÓRDOVA LOBATÓN, MARÍA JESSICA",NO
AP,"DOROTEO CARBAJO, RAÚL FELIPE",SI
BM,"DÁVILA ATANACIO, PASIÓN NEOMIAS",ABSTENCION
NA,"DÍAZ MONAGO, FREDDY RONALD",SUSPENDIDO
RP,"ECHAÍZ DE NÚÑEZ IZAGA, GLADYS MARGOT",SI
PD,"ECHEVERRÍA RODRÍGUEZ, HAMLET",ABSTENCION
SP,"ELERA GARCÍA, WILMAR ALBERTO",AUSENTE
PP,"ELÍAS ÁVALOS, JOSÉ LUIS",NO
AP,"ESPINOZA VARGAS, JHAEC DARWIN",AUSENTE
AP,"FLORES ANCACHI, JORGE LUIS",SI
PL,"FLORES RAMÍREZ, ALEX RANDU",LICENCIA_OFICIAL
FP,"FLORES RUÍZ, VÍCTOR SEFERINO",NO
APP,"GARCÍA CORREA, IDELSO MANUEL",SI
PL,"GONZA CASTILLO, AMERICO",SI
AP-PIS,"GONZALES DELGADO, DIANA CAROLINA",NO
FP,"GUERRA GARCÍA, CAMPOS HERNANDO",NO
BM,"GUTIÉRREZ TICONA, PAUL SILVIO",SI
RP,"HERRERA MEDINA, NOELIA ROSSVITH",NO
FP,"HUAMÁN CORONADO, RAÚL",LICENCIA_OFICIAL
FP,"INFANTES CASTAÑEDA, MERY ELIANA",NO
SP,"JERI ORÉ, JOSÉ ENRIQUE",NO
FP,"JIMÉNEZ HEREDIA, DAVID JULIO",NO
APP,"JULON IRIGOIN, ELVA EDHIT",SI
NA,"JUÁREZ CALLE, HEIDY LISBETH",SI
FP,"JUÁREZ GALLEGOS, CARMEN PATRICIA",SIN_RESPONDER
RP,"JÁUREGUI MARTÍNEZ DE AGUAYO, MARÍA DE LOS MILAGROS JACKELINE",NO
PD,"KAMICHE MORANTE, LUIS ROBERTO",SI
PD,"LIMACHI QUISPE, NIEVES ESMERALDA",SI
FP,"LIZARZABURU LIZARZABURU, JUAN CARLOS MARTIN",NO
PP,"LUNA GÁLVEZ, JOSÉ LEÓN",SI
CD-JPP,"LUQUE IBARRA, RUTH",NO
FP,"LÓPEZ MORALES, JENY LUZ",NO
AP,"LÓPEZ UREÑA, ILICH FREDY",SI
PB,"MARTICORENA MENDOZA, JORGE ALFONSO",SI
AP,"MARTÍNEZ TALAVERA, PEDRO EDWIN",SI
BM,"MEDINA HERMOSILLA, ELIZABETH SARA",LICENCIA_OFICIAL
SP,"MEDINA MINAYA, ESDRAS RICARDO",SI
PL,"MONTALVO CUBAS, SEGUNDO TORIBIO",SI
AP,"MONTEZA FACHO, SILVIA MARÍA",SI
RP,"MONTOYA MANRIQUE, JORGE CARLOS",SIN_RESPONDER
FP,"MORANTE FIGARI, JORGE ALBERTO",NO
AP,"MORI CELIS, JUAN CARLOS",SI
FP,"MOYANO DELGADO, MARTHA LUPE",NO
RP,"MUÑANTE BARRIOS, ALEJANDRO",AUSENTE
NA,"MÁLAGA TRILLO, GEORGE EDWARD",AUSENTE
FP,"OBANDO MORGAN, AURISTELA ANA",NO
FP,"OLIVOS MARTÍNEZ, VIVIAN",NO
ID,"PABLO MEDINA, FLOR AIDEE",SIN_RESPONDER
RP,"PADILLA ROMERO, JAVIER ROMMEL",NO
PL,"PALACIOS HUÁMAN, MARGOT",SI
BM,"PAREDES CASTRO, FRANCIS JHASMINA",ABSTENCION
AP,"PAREDES FONSECA, KAROL IVETT",LICENCIA_POR_ENFERMEDAD
BM,"PAREDES GONZALES, ALEX ANTONIO",AUSENTE
ID,"PAREDES PIQUÉ, SUSEL ANA MARÍA",AUSENTE
PL,"PARIONA SINCHE, ALFREDO",SI
NA,"PICÓN QUEDO, LUIS RAÚL",SI
PL,"PORTALATINO ÁVALOS, KELLY ROXANA",LICENCIA_OFICIAL
AP,"PORTERO LÓPEZ, HILDA MARLENY",SI
BM,"QUIROZ BARBOZA, SEGUNDO TEODOMIRO",ABSTENCION
PL,"QUISPE MAMANI, WILSON RUSBEL",SI
PL,"QUITO SARMIENTO, BERNARDO JAIME",SI
FP,"RAMÍREZ GARCÍA, TANIA ESTEFANY",NO
FP,"REVILLA VILLANUEVA, CÉSAR MANUEL",NO
PL,"REYES CAM, ABEL AUGUSTO",SI
CD-JPP,"REYMUNDO MERCADO, EDGARD CORNELIO",LICENCIA_POR_ENFERMEDAD
PL,"RIVAS CHACARA, JANET MILAGROS",SI
PL,"ROBLES ARAUJO, SILVANA EMPERATRIZ",LICENCIA_OFICIAL
APP,"RUÍZ RODRÍGUEZ, MAGALY ROSMERY",SI
SP,"SAAVEDRA CASTERNOQUE, HITLER",NO
APP,"SALHUANA CAVIDES, EDUARDO",NO
AP,"SOTO PALACIOS, WILSON",LICENCIA_OFICIAL
APP,"SOTO REYES, ALEJANDRO",SI
CD-JPP,"SÁNCHEZ PALOMINO, ROBERTO HELBERT",NO
BM,"TACURI VALDIVIA, GERMÁN ADOLFO",ABSTENCION
PL,"TAIPE CORONADO, MARÍA ELIZABETH",SI
BM,"TELLO MONTES, NIVARDO EDGAR",SI
APP,"TORRES SALINAS, ROSIO",SI
APP,"TRIGOZO REÁTEGUI, CHERYL",SI
AP-PIS,"TUDELA GUTIÉRREZ, ADRIANA JOSEFINA",SI
BM,"UGARTE MAMANI, JHAKELINE KATY",ABSTENCION
PD,"VALER PINTO, HÉCTOR",SIN_RESPONDER
PB,"VARAS MELÉNDEZ, ELÍAS MARCIAL",SI
FP,"VENTURA ANGEL, HÉCTOR JOSÉ",NO
AP,"VERGARA MENDOZA, ELVIS HERNÁN",ABSTENCION
BM,"VÁSQUEZ VELA, LUCINDA",LICENCIA_POR_ENFERMEDAD
AP-PIS,"WILLIAMS ZAPATA, JOSÉ DANIEL",SIN_RESPONDER
PP,"WONG PUJADA, ENRIQUE",ABSTENCION
AP-PIS,"YARROW LUMBRERAS, NORMA MARTINA",NO
PP,"ZEA CHOQUECHAMBI, OSCAR",NO
RP,"ZEBALLOS APONTE, JORGE ARTURO",NO
ID,"ZEBALLOS MADARIAGA, CARLOS JAVIER",SI
FP,"ZETA CHUNGA, CRUZ MARÍA",NO
