grupo_parlamentario,congresista,votacion
APP,"ACUÑA PERALTA, MARÍA GRIMANEZA",SI
NA,"ACUÑA PERALTA, SEGUNDO HÉCTOR",AUSENTE
FP,"AGUINAGA RECUENCO, ALEJANDRO AURELIO",NO
PL,"AGÜERO GUTIÉRREZ, MARÍA ANTONIETA",NO
PP,"ALCARRAZ AGUERO, YOREL KIRA",NO
FP,"ALEGRÍA GARCÍA, ARTURO",AUSENTE
AP,"ALVA PRIETO, MARÍA DEL CARMEN",NO
NA,"ALVA ROJAS, CARLOS ENRIQUE",NO
AP-PIS,"AMURUZ DULANTO, YESSICA ROSSELLI",NO
NA,"ANDERSON RAMÍREZ, CARLOS ANTONIO",AUSENTE
AP,"ARAGÓN CARREÑO, LUIS ÁNGEL",NO
AP,"ARRIOLA TUEROS, JOSÉ ALBERTO",SI
SP,"AZURÍN LOAYZA, ALFREDO",NO
PB,"BALCÁZAR ZELADA, JOSÉ MARÍA",SI
FP,"BARBARÁN REYES, ROSANGELLA ANDREA",SI
AP-PIS,"BAZÁN CALDERÓN, DIEGO ALONSO FERNANDO",NO
CD-JPP,"BAZÁN NARRO, SIGRID TESORO",SI
PB,"BELLIDO UGARTE, GUIDO",ABSTENCION
CD-JPP,"BERMEJO ROJAS, GUILLERMO",SI
NA,"BURGOS OLIVEROS, JUAN BARTOLOMÉ",NO
FP,"BUSTAMANTE DONAYRE, ERNESTO",NO
PP,"CALLE LOBATÓN, DIGNA",SI
APP,"CAMONES SORIANO, LADY MERCEDES",LICENCIA_POR_ENFERMEDAD
FP,"CASTILLO RIVAS, EDUARDO ENRIQUE",LICENCIA_POR_ENFERMEDAD
AP-PIS,"CAVERO ALVA, ALEJANDRO ENRIQUE",NO
PL,"CERRÓN ROJAS, WALDEMAR JOSÉ",NO
FP,"CHACÓN TRUJILLO, NILZA MERLY",NO
APP,"CHIABRA LEÓN, ROBERTO ENRIQUE",NO
AP-PIS,"CHIRINOS VENEGAS, PATRICIA ROSA",NO
NA,"CHÁVEZ CHINO, BETSSY BETZABET",SUSPENDIDO
RP,"CICCIA VÁSQUEZ, MIGUEL ANGEL",NO
PB,"COAYLA JUÁREZ, JORGE SAMUEL",SI
FP,"CORDERO JON TAY, LUIS GUSTAVO",AUSENTE
FP,"CORDERO JON TAY, MARÍA DEL PILAR",SI
CD-JPP,"CORTEZ AGUIRRE, ISABEL",SI
PL,"CRUZ MAMANI, FLAVIO",NO
RP,"CUETO ASERVI, JOSÉ ERNESTO",NO
PB,"CUTIPA CCAMA, VÍCTOR RAÚL",SI
AP-PIS,"CÓRDOVA LOBATÓN, MARÍA JESSICA",NO
AP,"DOROTEO CARBAJO, RAÚL FELIPE",LICENCIA_POR_ENFERMEDAD
BM,"DÁVILA ATANACIO, PASIÓN NEOMIAS",SUSPENDIDO
RP,"ECHAÍZ DE NÚÑEZ IZAGA, GLADYS MARGOT",AUSENTE
CD-JPP,"ECHEVERRÍA RODRÍGUEZ, HAMLET",SI
PP,"ELÍAS ÁVALOS, JOSÉ LUIS",SI
AP,"ESPINOZA VARGAS, JHAEC DARWIN",NO
AP,"FLORES ANCACHI, JORGE LUIS",AUSENTE
PL,"FLORES RAMÍREZ, ALEX RANDU",SI
FP,"FLORES RUÍZ, VÍCTOR SEFERINO",AUSENTE
APP,"GARCÍA CORREA, IDELSO MANUEL",SI
PL,"GONZA CASTILLO, AMERICO",NO
AP-PIS,"GONZALES DELGADO, DIANA CAROLINA",NO
FP,"GUERRA GARCÍA, CAMPOS HERNANDO",SI
BM,"GUTIÉRREZ TICONA, PAUL SILVIO",SI
APP,"HEIDINGER BALLESTEROS, NELCY",AUSENTE
RP,"HERRERA MEDINA, NOELIA ROSSVITH",NO
FP,"HUAMÁN CORONADO, RAÚL",NO
FP,"INFANTES CASTAÑEDA, MERY ELIANA",LICENCIA_POR_ENFERMEDAD
SP,"JERI ORÉ, JOSÉ ENRIQUE",NO
FP,"JIMÉNEZ HEREDIA, DAVID JULIO",NO
APP,"JULON IRIGOIN, ELVA EDHIT",NO
PP,"JUÁREZ CALLE, HEIDY LISBETH",LICENCIA_OFICIAL
FP,"JUÁREZ GALLEGOS, CARMEN PATRICIA",NO
RP,"JÁUREGUI MARTÍNEZ DE AGUAYO, MARÍA DE LOS MILAGROS JACKELINE",NO
CD-JPP,"KAMICHE MORANTE, LUIS ROBERTO",SI
CD-JPP,"LIMACHI QUISPE, NIEVES ESMERALDA",SI
FP,"LIZARZABURU LIZARZABURU, JUAN CARLOS MARTIN",NO
PP,"LUNA GÁLVEZ, JOSÉ LEÓN",AUSENTE
CD-JPP,"LUQUE IBARRA, RUTH",SI
FP,"LÓPEZ MORALES, JENY LUZ",NO
AP,"LÓPEZ UREÑA, ILICH FREDY",SI
PB,"MARTICORENA MENDOZA, JORGE ALFONSO",SI
AP,"MARTÍNEZ TALAVERA, PEDRO EDWIN",NO
BM,"MEDINA HERMOSILLA, ELIZABETH SARA",NO
SP,"MEDINA MINAYA, ESDRAS RICARDO",LICENCIA_PERSONAL
PL,"MONTALVO CUBAS, SEGUNDO TORIBIO",NO
AP,"MONTEZA FACHO, SILVIA MARÍA",NO
RP,"MONTOYA MANRIQUE, JORGE CARLOS",AUSENTE
FP,"MORANTE FIGARI, JORGE ALBERTO",SI
AP,"MORI CELIS, JUAN CARLOS",SI
FP,"MOYANO DELGADO, MARTHA LUPE",NO
RP,"MUÑANTE BARRIOS, ALEJANDRO",NO
NA,"MÁLAGA TRILLO, GEORGE EDWARD",SI
FP,"OBANDO MORGAN, AURISTELA ANA",SI
FP,"OLIVOS MARTÍNEZ, VIVIAN",NO
NA,"PABLO MEDINA, FLOR AIDEE",SI
RP,"PADILLA ROMERO, JAVIER ROMMEL",NO
PL,"PALACIOS HUÁMAN, MARGOT",NO
BM,"PAREDES CASTRO, FRANCIS JHASMINA",SI
AP,"PAREDES FONSECA, KAROL IVETT",AUSENTE
BM,"PAREDES GONZALES, ALEX ANTONIO",NO
NA,"PAREDES PIQUÉ, SUSEL ANA MARÍA",SI
PL,"PARIONA SINCHE, ALFREDO",NO
SP,"PAZO NUNURA, JOSE BERNARDO",ABSTENCION
NA,"PICÓN QUEDO, LUIS RAÚL",SI
PL,"PORTALATINO ÁVALOS, KELLY ROXANA",AUSENTE
AP,"PORTERO LÓPEZ, HILDA MARLENY",SI
BM,"QUIROZ BARBOZA, SEGUNDO TEODOMIRO",SI
PL,"QUISPE MAMANI, WILSON RUSBEL",NO
PL,"QUITO SARMIENTO, BERNARDO JAIME",ABSTENCION
FP,"RAMÍREZ GARCÍA, TANIA ESTEFANY",NO
FP,"REVILLA VILLANUEVA, CÉSAR MANUEL",NO
PL,"REYES CAM, ABEL AUGUSTO",AUSENTE
CD-JPP,"REYMUNDO MERCADO, EDGARD CORNELIO",SI
PL,"RIVAS CHACARA, JANET MILAGROS",SI
PL,"ROBLES ARAUJO, SILVANA EMPERATRIZ",AUSENTE
APP,"RUÍZ RODRÍGUEZ, MAGALY ROSMERY",SI
SP,"SAAVEDRA CASTERNOQUE, HITLER",LICENCIA_POR_ENFERMEDAD
APP,"SALHUANA CAVIDES, EDUARDO",SI
AP,"SOTO PALACIOS, WILSON",NO
APP,"SOTO REYES, ALEJANDRO",SI
CD-JPP,"SÁNCHEZ PALOMINO, ROBERTO HELBERT",SI
BM,"TACURI VALDIVIA, GERMÁN ADOLFO",SI
PL,"TAIPE CORONADO, MARÍA ELIZABETH",SI
BM,"TELLO MONTES, NIVARDO EDGAR",AUSENTE
APP,"TORRES SALINAS, ROSIO",SI
APP,"TRIGOZO REÁTEGUI, CHERYL",SI
AP-PIS,"TUDELA GUTIÉRREZ, ADRIANA JOSEFINA",NO
NA,"UGARTE MAMANI, JHAKELINE KATY",SI
SP,"VALER PINTO, HÉCTOR",NO
PB,"VARAS MELÉNDEZ, ELÍAS MARCIAL",SI
FP,"VENTURA ANGEL, HÉCTOR JOSÉ",SI
AP,"VERGARA MENDOZA, ELVIS HERNÁN",ABSTENCION
BM,"VÁSQUEZ VELA, LUCINDA",SI
AP-PIS,"WILLIAMS ZAPATA, JOSÉ DANIEL",SIN_RESPONDER
NA,"WONG PUJADA, ENRIQUE",AUSENTE
AP-PIS,"YARROW LUMBRERAS, NORMA MARTINA",NO
NA,"ZEA CHOQUECHAMBI, OSCAR",SI
RP,"ZEBALLOS APONTE, JORGE ARTURO",NO
PP,"ZEBALLOS MADARIAGA, CARLOS JAVIER",SI
FP,"ZETA CHUNGA, CRUZ MARÍA",AUSENTE