grupo_parlamentario,congresista,votacion
APP,"ACUÑA PERALTA, MARÍA GRIMANEZA",NO
NA,"ACUÑA PERALTA, SEGUNDO HÉCTOR",ABSTENCION
FP,"AGUINAGA RECUENCO, ALEJANDRO AURELIO",NO
PL,"AGÜERO GUTIÉRREZ, MARÍA ANTONIETA",SI
PP,"ALCARRAZ AGUERO, YOREL KIRA",LICENCIA_PERSONAL
FP,"ALEGRÍA GARCÍA, ARTURO",NO
NA,"ALVA PRIETO, MARÍA DEL CARMEN",NO
NA,"ALVA ROJAS, CARLOS ENRIQUE",LICENCIA_PERSONAL
AP-PIS,"AMURUZ DULANTO, YESSICA ROSSELLI",NO
NA,"ANDERSON RAMÍREZ, CARLOS ANTONIO",NO
AP,"ARAGÓN CARREÑO, LUIS ÁNGEL",NO
NA,"ARRIOLA TUEROS, JOSÉ ALBERTO",NO
SP,"AZURÍN LOAYZA, ALFREDO",NO
PB,"BALCÁZAR ZELADA, JOSÉ MARÍA",SI
FP,"BARBARÁN REYES, ROSANGELLA ANDREA",NO
AP-PIS,"BAZÁN CALDERÓN, DIEGO ALONSO FERNANDO",NO
CD-JPP,"BAZÁN NARRO, SIGRID TESORO",SI
PB,"BELLIDO UGARTE, GUIDO",SI
CD-JPP,"BERMEJO ROJAS, GUILLERMO",SI
NA,"BURGOS OLIVEROS, JUAN BARTOLOMÉ",AUSENTE
FP,"BUSTAMANTE DONAYRE, ERNESTO",NO
PP,"CALLE LOBATÓN, DIGNA",NO
APP,"CAMONES SORIANO, LADY MERCEDES",AUSENTE
FP,"CASTILLO RIVAS, EDUARDO ENRIQUE",NO
AP-PIS,"CAVERO ALVA, ALEJANDRO ENRIQUE",NO
PL,"CERRÓN ROJAS, WALDEMAR JOSÉ",SI
FP,"CHACÓN TRUJILLO, NILZA MERLY",AUSENTE
APP,"CHIABRA LEÓN, ROBERTO ENRIQUE",NO
AP-PIS,"CHIRINOS VENEGAS, PATRICIA ROSA",NO
RP,"CICCIA VÁSQUEZ, MIGUEL ANGEL",AUSENTE
PB,"COAYLA JUÁREZ, JORGE SAMUEL",AUSENTE
AP,"CORDERO JON TAY, LUIS GUSTAVO",ABSTENCION
NA,"CORDERO JON TAY, MARÍA DEL PILAR",SUSPENDIDO
CD-JPP,"CORTEZ AGUIRRE, ISABEL",SI
PL,"CRUZ MAMANI, FLAVIO",SI
RP,"CUETO ASERVI, JOSÉ ERNESTO",NO
NA,"CUTIPA CCAMA, VÍCTOR RAÚL",SI
AP-PIS,"CÓRDOVA LOBATÓN, MARÍA JESSICA",AUSENTE
AP,"DOROTEO CARBAJO, RAÚL FELIPE",ABSTENCION
BM,"DÁVILA ATANACIO, PASIÓN NEOMIAS",SI
RP,"ECHAÍZ DE NÚÑEZ IZAGA, GLADYS MARGOT",NO
CD-JPP,"ECHEVERRÍA RODRÍGUEZ, HAMLET",LICENCIA_PERSONAL
PP,"ELÍAS ÁVALOS, JOSÉ LUIS",AUSENTE
AP,"ESPINOZA VARGAS, JHAEC DARWIN",SI
AP,"FLORES ANCACHI, JORGE LUIS",SI
NA,"FLORES RAMÍREZ, ALEX RANDU",SI
FP,"FLORES RUÍZ, VÍCTOR SEFERINO",NO
APP,"GARCÍA CORREA, IDELSO MANUEL",NO
PL,"GONZA CASTILLO, AMERICO",SI
AP-PIS,"GONZALES DELGADO, DIANA CAROLINA",NO
BM,"GUTIÉRREZ TICONA, PAUL SILVIO",SI
APP,"HEIDINGER BALLESTEROS, NELCY",NO
RP,"HERRERA MEDINA, NOELIA ROSSVITH",AUSENTE
FP,"HUAMÁN CORONADO, RAÚL",NO
FP,"INFANTES CASTAÑEDA, MERY ELIANA",LICENCIA_OFICIAL
SP,"JERI ORÉ, JOSÉ ENRIQUE",NO
FP,"JIMÉNEZ HEREDIA, DAVID JULIO",NO
APP,"JULON IRIGOIN, ELVA EDHIT",AUSENTE
PP,"JUÁREZ CALLE, HEIDY LISBETH",NO
FP,"JUÁREZ GALLEGOS, CARMEN PATRICIA",NO
RP,"JÁUREGUI MARTÍNEZ DE AGUAYO, MARÍA DE LOS MILAGROS JACKELINE",AUSENTE
CD-JPP,"KAMICHE MORANTE, LUIS ROBERTO",LICENCIA_POR_ENFERMEDAD
CD-JPP,"LIMACHI QUISPE, NIEVES ESMERALDA",AUSENTE
FP,"LIZARZABURU LIZARZABURU, JUAN CARLOS MARTIN",AUSENTE
PP,"LUNA GÁLVEZ, JOSÉ LEÓN",AUSENTE
CD-JPP,"LUQUE IBARRA, RUTH",AUSENTE
FP,"LÓPEZ MORALES, JENY LUZ",NO
NA,"LÓPEZ UREÑA, ILICH FREDY",SI
PB,"MARTICORENA MENDOZA, JORGE ALFONSO",NO
NA,"MARTÍNEZ TALAVERA, PEDRO EDWIN",SI
BM,"MEDINA HERMOSILLA, ELIZABETH SARA",LICENCIA_POR_ENFERMEDAD
NA,"MEDINA MINAYA, ESDRAS RICARDO",NO
PL,"MITA ALANOCA, ISAAC",SI
PL,"MONTALVO CUBAS, SEGUNDO TORIBIO",AUSENTE
NA,"MONTEZA FACHO, SILVIA MARÍA",NO
RP,"MONTOYA MANRIQUE, JORGE CARLOS",NO
FP,"MORANTE FIGARI, JORGE ALBERTO",NO
NA,"MORI CELIS, JUAN CARLOS",SI
FP,"MOYANO DELGADO, MARTHA LUPE",NO
RP,"MUÑANTE BARRIOS, ALEJANDRO",NO
NA,"MÁLAGA TRILLO, GEORGE EDWARD",NO
FP,"OBANDO MORGAN, AURISTELA ANA",AUSENTE
FP,"OLIVOS MARTÍNEZ, VIVIAN",NO
NA,"PABLO MEDINA, FLOR AIDEE",LICENCIA_PERSONAL
RP,"PADILLA ROMERO, JAVIER ROMMEL",AUSENTE
PL,"PALACIOS HUÁMAN, MARGOT",AUSENTE
PP,"PAREDES CASTRO, FRANCIS JHASMINA",NO
NA,"PAREDES FONSECA, KAROL IVETT",NO
BM,"PAREDES GONZALES, ALEX ANTONIO",NO
CD-JPP,"PAREDES PIQUÉ, SUSEL ANA MARÍA",LICENCIA_OFICIAL
NA,"PARIONA SINCHE, ALFREDO",SI
SP,"PAZO NUNURA, JOSE BERNARDO",NO
PP,"PICÓN QUEDO, LUIS RAÚL",NO
PL,"PORTALATINO ÁVALOS, KELLY ROXANA",SI
AP,"PORTERO LÓPEZ, HILDA MARLENY",AUSENTE
BM,"QUIROZ BARBOZA, SEGUNDO TEODOMIRO",NO
PL,"QUISPE MAMANI, WILSON RUSBEL",AUSENTE
NA,"QUITO SARMIENTO, BERNARDO JAIME",SI
FP,"RAMÍREZ GARCÍA, TANIA ESTEFANY",NO
FP,"REVILLA VILLANUEVA, CÉSAR MANUEL",AUSENTE
PL,"REYES CAM, ABEL AUGUSTO",AUSENTE
CD-JPP,"REYMUNDO MERCADO, EDGARD CORNELIO",SI
PL,"RIVAS CHACARA, JANET MILAGROS",SI
NA,"ROBLES ARAUJO, SILVANA EMPERATRIZ",AUSENTE
FP,"ROSPIGLIOSI CAPURRO, FERNANDO MIGUEL",NO
APP,"RUÍZ RODRÍGUEZ, MAGALY ROSMERY",SIN_RESPONDER
SP,"SAAVEDRA CASTERNOQUE, HITLER",AUSENTE
APP,"SALHUANA CAVIDES, EDUARDO",AUSENTE
AP,"SOTO PALACIOS, WILSON",NO
APP,"SOTO REYES, ALEJANDRO",SIN_RESPONDER
CD-JPP,"SÁNCHEZ PALOMINO, ROBERTO HELBERT",SI
BM,"TACURI VALDIVIA, GERMÁN ADOLFO",SI
PL,"TAIPE CORONADO, MARÍA ELIZABETH",AUSENTE
BM,"TELLO MONTES, NIVARDO EDGAR",NO
APP,"TORRES SALINAS, ROSIO",NO
APP,"TRIGOZO REÁTEGUI, CHERYL",NO
AP-PIS,"TUDELA GUTIÉRREZ, ADRIANA JOSEFINA",NO
NA,"UGARTE MAMANI, JHAKELINE KATY",ABSTENCION
SP,"VALER PINTO, HÉCTOR",AUSENTE
PB,"VARAS MELÉNDEZ, ELÍAS MARCIAL",AUSENTE
FP,"VENTURA ANGEL, HÉCTOR JOSÉ",NO
AP,"VERGARA MENDOZA, ELVIS HERNÁN",AUSENTE
BM,"VÁSQUEZ VELA, LUCINDA",ABSTENCION
AP-PIS,"WILLIAMS ZAPATA, JOSÉ DANIEL",NO
PP,"WONG PUJADA, ENRIQUE",AUSENTE
AP-PIS,"YARROW LUMBRERAS, NORMA MARTINA",NO
BM,"ZEA CHOQUECHAMBI, OSCAR",ABSTENCION
RP,"ZEBALLOS APONTE, JORGE ARTURO",AUSENTE
PP,"ZEBALLOS MADARIAGA, CARLOS JAVIER",SIN_RESPONDER
FP,"ZETA CHUNGA, CRUZ MARÍA",NO
